No.     Time           Source                Destination           Protocol Length Info
      1 0.000000       host                  1.28.0                USB      36     GET DESCRIPTOR Request DEVICE

Frame 1: 36 bytes on wire (288 bits), 36 bytes captured (288 bits) on interface \\.\USBPcap1, id 0
USB URB
    [Source: host]
    [Destination: 1.28.0]
    USBPcap pseudoheader length: 28
    IRP ID: 0x0000000000000000
    IRP USBD_STATUS: USBD_STATUS_SUCCESS (0x00000000)
    URB Function: URB_FUNCTION_GET_DESCRIPTOR_FROM_DEVICE (0x000b)
    IRP information: 0x00, Direction: FDO -> PDO
        0000 000. = Reserved: 0x00
        .... ...0 = Direction: FDO -> PDO (0x0)
    URB bus id: 1
    Device address: 28
    Endpoint: 0x80, Direction: IN
        1... .... = Direction: IN (1)
        .... 0000 = Endpoint number: 0
    URB transfer type: URB_CONTROL (0x02)
    Packet Data Length: 8
    [Response in: 2]
    Control transfer stage: Setup (0)
Setup Data
    bmRequestType: 0x80
        1... .... = Direction: Device-to-host
        .00. .... = Type: Standard (0x0)
        ...0 0000 = Recipient: Device (0x00)
    bRequest: GET DESCRIPTOR (6)
    Descriptor Index: 0x00
    bDescriptorType: DEVICE (0x01)
    Language Id: no language specified (0x0000)
    wLength: 18

0000  1c 00 00 00 00 00 00 00 00 00 00 00 00 00 0b 00   ................
0010  00 01 00 1c 00 80 02 08 00 00 00 00 80 06 00 01   ................
0020  00 00 12 00                                       ....

No.     Time           Source                Destination           Protocol Length Info
      2 0.000000       1.28.0                host                  USB      46     GET DESCRIPTOR Response DEVICE

Frame 2: 46 bytes on wire (368 bits), 46 bytes captured (368 bits) on interface \\.\USBPcap1, id 0
USB URB
    [Source: 1.28.0]
    [Destination: host]
    USBPcap pseudoheader length: 28
    IRP ID: 0x0000000000000000
    IRP USBD_STATUS: USBD_STATUS_SUCCESS (0x00000000)
    URB Function: URB_FUNCTION_CONTROL_TRANSFER (0x0008)
    IRP information: 0x01, Direction: PDO -> FDO
        0000 000. = Reserved: 0x00
        .... ...1 = Direction: PDO -> FDO (0x1)
    URB bus id: 1
    Device address: 28
    Endpoint: 0x80, Direction: IN
        1... .... = Direction: IN (1)
        .... 0000 = Endpoint number: 0
    URB transfer type: URB_CONTROL (0x02)
    Packet Data Length: 18
    [Request in: 1]
    [Time from request: 0.000000000 seconds]
    Control transfer stage: Complete (3)
DEVICE DESCRIPTOR
    bLength: 18
    bDescriptorType: 0x01 (DEVICE)
    bcdUSB: 0x0200
    bDeviceClass: Device (0x00)
    bDeviceSubClass: 0
    bDeviceProtocol: 0 (Use class code info from Interface Descriptors)
    bMaxPacketSize0: 64
    idVendor: Cooler Master Co., Ltd. (0x2516)
    idProduct: Unknown (0x012d)
    bcdDevice: 0x0720
    iManufacturer: 3
    iProduct: 1
    iSerialNumber: 0
    bNumConfigurations: 1

0000  1c 00 00 00 00 00 00 00 00 00 00 00 00 00 08 00   ................
0010  01 01 00 1c 00 80 02 12 00 00 00 03 12 01 00 02   ................
0020  00 00 00 40 16 25 2d 01 20 07 03 01 00 01         ...@.%-. .....

No.     Time           Source                Destination           Protocol Length Info
      3 0.000000       host                  1.28.0                USB      36     GET DESCRIPTOR Request CONFIGURATION

Frame 3: 36 bytes on wire (288 bits), 36 bytes captured (288 bits) on interface \\.\USBPcap1, id 0
USB URB
    [Source: host]
    [Destination: 1.28.0]
    USBPcap pseudoheader length: 28
    IRP ID: 0x0000000000000000
    IRP USBD_STATUS: USBD_STATUS_SUCCESS (0x00000000)
    URB Function: URB_FUNCTION_GET_DESCRIPTOR_FROM_DEVICE (0x000b)
    IRP information: 0x00, Direction: FDO -> PDO
        0000 000. = Reserved: 0x00
        .... ...0 = Direction: FDO -> PDO (0x0)
    URB bus id: 1
    Device address: 28
    Endpoint: 0x80, Direction: IN
        1... .... = Direction: IN (1)
        .... 0000 = Endpoint number: 0
    URB transfer type: URB_CONTROL (0x02)
    Packet Data Length: 8
    [Response in: 4]
    Control transfer stage: Setup (0)
Setup Data
    bmRequestType: 0x80
        1... .... = Direction: Device-to-host
        .00. .... = Type: Standard (0x0)
        ...0 0000 = Recipient: Device (0x00)
    bRequest: GET DESCRIPTOR (6)
    Descriptor Index: 0x00
    bDescriptorType: CONFIGURATION (0x02)
    Language Id: no language specified (0x0000)
    wLength: 91

0000  1c 00 00 00 00 00 00 00 00 00 00 00 00 00 0b 00   ................
0010  00 01 00 1c 00 80 02 08 00 00 00 00 80 06 00 02   ................
0020  00 00 5b 00                                       ..[.

No.     Time           Source                Destination           Protocol Length Info
      4 0.000000       1.28.0                host                  USB      119    GET DESCRIPTOR Response CONFIGURATION

Frame 4: 119 bytes on wire (952 bits), 119 bytes captured (952 bits) on interface \\.\USBPcap1, id 0
USB URB
    [Source: 1.28.0]
    [Destination: host]
    USBPcap pseudoheader length: 28
    IRP ID: 0x0000000000000000
    IRP USBD_STATUS: USBD_STATUS_SUCCESS (0x00000000)
    URB Function: URB_FUNCTION_CONTROL_TRANSFER (0x0008)
    IRP information: 0x01, Direction: PDO -> FDO
        0000 000. = Reserved: 0x00
        .... ...1 = Direction: PDO -> FDO (0x1)
    URB bus id: 1
    Device address: 28
    Endpoint: 0x80, Direction: IN
        1... .... = Direction: IN (1)
        .... 0000 = Endpoint number: 0
    URB transfer type: URB_CONTROL (0x02)
    Packet Data Length: 91
    [Request in: 3]
    [Time from request: 0.000000000 seconds]
    Control transfer stage: Complete (3)
CONFIGURATION DESCRIPTOR
    bLength: 9
    bDescriptorType: 0x02 (CONFIGURATION)
    wTotalLength: 91
    bNumInterfaces: 3
    bConfigurationValue: 1
    iConfiguration: 0
    Configuration bmAttributes: 0xa0  NOT SELF-POWERED  REMOTE-WAKEUP
    bMaxPower: 50  (100mA)
INTERFACE DESCRIPTOR (0.0): class HID
    bLength: 9
    bDescriptorType: 0x04 (INTERFACE)
    bInterfaceNumber: 0
    bAlternateSetting: 0
    bNumEndpoints: 1
    bInterfaceClass: HID (0x03)
    bInterfaceSubClass: Boot Interface (0x01)
    bInterfaceProtocol: Keyboard (0x01)
    iInterface: 0
HID DESCRIPTOR
ENDPOINT DESCRIPTOR
    bLength: 7
    bDescriptorType: 0x05 (ENDPOINT)
    bEndpointAddress: 0x81  IN  Endpoint:1
    bmAttributes: 0x03
    wMaxPacketSize: 8
    bInterval: 1
INTERFACE DESCRIPTOR (1.0): class HID
    bLength: 9
    bDescriptorType: 0x04 (INTERFACE)
    bInterfaceNumber: 1
    bAlternateSetting: 0
    bNumEndpoints: 2
    bInterfaceClass: HID (0x03)
    bInterfaceSubClass: No Subclass (0x00)
    bInterfaceProtocol: 0x00
    iInterface: 2
HID DESCRIPTOR
ENDPOINT DESCRIPTOR
    bLength: 7
    bDescriptorType: 0x05 (ENDPOINT)
    bEndpointAddress: 0x83  IN  Endpoint:3
    bmAttributes: 0x03
    wMaxPacketSize: 64
    bInterval: 1
ENDPOINT DESCRIPTOR
    bLength: 7
    bDescriptorType: 0x05 (ENDPOINT)
    bEndpointAddress: 0x04  OUT  Endpoint:4
    bmAttributes: 0x03
    wMaxPacketSize: 64
    bInterval: 1
INTERFACE DESCRIPTOR (2.0): class HID
    bLength: 9
    bDescriptorType: 0x04 (INTERFACE)
    bInterfaceNumber: 2
    bAlternateSetting: 0
    bNumEndpoints: 1
    bInterfaceClass: HID (0x03)
    bInterfaceSubClass: No Subclass (0x00)
    bInterfaceProtocol: 0x00
    iInterface: 0
HID DESCRIPTOR
ENDPOINT DESCRIPTOR
    bLength: 7
    bDescriptorType: 0x05 (ENDPOINT)
    bEndpointAddress: 0x82  IN  Endpoint:2
    bmAttributes: 0x03
    wMaxPacketSize: 64
    bInterval: 1

0000  1c 00 00 00 00 00 00 00 00 00 00 00 00 00 08 00   ................
0010  01 01 00 1c 00 80 02 5b 00 00 00 03 09 02 5b 00   .......[......[.
0020  03 01 00 a0 32 09 04 00 00 01 03 01 01 00 09 21   ....2..........!
0030  11 01 00 01 22 40 00 07 05 81 03 08 00 01 09 04   ...."@..........
0040  01 00 02 03 00 00 02 09 21 11 01 00 01 22 22 00   ........!...."".
0050  07 05 83 03 40 00 01 07 05 04 03 40 00 01 09 04   ....@......@....
0060  02 00 01 03 00 00 00 09 21 11 01 00 01 22 cb 00   ........!...."..
0070  07 05 82 03 40 00 01                              ....@..

No.     Time           Source                Destination           Protocol Length Info
      5 0.000000       host                  1.28.0                USB      36     SET CONFIGURATION Request

Frame 5: 36 bytes on wire (288 bits), 36 bytes captured (288 bits) on interface \\.\USBPcap1, id 0
USB URB
    [Source: host]
    [Destination: 1.28.0]
    USBPcap pseudoheader length: 28
    IRP ID: 0x0000000000000000
    IRP USBD_STATUS: USBD_STATUS_SUCCESS (0x00000000)
    URB Function: URB_FUNCTION_SELECT_CONFIGURATION (0x0000)
    IRP information: 0x00, Direction: FDO -> PDO
        0000 000. = Reserved: 0x00
        .... ...0 = Direction: FDO -> PDO (0x0)
    URB bus id: 1
    Device address: 28
    Endpoint: 0x00, Direction: OUT
        0... .... = Direction: OUT (0)
        .... 0000 = Endpoint number: 0
    URB transfer type: URB_CONTROL (0x02)
    Packet Data Length: 8
    [Response in: 6]
    Control transfer stage: Setup (0)
Setup Data
    bmRequestType: 0x00
        0... .... = Direction: Host-to-device
        .00. .... = Type: Standard (0x0)
        ...0 0000 = Recipient: Device (0x00)
    bRequest: SET CONFIGURATION (9)
    bConfigurationValue: 1
    wIndex: 0 (0x0000)
    wLength: 0

0000  1c 00 00 00 00 00 00 00 00 00 00 00 00 00 00 00   ................
0010  00 01 00 1c 00 00 02 08 00 00 00 00 00 09 01 00   ................
0020  00 00 00 00                                       ....

No.     Time           Source                Destination           Protocol Length Info
      6 0.000000       1.28.0                host                  USB      28     SET CONFIGURATION Response

Frame 6: 28 bytes on wire (224 bits), 28 bytes captured (224 bits) on interface \\.\USBPcap1, id 0
USB URB
    [Source: 1.28.0]
    [Destination: host]
    USBPcap pseudoheader length: 28
    IRP ID: 0x0000000000000000
    IRP USBD_STATUS: USBD_STATUS_SUCCESS (0x00000000)
    URB Function: URB_FUNCTION_SELECT_CONFIGURATION (0x0000)
    IRP information: 0x01, Direction: PDO -> FDO
        0000 000. = Reserved: 0x00
        .... ...1 = Direction: PDO -> FDO (0x1)
    URB bus id: 1
    Device address: 28
    Endpoint: 0x00, Direction: OUT
        0... .... = Direction: OUT (0)
        .... 0000 = Endpoint number: 0
    URB transfer type: URB_CONTROL (0x02)
    Packet Data Length: 0
    [Request in: 5]
    [Time from request: 0.000000000 seconds]
    Control transfer stage: Complete (3)

0000  1c 00 00 00 00 00 00 00 00 00 00 00 00 00 00 00   ................
0010  01 01 00 1c 00 00 02 00 00 00 00 03               ............

No.     Time           Source                Destination           Protocol Length Info
      7 0.000000       host                  1.2.0                 USB      36     GET DESCRIPTOR Request DEVICE

Frame 7: 36 bytes on wire (288 bits), 36 bytes captured (288 bits) on interface \\.\USBPcap1, id 0
USB URB
    [Source: host]
    [Destination: 1.2.0]
    USBPcap pseudoheader length: 28
    IRP ID: 0x0000000000000000
    IRP USBD_STATUS: USBD_STATUS_SUCCESS (0x00000000)
    URB Function: URB_FUNCTION_GET_DESCRIPTOR_FROM_DEVICE (0x000b)
    IRP information: 0x00, Direction: FDO -> PDO
        0000 000. = Reserved: 0x00
        .... ...0 = Direction: FDO -> PDO (0x0)
    URB bus id: 1
    Device address: 2
    Endpoint: 0x80, Direction: IN
        1... .... = Direction: IN (1)
        .... 0000 = Endpoint number: 0
    URB transfer type: URB_CONTROL (0x02)
    Packet Data Length: 8
    [Response in: 8]
    Control transfer stage: Setup (0)
Setup Data
    bmRequestType: 0x80
        1... .... = Direction: Device-to-host
        .00. .... = Type: Standard (0x0)
        ...0 0000 = Recipient: Device (0x00)
    bRequest: GET DESCRIPTOR (6)
    Descriptor Index: 0x00
    bDescriptorType: DEVICE (0x01)
    Language Id: no language specified (0x0000)
    wLength: 18

0000  1c 00 00 00 00 00 00 00 00 00 00 00 00 00 0b 00   ................
0010  00 01 00 02 00 80 02 08 00 00 00 00 80 06 00 01   ................
0020  00 00 12 00                                       ....

No.     Time           Source                Destination           Protocol Length Info
      8 0.000000       1.2.0                 host                  USB      46     GET DESCRIPTOR Response DEVICE

Frame 8: 46 bytes on wire (368 bits), 46 bytes captured (368 bits) on interface \\.\USBPcap1, id 0
USB URB
    [Source: 1.2.0]
    [Destination: host]
    USBPcap pseudoheader length: 28
    IRP ID: 0x0000000000000000
    IRP USBD_STATUS: USBD_STATUS_SUCCESS (0x00000000)
    URB Function: URB_FUNCTION_CONTROL_TRANSFER (0x0008)
    IRP information: 0x01, Direction: PDO -> FDO
        0000 000. = Reserved: 0x00
        .... ...1 = Direction: PDO -> FDO (0x1)
    URB bus id: 1
    Device address: 2
    Endpoint: 0x80, Direction: IN
        1... .... = Direction: IN (1)
        .... 0000 = Endpoint number: 0
    URB transfer type: URB_CONTROL (0x02)
    Packet Data Length: 18
    [Request in: 7]
    [Time from request: 0.000000000 seconds]
    Control transfer stage: Complete (3)
DEVICE DESCRIPTOR
    bLength: 18
    bDescriptorType: 0x01 (DEVICE)
    bcdUSB: 0x0200
    bDeviceClass: Hub (0x09)
    bDeviceSubClass: 0
    bDeviceProtocol: 1 (Hi-speed hub with single TT)
    bMaxPacketSize0: 64
    idVendor: Apple, Inc. (0x05ac)
    idProduct: Unknown (0x1005)
    bcdDevice: 0x9615
    iManufacturer: 1
    iProduct: 2
    iSerialNumber: 3
    bNumConfigurations: 1

0000  1c 00 00 00 00 00 00 00 00 00 00 00 00 00 08 00   ................
0010  01 01 00 02 00 80 02 12 00 00 00 03 12 01 00 02   ................
0020  09 00 01 40 ac 05 05 10 15 96 01 02 03 01         ...@..........

No.     Time           Source                Destination           Protocol Length Info
      9 0.000000       host                  1.2.0                 USB      36     GET DESCRIPTOR Request CONFIGURATION

Frame 9: 36 bytes on wire (288 bits), 36 bytes captured (288 bits) on interface \\.\USBPcap1, id 0
USB URB
    [Source: host]
    [Destination: 1.2.0]
    USBPcap pseudoheader length: 28
    IRP ID: 0x0000000000000000
    IRP USBD_STATUS: USBD_STATUS_SUCCESS (0x00000000)
    URB Function: URB_FUNCTION_GET_DESCRIPTOR_FROM_DEVICE (0x000b)
    IRP information: 0x00, Direction: FDO -> PDO
        0000 000. = Reserved: 0x00
        .... ...0 = Direction: FDO -> PDO (0x0)
    URB bus id: 1
    Device address: 2
    Endpoint: 0x80, Direction: IN
        1... .... = Direction: IN (1)
        .... 0000 = Endpoint number: 0
    URB transfer type: URB_CONTROL (0x02)
    Packet Data Length: 8
    [Response in: 10]
    Control transfer stage: Setup (0)
Setup Data
    bmRequestType: 0x80
        1... .... = Direction: Device-to-host
        .00. .... = Type: Standard (0x0)
        ...0 0000 = Recipient: Device (0x00)
    bRequest: GET DESCRIPTOR (6)
    Descriptor Index: 0x00
    bDescriptorType: CONFIGURATION (0x02)
    Language Id: no language specified (0x0000)
    wLength: 25

0000  1c 00 00 00 00 00 00 00 00 00 00 00 00 00 0b 00   ................
0010  00 01 00 02 00 80 02 08 00 00 00 00 80 06 00 02   ................
0020  00 00 19 00                                       ....

No.     Time           Source                Destination           Protocol Length Info
     10 0.000000       1.2.0                 host                  USB      53     GET DESCRIPTOR Response CONFIGURATION

Frame 10: 53 bytes on wire (424 bits), 53 bytes captured (424 bits) on interface \\.\USBPcap1, id 0
USB URB
    [Source: 1.2.0]
    [Destination: host]
    USBPcap pseudoheader length: 28
    IRP ID: 0x0000000000000000
    IRP USBD_STATUS: USBD_STATUS_SUCCESS (0x00000000)
    URB Function: URB_FUNCTION_CONTROL_TRANSFER (0x0008)
    IRP information: 0x01, Direction: PDO -> FDO
        0000 000. = Reserved: 0x00
        .... ...1 = Direction: PDO -> FDO (0x1)
    URB bus id: 1
    Device address: 2
    Endpoint: 0x80, Direction: IN
        1... .... = Direction: IN (1)
        .... 0000 = Endpoint number: 0
    URB transfer type: URB_CONTROL (0x02)
    Packet Data Length: 25
    [Request in: 9]
    [Time from request: 0.000000000 seconds]
    Control transfer stage: Complete (3)
CONFIGURATION DESCRIPTOR
    bLength: 9
    bDescriptorType: 0x02 (CONFIGURATION)
    wTotalLength: 25
    bNumInterfaces: 1
    bConfigurationValue: 1
    iConfiguration: 0
    Configuration bmAttributes: 0xa0  NOT SELF-POWERED  REMOTE-WAKEUP
    bMaxPower: 150  (300mA)
INTERFACE DESCRIPTOR (0.0): class Hub
    bLength: 9
    bDescriptorType: 0x04 (INTERFACE)
    bInterfaceNumber: 0
    bAlternateSetting: 0
    bNumEndpoints: 1
    bInterfaceClass: Hub (0x09)
    bInterfaceSubClass: 0x00
    bInterfaceProtocol: 0x00
    iInterface: 0
ENDPOINT DESCRIPTOR
    bLength: 7
    bDescriptorType: 0x05 (ENDPOINT)
    bEndpointAddress: 0x81  IN  Endpoint:1
    bmAttributes: 0x03
    wMaxPacketSize: 1
    bInterval: 12

0000  1c 00 00 00 00 00 00 00 00 00 00 00 00 00 08 00   ................
0010  01 01 00 02 00 80 02 19 00 00 00 03 09 02 19 00   ................
0020  01 01 00 a0 96 09 04 00 00 01 09 00 00 00 07 05   ................
0030  81 03 01 00 0c                                    .....

No.     Time           Source                Destination           Protocol Length Info
     11 0.000000       host                  1.2.0                 USB      36     SET CONFIGURATION Request

Frame 11: 36 bytes on wire (288 bits), 36 bytes captured (288 bits) on interface \\.\USBPcap1, id 0
USB URB
    [Source: host]
    [Destination: 1.2.0]
    USBPcap pseudoheader length: 28
    IRP ID: 0x0000000000000000
    IRP USBD_STATUS: USBD_STATUS_SUCCESS (0x00000000)
    URB Function: URB_FUNCTION_SELECT_CONFIGURATION (0x0000)
    IRP information: 0x00, Direction: FDO -> PDO
        0000 000. = Reserved: 0x00
        .... ...0 = Direction: FDO -> PDO (0x0)
    URB bus id: 1
    Device address: 2
    Endpoint: 0x00, Direction: OUT
        0... .... = Direction: OUT (0)
        .... 0000 = Endpoint number: 0
    URB transfer type: URB_CONTROL (0x02)
    Packet Data Length: 8
    [Response in: 12]
    Control transfer stage: Setup (0)
Setup Data
    bmRequestType: 0x00
        0... .... = Direction: Host-to-device
        .00. .... = Type: Standard (0x0)
        ...0 0000 = Recipient: Device (0x00)
    bRequest: SET CONFIGURATION (9)
    bConfigurationValue: 1
    wIndex: 0 (0x0000)
    wLength: 0

0000  1c 00 00 00 00 00 00 00 00 00 00 00 00 00 00 00   ................
0010  00 01 00 02 00 00 02 08 00 00 00 00 00 09 01 00   ................
0020  00 00 00 00                                       ....

No.     Time           Source                Destination           Protocol Length Info
     12 0.000000       1.2.0                 host                  USB      28     SET CONFIGURATION Response

Frame 12: 28 bytes on wire (224 bits), 28 bytes captured (224 bits) on interface \\.\USBPcap1, id 0
USB URB
    [Source: 1.2.0]
    [Destination: host]
    USBPcap pseudoheader length: 28
    IRP ID: 0x0000000000000000
    IRP USBD_STATUS: USBD_STATUS_SUCCESS (0x00000000)
    URB Function: URB_FUNCTION_SELECT_CONFIGURATION (0x0000)
    IRP information: 0x01, Direction: PDO -> FDO
        0000 000. = Reserved: 0x00
        .... ...1 = Direction: PDO -> FDO (0x1)
    URB bus id: 1
    Device address: 2
    Endpoint: 0x00, Direction: OUT
        0... .... = Direction: OUT (0)
        .... 0000 = Endpoint number: 0
    URB transfer type: URB_CONTROL (0x02)
    Packet Data Length: 0
    [Request in: 11]
    [Time from request: 0.000000000 seconds]
    Control transfer stage: Complete (3)

0000  1c 00 00 00 00 00 00 00 00 00 00 00 00 00 00 00   ................
0010  01 01 00 02 00 00 02 00 00 00 00 03               ............

No.     Time           Source                Destination           Protocol Length Info
     13 0.000000       host                  1.4.0                 USB      36     GET DESCRIPTOR Request DEVICE

Frame 13: 36 bytes on wire (288 bits), 36 bytes captured (288 bits) on interface \\.\USBPcap1, id 0
USB URB
    [Source: host]
    [Destination: 1.4.0]
    USBPcap pseudoheader length: 28
    IRP ID: 0x0000000000000000
    IRP USBD_STATUS: USBD_STATUS_SUCCESS (0x00000000)
    URB Function: URB_FUNCTION_GET_DESCRIPTOR_FROM_DEVICE (0x000b)
    IRP information: 0x00, Direction: FDO -> PDO
        0000 000. = Reserved: 0x00
        .... ...0 = Direction: FDO -> PDO (0x0)
    URB bus id: 1
    Device address: 4
    Endpoint: 0x80, Direction: IN
        1... .... = Direction: IN (1)
        .... 0000 = Endpoint number: 0
    URB transfer type: URB_CONTROL (0x02)
    Packet Data Length: 8
    [Response in: 14]
    Control transfer stage: Setup (0)
Setup Data
    bmRequestType: 0x80
        1... .... = Direction: Device-to-host
        .00. .... = Type: Standard (0x0)
        ...0 0000 = Recipient: Device (0x00)
    bRequest: GET DESCRIPTOR (6)
    Descriptor Index: 0x00
    bDescriptorType: DEVICE (0x01)
    Language Id: no language specified (0x0000)
    wLength: 18

0000  1c 00 00 00 00 00 00 00 00 00 00 00 00 00 0b 00   ................
0010  00 01 00 04 00 80 02 08 00 00 00 00 80 06 00 01   ................
0020  00 00 12 00                                       ....

No.     Time           Source                Destination           Protocol Length Info
     14 0.000000       1.4.0                 host                  USB      46     GET DESCRIPTOR Response DEVICE

Frame 14: 46 bytes on wire (368 bits), 46 bytes captured (368 bits) on interface \\.\USBPcap1, id 0
USB URB
    [Source: 1.4.0]
    [Destination: host]
    USBPcap pseudoheader length: 28
    IRP ID: 0x0000000000000000
    IRP USBD_STATUS: USBD_STATUS_SUCCESS (0x00000000)
    URB Function: URB_FUNCTION_CONTROL_TRANSFER (0x0008)
    IRP information: 0x01, Direction: PDO -> FDO
        0000 000. = Reserved: 0x00
        .... ...1 = Direction: PDO -> FDO (0x1)
    URB bus id: 1
    Device address: 4
    Endpoint: 0x80, Direction: IN
        1... .... = Direction: IN (1)
        .... 0000 = Endpoint number: 0
    URB transfer type: URB_CONTROL (0x02)
    Packet Data Length: 18
    [Request in: 13]
    [Time from request: 0.000000000 seconds]
    Control transfer stage: Complete (3)
DEVICE DESCRIPTOR
    bLength: 18
    bDescriptorType: 0x01 (DEVICE)
    bcdUSB: 0x0200
    bDeviceClass: Device (0x00)
    bDeviceSubClass: 0
    bDeviceProtocol: 0 (Use class code info from Interface Descriptors)
    bMaxPacketSize0: 8
    idVendor: Apple, Inc. (0x05ac)
    idProduct: Aluminum Mini Keyboard (ISO) (0x021e)
    bcdDevice: 0x0070
    iManufacturer: 1
    iProduct: 2
    iSerialNumber: 0
    bNumConfigurations: 1

0000  1c 00 00 00 00 00 00 00 00 00 00 00 00 00 08 00   ................
0010  01 01 00 04 00 80 02 12 00 00 00 03 12 01 00 02   ................
0020  00 00 00 08 ac 05 1e 02 70 00 01 02 00 01         ........p.....

No.     Time           Source                Destination           Protocol Length Info
     15 0.000000       host                  1.4.0                 USB      36     GET DESCRIPTOR Request CONFIGURATION

Frame 15: 36 bytes on wire (288 bits), 36 bytes captured (288 bits) on interface \\.\USBPcap1, id 0
USB URB
    [Source: host]
    [Destination: 1.4.0]
    USBPcap pseudoheader length: 28
    IRP ID: 0x0000000000000000
    IRP USBD_STATUS: USBD_STATUS_SUCCESS (0x00000000)
    URB Function: URB_FUNCTION_GET_DESCRIPTOR_FROM_DEVICE (0x000b)
    IRP information: 0x00, Direction: FDO -> PDO
        0000 000. = Reserved: 0x00
        .... ...0 = Direction: FDO -> PDO (0x0)
    URB bus id: 1
    Device address: 4
    Endpoint: 0x80, Direction: IN
        1... .... = Direction: IN (1)
        .... 0000 = Endpoint number: 0
    URB transfer type: URB_CONTROL (0x02)
    Packet Data Length: 8
    [Response in: 16]
    Control transfer stage: Setup (0)
Setup Data
    bmRequestType: 0x80
        1... .... = Direction: Device-to-host
        .00. .... = Type: Standard (0x0)
        ...0 0000 = Recipient: Device (0x00)
    bRequest: GET DESCRIPTOR (6)
    Descriptor Index: 0x00
    bDescriptorType: CONFIGURATION (0x02)
    Language Id: no language specified (0x0000)
    wLength: 59

0000  1c 00 00 00 00 00 00 00 00 00 00 00 00 00 0b 00   ................
0010  00 01 00 04 00 80 02 08 00 00 00 00 80 06 00 02   ................
0020  00 00 3b 00                                       ..;.

No.     Time           Source                Destination           Protocol Length Info
     16 0.000000       1.4.0                 host                  USB      87     GET DESCRIPTOR Response CONFIGURATION

Frame 16: 87 bytes on wire (696 bits), 87 bytes captured (696 bits) on interface \\.\USBPcap1, id 0
USB URB
    [Source: 1.4.0]
    [Destination: host]
    USBPcap pseudoheader length: 28
    IRP ID: 0x0000000000000000
    IRP USBD_STATUS: USBD_STATUS_SUCCESS (0x00000000)
    URB Function: URB_FUNCTION_CONTROL_TRANSFER (0x0008)
    IRP information: 0x01, Direction: PDO -> FDO
        0000 000. = Reserved: 0x00
        .... ...1 = Direction: PDO -> FDO (0x1)
    URB bus id: 1
    Device address: 4
    Endpoint: 0x80, Direction: IN
        1... .... = Direction: IN (1)
        .... 0000 = Endpoint number: 0
    URB transfer type: URB_CONTROL (0x02)
    Packet Data Length: 59
    [Request in: 15]
    [Time from request: 0.000000000 seconds]
    Control transfer stage: Complete (3)
CONFIGURATION DESCRIPTOR
    bLength: 9
    bDescriptorType: 0x02 (CONFIGURATION)
    wTotalLength: 59
    bNumInterfaces: 2
    bConfigurationValue: 1
    iConfiguration: 0
    Configuration bmAttributes: 0xa0  NOT SELF-POWERED  REMOTE-WAKEUP
    bMaxPower: 10  (20mA)
INTERFACE DESCRIPTOR (0.0): class HID
    bLength: 9
    bDescriptorType: 0x04 (INTERFACE)
    bInterfaceNumber: 0
    bAlternateSetting: 0
    bNumEndpoints: 1
    bInterfaceClass: HID (0x03)
    bInterfaceSubClass: Boot Interface (0x01)
    bInterfaceProtocol: Keyboard (0x01)
    iInterface: 0
HID DESCRIPTOR
ENDPOINT DESCRIPTOR
    bLength: 7
    bDescriptorType: 0x05 (ENDPOINT)
    bEndpointAddress: 0x81  IN  Endpoint:1
    bmAttributes: 0x03
    wMaxPacketSize: 8
    bInterval: 10
INTERFACE DESCRIPTOR (1.0): class HID
    bLength: 9
    bDescriptorType: 0x04 (INTERFACE)
    bInterfaceNumber: 1
    bAlternateSetting: 0
    bNumEndpoints: 1
    bInterfaceClass: HID (0x03)
    bInterfaceSubClass: No Subclass (0x00)
    bInterfaceProtocol: 0x00
    iInterface: 0
HID DESCRIPTOR
ENDPOINT DESCRIPTOR
    bLength: 7
    bDescriptorType: 0x05 (ENDPOINT)
    bEndpointAddress: 0x82  IN  Endpoint:2
    bmAttributes: 0x03
    wMaxPacketSize: 1
    bInterval: 10

0000  1c 00 00 00 00 00 00 00 00 00 00 00 00 00 08 00   ................
0010  01 01 00 04 00 80 02 3b 00 00 00 03 09 02 3b 00   .......;......;.
0020  02 01 00 a0 0a 09 04 00 00 01 03 01 01 00 09 21   ...............!
0030  11 01 0d 01 22 4b 00 07 05 81 03 08 00 0a 09 04   ...."K..........
0040  01 00 01 03 00 00 00 09 21 11 01 00 01 22 2f 00   ........!...."/.
0050  07 05 82 03 01 00 0a                              .......

No.     Time           Source                Destination           Protocol Length Info
     17 0.000000       host                  1.4.0                 USB      36     SET CONFIGURATION Request

Frame 17: 36 bytes on wire (288 bits), 36 bytes captured (288 bits) on interface \\.\USBPcap1, id 0
USB URB
    [Source: host]
    [Destination: 1.4.0]
    USBPcap pseudoheader length: 28
    IRP ID: 0x0000000000000000
    IRP USBD_STATUS: USBD_STATUS_SUCCESS (0x00000000)
    URB Function: URB_FUNCTION_SELECT_CONFIGURATION (0x0000)
    IRP information: 0x00, Direction: FDO -> PDO
        0000 000. = Reserved: 0x00
        .... ...0 = Direction: FDO -> PDO (0x0)
    URB bus id: 1
    Device address: 4
    Endpoint: 0x00, Direction: OUT
        0... .... = Direction: OUT (0)
        .... 0000 = Endpoint number: 0
    URB transfer type: URB_CONTROL (0x02)
    Packet Data Length: 8
    [Response in: 18]
    Control transfer stage: Setup (0)
Setup Data
    bmRequestType: 0x00
        0... .... = Direction: Host-to-device
        .00. .... = Type: Standard (0x0)
        ...0 0000 = Recipient: Device (0x00)
    bRequest: SET CONFIGURATION (9)
    bConfigurationValue: 1
    wIndex: 0 (0x0000)
    wLength: 0

0000  1c 00 00 00 00 00 00 00 00 00 00 00 00 00 00 00   ................
0010  00 01 00 04 00 00 02 08 00 00 00 00 00 09 01 00   ................
0020  00 00 00 00                                       ....

No.     Time           Source                Destination           Protocol Length Info
     18 0.000000       1.4.0                 host                  USB      28     SET CONFIGURATION Response

Frame 18: 28 bytes on wire (224 bits), 28 bytes captured (224 bits) on interface \\.\USBPcap1, id 0
USB URB
    [Source: 1.4.0]
    [Destination: host]
    USBPcap pseudoheader length: 28
    IRP ID: 0x0000000000000000
    IRP USBD_STATUS: USBD_STATUS_SUCCESS (0x00000000)
    URB Function: URB_FUNCTION_SELECT_CONFIGURATION (0x0000)
    IRP information: 0x01, Direction: PDO -> FDO
        0000 000. = Reserved: 0x00
        .... ...1 = Direction: PDO -> FDO (0x1)
    URB bus id: 1
    Device address: 4
    Endpoint: 0x00, Direction: OUT
        0... .... = Direction: OUT (0)
        .... 0000 = Endpoint number: 0
    URB transfer type: URB_CONTROL (0x02)
    Packet Data Length: 0
    [Request in: 17]
    [Time from request: 0.000000000 seconds]
    Control transfer stage: Complete (3)

0000  1c 00 00 00 00 00 00 00 00 00 00 00 00 00 00 00   ................
0010  01 01 00 04 00 00 02 00 00 00 00 03               ............

No.     Time           Source                Destination           Protocol Length Info
     19 0.000000       host                  1.3.0                 USB      36     GET DESCRIPTOR Request DEVICE

Frame 19: 36 bytes on wire (288 bits), 36 bytes captured (288 bits) on interface \\.\USBPcap1, id 0
USB URB
    [Source: host]
    [Destination: 1.3.0]
    USBPcap pseudoheader length: 28
    IRP ID: 0x0000000000000000
    IRP USBD_STATUS: USBD_STATUS_SUCCESS (0x00000000)
    URB Function: URB_FUNCTION_GET_DESCRIPTOR_FROM_DEVICE (0x000b)
    IRP information: 0x00, Direction: FDO -> PDO
        0000 000. = Reserved: 0x00
        .... ...0 = Direction: FDO -> PDO (0x0)
    URB bus id: 1
    Device address: 3
    Endpoint: 0x80, Direction: IN
        1... .... = Direction: IN (1)
        .... 0000 = Endpoint number: 0
    URB transfer type: URB_CONTROL (0x02)
    Packet Data Length: 8
    [Response in: 20]
    Control transfer stage: Setup (0)
Setup Data
    bmRequestType: 0x80
        1... .... = Direction: Device-to-host
        .00. .... = Type: Standard (0x0)
        ...0 0000 = Recipient: Device (0x00)
    bRequest: GET DESCRIPTOR (6)
    Descriptor Index: 0x00
    bDescriptorType: DEVICE (0x01)
    Language Id: no language specified (0x0000)
    wLength: 18

0000  1c 00 00 00 00 00 00 00 00 00 00 00 00 00 0b 00   ................
0010  00 01 00 03 00 80 02 08 00 00 00 00 80 06 00 01   ................
0020  00 00 12 00                                       ....

No.     Time           Source                Destination           Protocol Length Info
     20 0.000000       1.3.0                 host                  USB      46     GET DESCRIPTOR Response DEVICE

Frame 20: 46 bytes on wire (368 bits), 46 bytes captured (368 bits) on interface \\.\USBPcap1, id 0
USB URB
    [Source: 1.3.0]
    [Destination: host]
    USBPcap pseudoheader length: 28
    IRP ID: 0x0000000000000000
    IRP USBD_STATUS: USBD_STATUS_SUCCESS (0x00000000)
    URB Function: URB_FUNCTION_CONTROL_TRANSFER (0x0008)
    IRP information: 0x01, Direction: PDO -> FDO
        0000 000. = Reserved: 0x00
        .... ...1 = Direction: PDO -> FDO (0x1)
    URB bus id: 1
    Device address: 3
    Endpoint: 0x80, Direction: IN
        1... .... = Direction: IN (1)
        .... 0000 = Endpoint number: 0
    URB transfer type: URB_CONTROL (0x02)
    Packet Data Length: 18
    [Request in: 19]
    [Time from request: 0.000000000 seconds]
    Control transfer stage: Complete (3)
DEVICE DESCRIPTOR
    bLength: 18
    bDescriptorType: 0x01 (DEVICE)
    bcdUSB: 0x0200
    bDeviceClass: Device (0x00)
    bDeviceSubClass: 0
    bDeviceProtocol: 0 (Use class code info from Interface Descriptors)
    bMaxPacketSize0: 64
    idVendor: Corsair (0x1b1c)
    idProduct: Unknown (0x1b05)
    bcdDevice: 0x0212
    iManufacturer: 1
    iProduct: 2
    iSerialNumber: 0
    bNumConfigurations: 1

0000  1c 00 00 00 00 00 00 00 00 00 00 00 00 00 08 00   ................
0010  01 01 00 03 00 80 02 12 00 00 00 03 12 01 00 02   ................
0020  00 00 00 40 1c 1b 05 1b 12 02 01 02 00 01         ...@..........

No.     Time           Source                Destination           Protocol Length Info
     21 0.000000       host                  1.3.0                 USB      36     GET DESCRIPTOR Request CONFIGURATION

Frame 21: 36 bytes on wire (288 bits), 36 bytes captured (288 bits) on interface \\.\USBPcap1, id 0
USB URB
    [Source: host]
    [Destination: 1.3.0]
    USBPcap pseudoheader length: 28
    IRP ID: 0x0000000000000000
    IRP USBD_STATUS: USBD_STATUS_SUCCESS (0x00000000)
    URB Function: URB_FUNCTION_GET_DESCRIPTOR_FROM_DEVICE (0x000b)
    IRP information: 0x00, Direction: FDO -> PDO
        0000 000. = Reserved: 0x00
        .... ...0 = Direction: FDO -> PDO (0x0)
    URB bus id: 1
    Device address: 3
    Endpoint: 0x80, Direction: IN
        1... .... = Direction: IN (1)
        .... 0000 = Endpoint number: 0
    URB transfer type: URB_CONTROL (0x02)
    Packet Data Length: 8
    [Response in: 22]
    Control transfer stage: Setup (0)
Setup Data
    bmRequestType: 0x80
        1... .... = Direction: Device-to-host
        .00. .... = Type: Standard (0x0)
        ...0 0000 = Recipient: Device (0x00)
    bRequest: GET DESCRIPTOR (6)
    Descriptor Index: 0x00
    bDescriptorType: CONFIGURATION (0x02)
    Language Id: no language specified (0x0000)
    wLength: 84

0000  1c 00 00 00 00 00 00 00 00 00 00 00 00 00 0b 00   ................
0010  00 01 00 03 00 80 02 08 00 00 00 00 80 06 00 02   ................
0020  00 00 54 00                                       ..T.

No.     Time           Source                Destination           Protocol Length Info
     22 0.000000       1.3.0                 host                  USB      112    GET DESCRIPTOR Response CONFIGURATION

Frame 22: 112 bytes on wire (896 bits), 112 bytes captured (896 bits) on interface \\.\USBPcap1, id 0
USB URB
    [Source: 1.3.0]
    [Destination: host]
    USBPcap pseudoheader length: 28
    IRP ID: 0x0000000000000000
    IRP USBD_STATUS: USBD_STATUS_SUCCESS (0x00000000)
    URB Function: URB_FUNCTION_CONTROL_TRANSFER (0x0008)
    IRP information: 0x01, Direction: PDO -> FDO
        0000 000. = Reserved: 0x00
        .... ...1 = Direction: PDO -> FDO (0x1)
    URB bus id: 1
    Device address: 3
    Endpoint: 0x80, Direction: IN
        1... .... = Direction: IN (1)
        .... 0000 = Endpoint number: 0
    URB transfer type: URB_CONTROL (0x02)
    Packet Data Length: 84
    [Request in: 21]
    [Time from request: 0.000000000 seconds]
    Control transfer stage: Complete (3)
CONFIGURATION DESCRIPTOR
    bLength: 9
    bDescriptorType: 0x02 (CONFIGURATION)
    wTotalLength: 84
    bNumInterfaces: 3
    bConfigurationValue: 1
    iConfiguration: 0
    Configuration bmAttributes: 0xa0  NOT SELF-POWERED  REMOTE-WAKEUP
    bMaxPower: 50  (100mA)
INTERFACE DESCRIPTOR (0.0): class HID
    bLength: 9
    bDescriptorType: 0x04 (INTERFACE)
    bInterfaceNumber: 0
    bAlternateSetting: 0
    bNumEndpoints: 1
    bInterfaceClass: HID (0x03)
    bInterfaceSubClass: Boot Interface (0x01)
    bInterfaceProtocol: Mouse (0x02)
    iInterface: 0
HID DESCRIPTOR
ENDPOINT DESCRIPTOR
    bLength: 7
    bDescriptorType: 0x05 (ENDPOINT)
    bEndpointAddress: 0x81  IN  Endpoint:1
    bmAttributes: 0x03
    wMaxPacketSize: 7
    bInterval: 1
INTERFACE DESCRIPTOR (1.0): class HID
    bLength: 9
    bDescriptorType: 0x04 (INTERFACE)
    bInterfaceNumber: 1
    bAlternateSetting: 0
    bNumEndpoints: 1
    bInterfaceClass: HID (0x03)
    bInterfaceSubClass: Boot Interface (0x01)
    bInterfaceProtocol: Keyboard (0x01)
    iInterface: 0
HID DESCRIPTOR
ENDPOINT DESCRIPTOR
    bLength: 7
    bDescriptorType: 0x05 (ENDPOINT)
    bEndpointAddress: 0x82  IN  Endpoint:2
    bmAttributes: 0x03
    wMaxPacketSize: 8
    bInterval: 1
INTERFACE DESCRIPTOR (2.0): class HID
    bLength: 9
    bDescriptorType: 0x04 (INTERFACE)
    bInterfaceNumber: 2
    bAlternateSetting: 0
    bNumEndpoints: 1
    bInterfaceClass: HID (0x03)
    bInterfaceSubClass: No Subclass (0x00)
    bInterfaceProtocol: 0x01
    iInterface: 0
HID DESCRIPTOR
ENDPOINT DESCRIPTOR
    bLength: 7
    bDescriptorType: 0x05 (ENDPOINT)
    bEndpointAddress: 0x83  IN  Endpoint:3
    bmAttributes: 0x03
    wMaxPacketSize: 4
    bInterval: 1

0000  1c 00 00 00 00 00 00 00 00 00 00 00 00 00 08 00   ................
0010  01 01 00 03 00 80 02 54 00 00 00 03 09 02 54 00   .......T......T.
0020  03 01 00 a0 32 09 04 00 00 01 03 01 02 00 09 21   ....2..........!
0030  11 01 00 01 22 4a 00 07 05 81 03 07 00 01 09 04   ...."J..........
0040  01 00 01 03 01 01 00 09 21 11 01 00 01 22 2f 00   ........!...."/.
0050  07 05 82 03 08 00 01 09 04 02 00 01 03 00 01 00   ................
0060  09 21 11 01 00 01 22 19 00 07 05 83 03 04 00 01   .!....".........

No.     Time           Source                Destination           Protocol Length Info
     23 0.000000       host                  1.3.0                 USB      36     SET CONFIGURATION Request

Frame 23: 36 bytes on wire (288 bits), 36 bytes captured (288 bits) on interface \\.\USBPcap1, id 0
USB URB
    [Source: host]
    [Destination: 1.3.0]
    USBPcap pseudoheader length: 28
    IRP ID: 0x0000000000000000
    IRP USBD_STATUS: USBD_STATUS_SUCCESS (0x00000000)
    URB Function: URB_FUNCTION_SELECT_CONFIGURATION (0x0000)
    IRP information: 0x00, Direction: FDO -> PDO
        0000 000. = Reserved: 0x00
        .... ...0 = Direction: FDO -> PDO (0x0)
    URB bus id: 1
    Device address: 3
    Endpoint: 0x00, Direction: OUT
        0... .... = Direction: OUT (0)
        .... 0000 = Endpoint number: 0
    URB transfer type: URB_CONTROL (0x02)
    Packet Data Length: 8
    [Response in: 24]
    Control transfer stage: Setup (0)
Setup Data
    bmRequestType: 0x00
        0... .... = Direction: Host-to-device
        .00. .... = Type: Standard (0x0)
        ...0 0000 = Recipient: Device (0x00)
    bRequest: SET CONFIGURATION (9)
    bConfigurationValue: 1
    wIndex: 0 (0x0000)
    wLength: 0

0000  1c 00 00 00 00 00 00 00 00 00 00 00 00 00 00 00   ................
0010  00 01 00 03 00 00 02 08 00 00 00 00 00 09 01 00   ................
0020  00 00 00 00                                       ....

No.     Time           Source                Destination           Protocol Length Info
     24 0.000000       1.3.0                 host                  USB      28     SET CONFIGURATION Response

Frame 24: 28 bytes on wire (224 bits), 28 bytes captured (224 bits) on interface \\.\USBPcap1, id 0
USB URB
    [Source: 1.3.0]
    [Destination: host]
    USBPcap pseudoheader length: 28
    IRP ID: 0x0000000000000000
    IRP USBD_STATUS: USBD_STATUS_SUCCESS (0x00000000)
    URB Function: URB_FUNCTION_SELECT_CONFIGURATION (0x0000)
    IRP information: 0x01, Direction: PDO -> FDO
        0000 000. = Reserved: 0x00
        .... ...1 = Direction: PDO -> FDO (0x1)
    URB bus id: 1
    Device address: 3
    Endpoint: 0x00, Direction: OUT
        0... .... = Direction: OUT (0)
        .... 0000 = Endpoint number: 0
    URB transfer type: URB_CONTROL (0x02)
    Packet Data Length: 0
    [Request in: 23]
    [Time from request: 0.000000000 seconds]
    Control transfer stage: Complete (3)

0000  1c 00 00 00 00 00 00 00 00 00 00 00 00 00 00 00   ................
0010  01 01 00 03 00 00 02 00 00 00 00 03               ............
