No.     Time           Source                Destination           Protocol Length Info
      1 0.000000       host                  1.25.0                USB      36     GET DESCRIPTOR Request DEVICE

Frame 1: 36 bytes on wire (288 bits), 36 bytes captured (288 bits) on interface \\.\USBPcap1, id 0
USB URB
    [Source: host]
    [Destination: 1.25.0]
    USBPcap pseudoheader length: 28
    IRP ID: 0x0000000000000000
    IRP USBD_STATUS: USBD_STATUS_SUCCESS (0x00000000)
    URB Function: URB_FUNCTION_GET_DESCRIPTOR_FROM_DEVICE (0x000b)
    IRP information: 0x00, Direction: FDO -> PDO
        0000 000. = Reserved: 0x00
        .... ...0 = Direction: FDO -> PDO (0x0)
    URB bus id: 1
    Device address: 25
    Endpoint: 0x80, Direction: IN
        1... .... = Direction: IN (1)
        .... 0000 = Endpoint number: 0
    URB transfer type: URB_CONTROL (0x02)
    Packet Data Length: 8
    [Response in: 2]
    Control transfer stage: Setup (0)
Setup Data
    bmRequestType: 0x80
        1... .... = Direction: Device-to-host
        .00. .... = Type: Standard (0x0)
        ...0 0000 = Recipient: Device (0x00)
    bRequest: GET DESCRIPTOR (6)
    Descriptor Index: 0x00
    bDescriptorType: DEVICE (0x01)
    Language Id: no language specified (0x0000)
    wLength: 18

0000  1c 00 00 00 00 00 00 00 00 00 00 00 00 00 0b 00   ................
0010  00 01 00 19 00 80 02 08 00 00 00 00 80 06 00 01   ................
0020  00 00 12 00                                       ....

No.     Time           Source                Destination           Protocol Length Info
      2 0.000000       1.25.0                host                  USB      46     GET DESCRIPTOR Response DEVICE

Frame 2: 46 bytes on wire (368 bits), 46 bytes captured (368 bits) on interface \\.\USBPcap1, id 0
USB URB
    [Source: 1.25.0]
    [Destination: host]
    USBPcap pseudoheader length: 28
    IRP ID: 0x0000000000000000
    IRP USBD_STATUS: USBD_STATUS_SUCCESS (0x00000000)
    URB Function: URB_FUNCTION_CONTROL_TRANSFER (0x0008)
    IRP information: 0x01, Direction: PDO -> FDO
        0000 000. = Reserved: 0x00
        .... ...1 = Direction: PDO -> FDO (0x1)
    URB bus id: 1
    Device address: 25
    Endpoint: 0x80, Direction: IN
        1... .... = Direction: IN (1)
        .... 0000 = Endpoint number: 0
    URB transfer type: URB_CONTROL (0x02)
    Packet Data Length: 18
    [Request in: 1]
    [Time from request: 0.000000000 seconds]
    Control transfer stage: Complete (3)
DEVICE DESCRIPTOR
    bLength: 18
    bDescriptorType: 0x01 (DEVICE)
    bcdUSB: 0x0200
    bDeviceClass: Device (0x00)
    bDeviceSubClass: 0
    bDeviceProtocol: 0 (Use class code info from Interface Descriptors)
    bMaxPacketSize0: 64
    idVendor: Cooler Master Co., Ltd. (0x2516)
    idProduct: Unknown (0x012d)
    bcdDevice: 0x0720
    iManufacturer: 3
    iProduct: 1
    iSerialNumber: 0
    bNumConfigurations: 1

0000  1c 00 00 00 00 00 00 00 00 00 00 00 00 00 08 00   ................
0010  01 01 00 19 00 80 02 12 00 00 00 03 12 01 00 02   ................
0020  00 00 00 40 16 25 2d 01 20 07 03 01 00 01         ...@.%-. .....

No.     Time           Source                Destination           Protocol Length Info
      3 0.000000       host                  1.25.0                USB      36     GET DESCRIPTOR Request CONFIGURATION

Frame 3: 36 bytes on wire (288 bits), 36 bytes captured (288 bits) on interface \\.\USBPcap1, id 0
USB URB
    [Source: host]
    [Destination: 1.25.0]
    USBPcap pseudoheader length: 28
    IRP ID: 0x0000000000000000
    IRP USBD_STATUS: USBD_STATUS_SUCCESS (0x00000000)
    URB Function: URB_FUNCTION_GET_DESCRIPTOR_FROM_DEVICE (0x000b)
    IRP information: 0x00, Direction: FDO -> PDO
        0000 000. = Reserved: 0x00
        .... ...0 = Direction: FDO -> PDO (0x0)
    URB bus id: 1
    Device address: 25
    Endpoint: 0x80, Direction: IN
        1... .... = Direction: IN (1)
        .... 0000 = Endpoint number: 0
    URB transfer type: URB_CONTROL (0x02)
    Packet Data Length: 8
    [Response in: 4]
    Control transfer stage: Setup (0)
Setup Data
    bmRequestType: 0x80
        1... .... = Direction: Device-to-host
        .00. .... = Type: Standard (0x0)
        ...0 0000 = Recipient: Device (0x00)
    bRequest: GET DESCRIPTOR (6)
    Descriptor Index: 0x00
    bDescriptorType: CONFIGURATION (0x02)
    Language Id: no language specified (0x0000)
    wLength: 91

0000  1c 00 00 00 00 00 00 00 00 00 00 00 00 00 0b 00   ................
0010  00 01 00 19 00 80 02 08 00 00 00 00 80 06 00 02   ................
0020  00 00 5b 00                                       ..[.

No.     Time           Source                Destination           Protocol Length Info
      4 0.000000       1.25.0                host                  USB      119    GET DESCRIPTOR Response CONFIGURATION

Frame 4: 119 bytes on wire (952 bits), 119 bytes captured (952 bits) on interface \\.\USBPcap1, id 0
USB URB
    [Source: 1.25.0]
    [Destination: host]
    USBPcap pseudoheader length: 28
    IRP ID: 0x0000000000000000
    IRP USBD_STATUS: USBD_STATUS_SUCCESS (0x00000000)
    URB Function: URB_FUNCTION_CONTROL_TRANSFER (0x0008)
    IRP information: 0x01, Direction: PDO -> FDO
        0000 000. = Reserved: 0x00
        .... ...1 = Direction: PDO -> FDO (0x1)
    URB bus id: 1
    Device address: 25
    Endpoint: 0x80, Direction: IN
        1... .... = Direction: IN (1)
        .... 0000 = Endpoint number: 0
    URB transfer type: URB_CONTROL (0x02)
    Packet Data Length: 91
    [Request in: 3]
    [Time from request: 0.000000000 seconds]
    Control transfer stage: Complete (3)
CONFIGURATION DESCRIPTOR
    bLength: 9
    bDescriptorType: 0x02 (CONFIGURATION)
    wTotalLength: 91
    bNumInterfaces: 3
    bConfigurationValue: 1
    iConfiguration: 0
    Configuration bmAttributes: 0xa0  NOT SELF-POWERED  REMOTE-WAKEUP
    bMaxPower: 50  (100mA)
INTERFACE DESCRIPTOR (0.0): class HID
    bLength: 9
    bDescriptorType: 0x04 (INTERFACE)
    bInterfaceNumber: 0
    bAlternateSetting: 0
    bNumEndpoints: 1
    bInterfaceClass: HID (0x03)
    bInterfaceSubClass: Boot Interface (0x01)
    bInterfaceProtocol: Keyboard (0x01)
    iInterface: 0
HID DESCRIPTOR
ENDPOINT DESCRIPTOR
    bLength: 7
    bDescriptorType: 0x05 (ENDPOINT)
    bEndpointAddress: 0x81  IN  Endpoint:1
    bmAttributes: 0x03
    wMaxPacketSize: 8
    bInterval: 1
INTERFACE DESCRIPTOR (1.0): class HID
    bLength: 9
    bDescriptorType: 0x04 (INTERFACE)
    bInterfaceNumber: 1
    bAlternateSetting: 0
    bNumEndpoints: 2
    bInterfaceClass: HID (0x03)
    bInterfaceSubClass: No Subclass (0x00)
    bInterfaceProtocol: 0x00
    iInterface: 2
HID DESCRIPTOR
ENDPOINT DESCRIPTOR
    bLength: 7
    bDescriptorType: 0x05 (ENDPOINT)
    bEndpointAddress: 0x83  IN  Endpoint:3
    bmAttributes: 0x03
    wMaxPacketSize: 64
    bInterval: 1
ENDPOINT DESCRIPTOR
    bLength: 7
    bDescriptorType: 0x05 (ENDPOINT)
    bEndpointAddress: 0x04  OUT  Endpoint:4
    bmAttributes: 0x03
    wMaxPacketSize: 64
    bInterval: 1
INTERFACE DESCRIPTOR (2.0): class HID
    bLength: 9
    bDescriptorType: 0x04 (INTERFACE)
    bInterfaceNumber: 2
    bAlternateSetting: 0
    bNumEndpoints: 1
    bInterfaceClass: HID (0x03)
    bInterfaceSubClass: No Subclass (0x00)
    bInterfaceProtocol: 0x00
    iInterface: 0
HID DESCRIPTOR
ENDPOINT DESCRIPTOR
    bLength: 7
    bDescriptorType: 0x05 (ENDPOINT)
    bEndpointAddress: 0x82  IN  Endpoint:2
    bmAttributes: 0x03
    wMaxPacketSize: 64
    bInterval: 1

0000  1c 00 00 00 00 00 00 00 00 00 00 00 00 00 08 00   ................
0010  01 01 00 19 00 80 02 5b 00 00 00 03 09 02 5b 00   .......[......[.
0020  03 01 00 a0 32 09 04 00 00 01 03 01 01 00 09 21   ....2..........!
0030  11 01 00 01 22 40 00 07 05 81 03 08 00 01 09 04   ...."@..........
0040  01 00 02 03 00 00 02 09 21 11 01 00 01 22 22 00   ........!...."".
0050  07 05 83 03 40 00 01 07 05 04 03 40 00 01 09 04   ....@......@....
0060  02 00 01 03 00 00 00 09 21 11 01 00 01 22 cb 00   ........!...."..
0070  07 05 82 03 40 00 01                              ....@..

No.     Time           Source                Destination           Protocol Length Info
      5 0.000000       host                  1.25.0                USB      36     SET CONFIGURATION Request

Frame 5: 36 bytes on wire (288 bits), 36 bytes captured (288 bits) on interface \\.\USBPcap1, id 0
USB URB
    [Source: host]
    [Destination: 1.25.0]
    USBPcap pseudoheader length: 28
    IRP ID: 0x0000000000000000
    IRP USBD_STATUS: USBD_STATUS_SUCCESS (0x00000000)
    URB Function: URB_FUNCTION_SELECT_CONFIGURATION (0x0000)
    IRP information: 0x00, Direction: FDO -> PDO
        0000 000. = Reserved: 0x00
        .... ...0 = Direction: FDO -> PDO (0x0)
    URB bus id: 1
    Device address: 25
    Endpoint: 0x00, Direction: OUT
        0... .... = Direction: OUT (0)
        .... 0000 = Endpoint number: 0
    URB transfer type: URB_CONTROL (0x02)
    Packet Data Length: 8
    [Response in: 6]
    Control transfer stage: Setup (0)
Setup Data
    bmRequestType: 0x00
        0... .... = Direction: Host-to-device
        .00. .... = Type: Standard (0x0)
        ...0 0000 = Recipient: Device (0x00)
    bRequest: SET CONFIGURATION (9)
    bConfigurationValue: 1
    wIndex: 0 (0x0000)
    wLength: 0

0000  1c 00 00 00 00 00 00 00 00 00 00 00 00 00 00 00   ................
0010  00 01 00 19 00 00 02 08 00 00 00 00 00 09 01 00   ................
0020  00 00 00 00                                       ....

No.     Time           Source                Destination           Protocol Length Info
      6 0.000000       1.25.0                host                  USB      28     SET CONFIGURATION Response

Frame 6: 28 bytes on wire (224 bits), 28 bytes captured (224 bits) on interface \\.\USBPcap1, id 0
USB URB
    [Source: 1.25.0]
    [Destination: host]
    USBPcap pseudoheader length: 28
    IRP ID: 0x0000000000000000
    IRP USBD_STATUS: USBD_STATUS_SUCCESS (0x00000000)
    URB Function: URB_FUNCTION_SELECT_CONFIGURATION (0x0000)
    IRP information: 0x01, Direction: PDO -> FDO
        0000 000. = Reserved: 0x00
        .... ...1 = Direction: PDO -> FDO (0x1)
    URB bus id: 1
    Device address: 25
    Endpoint: 0x00, Direction: OUT
        0... .... = Direction: OUT (0)
        .... 0000 = Endpoint number: 0
    URB transfer type: URB_CONTROL (0x02)
    Packet Data Length: 0
    [Request in: 5]
    [Time from request: 0.000000000 seconds]
    Control transfer stage: Complete (3)

0000  1c 00 00 00 00 00 00 00 00 00 00 00 00 00 00 00   ................
0010  01 01 00 19 00 00 02 00 00 00 00 03               ............

No.     Time           Source                Destination           Protocol Length Info
      7 0.000000       host                  1.2.0                 USB      36     GET DESCRIPTOR Request DEVICE

Frame 7: 36 bytes on wire (288 bits), 36 bytes captured (288 bits) on interface \\.\USBPcap1, id 0
USB URB
    [Source: host]
    [Destination: 1.2.0]
    USBPcap pseudoheader length: 28
    IRP ID: 0x0000000000000000
    IRP USBD_STATUS: USBD_STATUS_SUCCESS (0x00000000)
    URB Function: URB_FUNCTION_GET_DESCRIPTOR_FROM_DEVICE (0x000b)
    IRP information: 0x00, Direction: FDO -> PDO
        0000 000. = Reserved: 0x00
        .... ...0 = Direction: FDO -> PDO (0x0)
    URB bus id: 1
    Device address: 2
    Endpoint: 0x80, Direction: IN
        1... .... = Direction: IN (1)
        .... 0000 = Endpoint number: 0
    URB transfer type: URB_CONTROL (0x02)
    Packet Data Length: 8
    [Response in: 8]
    Control transfer stage: Setup (0)
Setup Data
    bmRequestType: 0x80
        1... .... = Direction: Device-to-host
        .00. .... = Type: Standard (0x0)
        ...0 0000 = Recipient: Device (0x00)
    bRequest: GET DESCRIPTOR (6)
    Descriptor Index: 0x00
    bDescriptorType: DEVICE (0x01)
    Language Id: no language specified (0x0000)
    wLength: 18

0000  1c 00 00 00 00 00 00 00 00 00 00 00 00 00 0b 00   ................
0010  00 01 00 02 00 80 02 08 00 00 00 00 80 06 00 01   ................
0020  00 00 12 00                                       ....

No.     Time           Source                Destination           Protocol Length Info
      8 0.000000       1.2.0                 host                  USB      46     GET DESCRIPTOR Response DEVICE

Frame 8: 46 bytes on wire (368 bits), 46 bytes captured (368 bits) on interface \\.\USBPcap1, id 0
USB URB
    [Source: 1.2.0]
    [Destination: host]
    USBPcap pseudoheader length: 28
    IRP ID: 0x0000000000000000
    IRP USBD_STATUS: USBD_STATUS_SUCCESS (0x00000000)
    URB Function: URB_FUNCTION_CONTROL_TRANSFER (0x0008)
    IRP information: 0x01, Direction: PDO -> FDO
        0000 000. = Reserved: 0x00
        .... ...1 = Direction: PDO -> FDO (0x1)
    URB bus id: 1
    Device address: 2
    Endpoint: 0x80, Direction: IN
        1... .... = Direction: IN (1)
        .... 0000 = Endpoint number: 0
    URB transfer type: URB_CONTROL (0x02)
    Packet Data Length: 18
    [Request in: 7]
    [Time from request: 0.000000000 seconds]
    Control transfer stage: Complete (3)
DEVICE DESCRIPTOR
    bLength: 18
    bDescriptorType: 0x01 (DEVICE)
    bcdUSB: 0x0200
    bDeviceClass: Hub (0x09)
    bDeviceSubClass: 0
    bDeviceProtocol: 1 (Hi-speed hub with single TT)
    bMaxPacketSize0: 64
    idVendor: Apple, Inc. (0x05ac)
    idProduct: Unknown (0x1005)
    bcdDevice: 0x9615
    iManufacturer: 1
    iProduct: 2
    iSerialNumber: 3
    bNumConfigurations: 1

0000  1c 00 00 00 00 00 00 00 00 00 00 00 00 00 08 00   ................
0010  01 01 00 02 00 80 02 12 00 00 00 03 12 01 00 02   ................
0020  09 00 01 40 ac 05 05 10 15 96 01 02 03 01         ...@..........

No.     Time           Source                Destination           Protocol Length Info
      9 0.000000       host                  1.2.0                 USB      36     GET DESCRIPTOR Request CONFIGURATION

Frame 9: 36 bytes on wire (288 bits), 36 bytes captured (288 bits) on interface \\.\USBPcap1, id 0
USB URB
    [Source: host]
    [Destination: 1.2.0]
    USBPcap pseudoheader length: 28
    IRP ID: 0x0000000000000000
    IRP USBD_STATUS: USBD_STATUS_SUCCESS (0x00000000)
    URB Function: URB_FUNCTION_GET_DESCRIPTOR_FROM_DEVICE (0x000b)
    IRP information: 0x00, Direction: FDO -> PDO
        0000 000. = Reserved: 0x00
        .... ...0 = Direction: FDO -> PDO (0x0)
    URB bus id: 1
    Device address: 2
    Endpoint: 0x80, Direction: IN
        1... .... = Direction: IN (1)
        .... 0000 = Endpoint number: 0
    URB transfer type: URB_CONTROL (0x02)
    Packet Data Length: 8
    [Response in: 10]
    Control transfer stage: Setup (0)
Setup Data
    bmRequestType: 0x80
        1... .... = Direction: Device-to-host
        .00. .... = Type: Standard (0x0)
        ...0 0000 = Recipient: Device (0x00)
    bRequest: GET DESCRIPTOR (6)
    Descriptor Index: 0x00
    bDescriptorType: CONFIGURATION (0x02)
    Language Id: no language specified (0x0000)
    wLength: 25

0000  1c 00 00 00 00 00 00 00 00 00 00 00 00 00 0b 00   ................
0010  00 01 00 02 00 80 02 08 00 00 00 00 80 06 00 02   ................
0020  00 00 19 00                                       ....

No.     Time           Source                Destination           Protocol Length Info
     10 0.000000       1.2.0                 host                  USB      53     GET DESCRIPTOR Response CONFIGURATION

Frame 10: 53 bytes on wire (424 bits), 53 bytes captured (424 bits) on interface \\.\USBPcap1, id 0
USB URB
    [Source: 1.2.0]
    [Destination: host]
    USBPcap pseudoheader length: 28
    IRP ID: 0x0000000000000000
    IRP USBD_STATUS: USBD_STATUS_SUCCESS (0x00000000)
    URB Function: URB_FUNCTION_CONTROL_TRANSFER (0x0008)
    IRP information: 0x01, Direction: PDO -> FDO
        0000 000. = Reserved: 0x00
        .... ...1 = Direction: PDO -> FDO (0x1)
    URB bus id: 1
    Device address: 2
    Endpoint: 0x80, Direction: IN
        1... .... = Direction: IN (1)
        .... 0000 = Endpoint number: 0
    URB transfer type: URB_CONTROL (0x02)
    Packet Data Length: 25
    [Request in: 9]
    [Time from request: 0.000000000 seconds]
    Control transfer stage: Complete (3)
CONFIGURATION DESCRIPTOR
    bLength: 9
    bDescriptorType: 0x02 (CONFIGURATION)
    wTotalLength: 25
    bNumInterfaces: 1
    bConfigurationValue: 1
    iConfiguration: 0
    Configuration bmAttributes: 0xa0  NOT SELF-POWERED  REMOTE-WAKEUP
    bMaxPower: 150  (300mA)
INTERFACE DESCRIPTOR (0.0): class Hub
    bLength: 9
    bDescriptorType: 0x04 (INTERFACE)
    bInterfaceNumber: 0
    bAlternateSetting: 0
    bNumEndpoints: 1
    bInterfaceClass: Hub (0x09)
    bInterfaceSubClass: 0x00
    bInterfaceProtocol: 0x00
    iInterface: 0
ENDPOINT DESCRIPTOR
    bLength: 7
    bDescriptorType: 0x05 (ENDPOINT)
    bEndpointAddress: 0x81  IN  Endpoint:1
    bmAttributes: 0x03
    wMaxPacketSize: 1
    bInterval: 12

0000  1c 00 00 00 00 00 00 00 00 00 00 00 00 00 08 00   ................
0010  01 01 00 02 00 80 02 19 00 00 00 03 09 02 19 00   ................
0020  01 01 00 a0 96 09 04 00 00 01 09 00 00 00 07 05   ................
0030  81 03 01 00 0c                                    .....

No.     Time           Source                Destination           Protocol Length Info
     11 0.000000       host                  1.2.0                 USB      36     SET CONFIGURATION Request

Frame 11: 36 bytes on wire (288 bits), 36 bytes captured (288 bits) on interface \\.\USBPcap1, id 0
USB URB
    [Source: host]
    [Destination: 1.2.0]
    USBPcap pseudoheader length: 28
    IRP ID: 0x0000000000000000
    IRP USBD_STATUS: USBD_STATUS_SUCCESS (0x00000000)
    URB Function: URB_FUNCTION_SELECT_CONFIGURATION (0x0000)
    IRP information: 0x00, Direction: FDO -> PDO
        0000 000. = Reserved: 0x00
        .... ...0 = Direction: FDO -> PDO (0x0)
    URB bus id: 1
    Device address: 2
    Endpoint: 0x00, Direction: OUT
        0... .... = Direction: OUT (0)
        .... 0000 = Endpoint number: 0
    URB transfer type: URB_CONTROL (0x02)
    Packet Data Length: 8
    [Response in: 12]
    Control transfer stage: Setup (0)
Setup Data
    bmRequestType: 0x00
        0... .... = Direction: Host-to-device
        .00. .... = Type: Standard (0x0)
        ...0 0000 = Recipient: Device (0x00)
    bRequest: SET CONFIGURATION (9)
    bConfigurationValue: 1
    wIndex: 0 (0x0000)
    wLength: 0

0000  1c 00 00 00 00 00 00 00 00 00 00 00 00 00 00 00   ................
0010  00 01 00 02 00 00 02 08 00 00 00 00 00 09 01 00   ................
0020  00 00 00 00                                       ....

No.     Time           Source                Destination           Protocol Length Info
     12 0.000000       1.2.0                 host                  USB      28     SET CONFIGURATION Response

Frame 12: 28 bytes on wire (224 bits), 28 bytes captured (224 bits) on interface \\.\USBPcap1, id 0
USB URB
    [Source: 1.2.0]
    [Destination: host]
    USBPcap pseudoheader length: 28
    IRP ID: 0x0000000000000000
    IRP USBD_STATUS: USBD_STATUS_SUCCESS (0x00000000)
    URB Function: URB_FUNCTION_SELECT_CONFIGURATION (0x0000)
    IRP information: 0x01, Direction: PDO -> FDO
        0000 000. = Reserved: 0x00
        .... ...1 = Direction: PDO -> FDO (0x1)
    URB bus id: 1
    Device address: 2
    Endpoint: 0x00, Direction: OUT
        0... .... = Direction: OUT (0)
        .... 0000 = Endpoint number: 0
    URB transfer type: URB_CONTROL (0x02)
    Packet Data Length: 0
    [Request in: 11]
    [Time from request: 0.000000000 seconds]
    Control transfer stage: Complete (3)

0000  1c 00 00 00 00 00 00 00 00 00 00 00 00 00 00 00   ................
0010  01 01 00 02 00 00 02 00 00 00 00 03               ............

No.     Time           Source                Destination           Protocol Length Info
     13 0.000000       host                  1.4.0                 USB      36     GET DESCRIPTOR Request DEVICE

Frame 13: 36 bytes on wire (288 bits), 36 bytes captured (288 bits) on interface \\.\USBPcap1, id 0
USB URB
    [Source: host]
    [Destination: 1.4.0]
    USBPcap pseudoheader length: 28
    IRP ID: 0x0000000000000000
    IRP USBD_STATUS: USBD_STATUS_SUCCESS (0x00000000)
    URB Function: URB_FUNCTION_GET_DESCRIPTOR_FROM_DEVICE (0x000b)
    IRP information: 0x00, Direction: FDO -> PDO
        0000 000. = Reserved: 0x00
        .... ...0 = Direction: FDO -> PDO (0x0)
    URB bus id: 1
    Device address: 4
    Endpoint: 0x80, Direction: IN
        1... .... = Direction: IN (1)
        .... 0000 = Endpoint number: 0
    URB transfer type: URB_CONTROL (0x02)
    Packet Data Length: 8
    [Response in: 14]
    Control transfer stage: Setup (0)
Setup Data
    bmRequestType: 0x80
        1... .... = Direction: Device-to-host
        .00. .... = Type: Standard (0x0)
        ...0 0000 = Recipient: Device (0x00)
    bRequest: GET DESCRIPTOR (6)
    Descriptor Index: 0x00
    bDescriptorType: DEVICE (0x01)
    Language Id: no language specified (0x0000)
    wLength: 18

0000  1c 00 00 00 00 00 00 00 00 00 00 00 00 00 0b 00   ................
0010  00 01 00 04 00 80 02 08 00 00 00 00 80 06 00 01   ................
0020  00 00 12 00                                       ....

No.     Time           Source                Destination           Protocol Length Info
     14 0.000000       1.4.0                 host                  USB      46     GET DESCRIPTOR Response DEVICE

Frame 14: 46 bytes on wire (368 bits), 46 bytes captured (368 bits) on interface \\.\USBPcap1, id 0
USB URB
    [Source: 1.4.0]
    [Destination: host]
    USBPcap pseudoheader length: 28
    IRP ID: 0x0000000000000000
    IRP USBD_STATUS: USBD_STATUS_SUCCESS (0x00000000)
    URB Function: URB_FUNCTION_CONTROL_TRANSFER (0x0008)
    IRP information: 0x01, Direction: PDO -> FDO
        0000 000. = Reserved: 0x00
        .... ...1 = Direction: PDO -> FDO (0x1)
    URB bus id: 1
    Device address: 4
    Endpoint: 0x80, Direction: IN
        1... .... = Direction: IN (1)
        .... 0000 = Endpoint number: 0
    URB transfer type: URB_CONTROL (0x02)
    Packet Data Length: 18
    [Request in: 13]
    [Time from request: 0.000000000 seconds]
    Control transfer stage: Complete (3)
DEVICE DESCRIPTOR
    bLength: 18
    bDescriptorType: 0x01 (DEVICE)
    bcdUSB: 0x0200
    bDeviceClass: Device (0x00)
    bDeviceSubClass: 0
    bDeviceProtocol: 0 (Use class code info from Interface Descriptors)
    bMaxPacketSize0: 8
    idVendor: Apple, Inc. (0x05ac)
    idProduct: Aluminum Mini Keyboard (ISO) (0x021e)
    bcdDevice: 0x0070
    iManufacturer: 1
    iProduct: 2
    iSerialNumber: 0
    bNumConfigurations: 1

0000  1c 00 00 00 00 00 00 00 00 00 00 00 00 00 08 00   ................
0010  01 01 00 04 00 80 02 12 00 00 00 03 12 01 00 02   ................
0020  00 00 00 08 ac 05 1e 02 70 00 01 02 00 01         ........p.....

No.     Time           Source                Destination           Protocol Length Info
     15 0.000000       host                  1.4.0                 USB      36     GET DESCRIPTOR Request CONFIGURATION

Frame 15: 36 bytes on wire (288 bits), 36 bytes captured (288 bits) on interface \\.\USBPcap1, id 0
USB URB
    [Source: host]
    [Destination: 1.4.0]
    USBPcap pseudoheader length: 28
    IRP ID: 0x0000000000000000
    IRP USBD_STATUS: USBD_STATUS_SUCCESS (0x00000000)
    URB Function: URB_FUNCTION_GET_DESCRIPTOR_FROM_DEVICE (0x000b)
    IRP information: 0x00, Direction: FDO -> PDO
        0000 000. = Reserved: 0x00
        .... ...0 = Direction: FDO -> PDO (0x0)
    URB bus id: 1
    Device address: 4
    Endpoint: 0x80, Direction: IN
        1... .... = Direction: IN (1)
        .... 0000 = Endpoint number: 0
    URB transfer type: URB_CONTROL (0x02)
    Packet Data Length: 8
    [Response in: 16]
    Control transfer stage: Setup (0)
Setup Data
    bmRequestType: 0x80
        1... .... = Direction: Device-to-host
        .00. .... = Type: Standard (0x0)
        ...0 0000 = Recipient: Device (0x00)
    bRequest: GET DESCRIPTOR (6)
    Descriptor Index: 0x00
    bDescriptorType: CONFIGURATION (0x02)
    Language Id: no language specified (0x0000)
    wLength: 59

0000  1c 00 00 00 00 00 00 00 00 00 00 00 00 00 0b 00   ................
0010  00 01 00 04 00 80 02 08 00 00 00 00 80 06 00 02   ................
0020  00 00 3b 00                                       ..;.

No.     Time           Source                Destination           Protocol Length Info
     16 0.000000       1.4.0                 host                  USB      87     GET DESCRIPTOR Response CONFIGURATION

Frame 16: 87 bytes on wire (696 bits), 87 bytes captured (696 bits) on interface \\.\USBPcap1, id 0
USB URB
    [Source: 1.4.0]
    [Destination: host]
    USBPcap pseudoheader length: 28
    IRP ID: 0x0000000000000000
    IRP USBD_STATUS: USBD_STATUS_SUCCESS (0x00000000)
    URB Function: URB_FUNCTION_CONTROL_TRANSFER (0x0008)
    IRP information: 0x01, Direction: PDO -> FDO
        0000 000. = Reserved: 0x00
        .... ...1 = Direction: PDO -> FDO (0x1)
    URB bus id: 1
    Device address: 4
    Endpoint: 0x80, Direction: IN
        1... .... = Direction: IN (1)
        .... 0000 = Endpoint number: 0
    URB transfer type: URB_CONTROL (0x02)
    Packet Data Length: 59
    [Request in: 15]
    [Time from request: 0.000000000 seconds]
    Control transfer stage: Complete (3)
CONFIGURATION DESCRIPTOR
    bLength: 9
    bDescriptorType: 0x02 (CONFIGURATION)
    wTotalLength: 59
    bNumInterfaces: 2
    bConfigurationValue: 1
    iConfiguration: 0
    Configuration bmAttributes: 0xa0  NOT SELF-POWERED  REMOTE-WAKEUP
    bMaxPower: 10  (20mA)
INTERFACE DESCRIPTOR (0.0): class HID
    bLength: 9
    bDescriptorType: 0x04 (INTERFACE)
    bInterfaceNumber: 0
    bAlternateSetting: 0
    bNumEndpoints: 1
    bInterfaceClass: HID (0x03)
    bInterfaceSubClass: Boot Interface (0x01)
    bInterfaceProtocol: Keyboard (0x01)
    iInterface: 0
HID DESCRIPTOR
ENDPOINT DESCRIPTOR
    bLength: 7
    bDescriptorType: 0x05 (ENDPOINT)
    bEndpointAddress: 0x81  IN  Endpoint:1
    bmAttributes: 0x03
    wMaxPacketSize: 8
    bInterval: 10
INTERFACE DESCRIPTOR (1.0): class HID
    bLength: 9
    bDescriptorType: 0x04 (INTERFACE)
    bInterfaceNumber: 1
    bAlternateSetting: 0
    bNumEndpoints: 1
    bInterfaceClass: HID (0x03)
    bInterfaceSubClass: No Subclass (0x00)
    bInterfaceProtocol: 0x00
    iInterface: 0
HID DESCRIPTOR
ENDPOINT DESCRIPTOR
    bLength: 7
    bDescriptorType: 0x05 (ENDPOINT)
    bEndpointAddress: 0x82  IN  Endpoint:2
    bmAttributes: 0x03
    wMaxPacketSize: 1
    bInterval: 10

0000  1c 00 00 00 00 00 00 00 00 00 00 00 00 00 08 00   ................
0010  01 01 00 04 00 80 02 3b 00 00 00 03 09 02 3b 00   .......;......;.
0020  02 01 00 a0 0a 09 04 00 00 01 03 01 01 00 09 21   ...............!
0030  11 01 0d 01 22 4b 00 07 05 81 03 08 00 0a 09 04   ...."K..........
0040  01 00 01 03 00 00 00 09 21 11 01 00 01 22 2f 00   ........!...."/.
0050  07 05 82 03 01 00 0a                              .......

No.     Time           Source                Destination           Protocol Length Info
     17 0.000000       host                  1.4.0                 USB      36     SET CONFIGURATION Request

Frame 17: 36 bytes on wire (288 bits), 36 bytes captured (288 bits) on interface \\.\USBPcap1, id 0
USB URB
    [Source: host]
    [Destination: 1.4.0]
    USBPcap pseudoheader length: 28
    IRP ID: 0x0000000000000000
    IRP USBD_STATUS: USBD_STATUS_SUCCESS (0x00000000)
    URB Function: URB_FUNCTION_SELECT_CONFIGURATION (0x0000)
    IRP information: 0x00, Direction: FDO -> PDO
        0000 000. = Reserved: 0x00
        .... ...0 = Direction: FDO -> PDO (0x0)
    URB bus id: 1
    Device address: 4
    Endpoint: 0x00, Direction: OUT
        0... .... = Direction: OUT (0)
        .... 0000 = Endpoint number: 0
    URB transfer type: URB_CONTROL (0x02)
    Packet Data Length: 8
    [Response in: 18]
    Control transfer stage: Setup (0)
Setup Data
    bmRequestType: 0x00
        0... .... = Direction: Host-to-device
        .00. .... = Type: Standard (0x0)
        ...0 0000 = Recipient: Device (0x00)
    bRequest: SET CONFIGURATION (9)
    bConfigurationValue: 1
    wIndex: 0 (0x0000)
    wLength: 0

0000  1c 00 00 00 00 00 00 00 00 00 00 00 00 00 00 00   ................
0010  00 01 00 04 00 00 02 08 00 00 00 00 00 09 01 00   ................
0020  00 00 00 00                                       ....

No.     Time           Source                Destination           Protocol Length Info
     18 0.000000       1.4.0                 host                  USB      28     SET CONFIGURATION Response

Frame 18: 28 bytes on wire (224 bits), 28 bytes captured (224 bits) on interface \\.\USBPcap1, id 0
USB URB
    [Source: 1.4.0]
    [Destination: host]
    USBPcap pseudoheader length: 28
    IRP ID: 0x0000000000000000
    IRP USBD_STATUS: USBD_STATUS_SUCCESS (0x00000000)
    URB Function: URB_FUNCTION_SELECT_CONFIGURATION (0x0000)
    IRP information: 0x01, Direction: PDO -> FDO
        0000 000. = Reserved: 0x00
        .... ...1 = Direction: PDO -> FDO (0x1)
    URB bus id: 1
    Device address: 4
    Endpoint: 0x00, Direction: OUT
        0... .... = Direction: OUT (0)
        .... 0000 = Endpoint number: 0
    URB transfer type: URB_CONTROL (0x02)
    Packet Data Length: 0
    [Request in: 17]
    [Time from request: 0.000000000 seconds]
    Control transfer stage: Complete (3)

0000  1c 00 00 00 00 00 00 00 00 00 00 00 00 00 00 00   ................
0010  01 01 00 04 00 00 02 00 00 00 00 03               ............

No.     Time           Source                Destination           Protocol Length Info
     19 0.000000       host                  1.3.0                 USB      36     GET DESCRIPTOR Request DEVICE

Frame 19: 36 bytes on wire (288 bits), 36 bytes captured (288 bits) on interface \\.\USBPcap1, id 0
USB URB
    [Source: host]
    [Destination: 1.3.0]
    USBPcap pseudoheader length: 28
    IRP ID: 0x0000000000000000
    IRP USBD_STATUS: USBD_STATUS_SUCCESS (0x00000000)
    URB Function: URB_FUNCTION_GET_DESCRIPTOR_FROM_DEVICE (0x000b)
    IRP information: 0x00, Direction: FDO -> PDO
        0000 000. = Reserved: 0x00
        .... ...0 = Direction: FDO -> PDO (0x0)
    URB bus id: 1
    Device address: 3
    Endpoint: 0x80, Direction: IN
        1... .... = Direction: IN (1)
        .... 0000 = Endpoint number: 0
    URB transfer type: URB_CONTROL (0x02)
    Packet Data Length: 8
    [Response in: 20]
    Control transfer stage: Setup (0)
Setup Data
    bmRequestType: 0x80
        1... .... = Direction: Device-to-host
        .00. .... = Type: Standard (0x0)
        ...0 0000 = Recipient: Device (0x00)
    bRequest: GET DESCRIPTOR (6)
    Descriptor Index: 0x00
    bDescriptorType: DEVICE (0x01)
    Language Id: no language specified (0x0000)
    wLength: 18

0000  1c 00 00 00 00 00 00 00 00 00 00 00 00 00 0b 00   ................
0010  00 01 00 03 00 80 02 08 00 00 00 00 80 06 00 01   ................
0020  00 00 12 00                                       ....

No.     Time           Source                Destination           Protocol Length Info
     20 0.000000       1.3.0                 host                  USB      46     GET DESCRIPTOR Response DEVICE

Frame 20: 46 bytes on wire (368 bits), 46 bytes captured (368 bits) on interface \\.\USBPcap1, id 0
USB URB
    [Source: 1.3.0]
    [Destination: host]
    USBPcap pseudoheader length: 28
    IRP ID: 0x0000000000000000
    IRP USBD_STATUS: USBD_STATUS_SUCCESS (0x00000000)
    URB Function: URB_FUNCTION_CONTROL_TRANSFER (0x0008)
    IRP information: 0x01, Direction: PDO -> FDO
        0000 000. = Reserved: 0x00
        .... ...1 = Direction: PDO -> FDO (0x1)
    URB bus id: 1
    Device address: 3
    Endpoint: 0x80, Direction: IN
        1... .... = Direction: IN (1)
        .... 0000 = Endpoint number: 0
    URB transfer type: URB_CONTROL (0x02)
    Packet Data Length: 18
    [Request in: 19]
    [Time from request: 0.000000000 seconds]
    Control transfer stage: Complete (3)
DEVICE DESCRIPTOR
    bLength: 18
    bDescriptorType: 0x01 (DEVICE)
    bcdUSB: 0x0200
    bDeviceClass: Device (0x00)
    bDeviceSubClass: 0
    bDeviceProtocol: 0 (Use class code info from Interface Descriptors)
    bMaxPacketSize0: 64
    idVendor: Corsair (0x1b1c)
    idProduct: Unknown (0x1b05)
    bcdDevice: 0x0212
    iManufacturer: 1
    iProduct: 2
    iSerialNumber: 0
    bNumConfigurations: 1

0000  1c 00 00 00 00 00 00 00 00 00 00 00 00 00 08 00   ................
0010  01 01 00 03 00 80 02 12 00 00 00 03 12 01 00 02   ................
0020  00 00 00 40 1c 1b 05 1b 12 02 01 02 00 01         ...@..........

No.     Time           Source                Destination           Protocol Length Info
     21 0.000000       host                  1.3.0                 USB      36     GET DESCRIPTOR Request CONFIGURATION

Frame 21: 36 bytes on wire (288 bits), 36 bytes captured (288 bits) on interface \\.\USBPcap1, id 0
USB URB
    [Source: host]
    [Destination: 1.3.0]
    USBPcap pseudoheader length: 28
    IRP ID: 0x0000000000000000
    IRP USBD_STATUS: USBD_STATUS_SUCCESS (0x00000000)
    URB Function: URB_FUNCTION_GET_DESCRIPTOR_FROM_DEVICE (0x000b)
    IRP information: 0x00, Direction: FDO -> PDO
        0000 000. = Reserved: 0x00
        .... ...0 = Direction: FDO -> PDO (0x0)
    URB bus id: 1
    Device address: 3
    Endpoint: 0x80, Direction: IN
        1... .... = Direction: IN (1)
        .... 0000 = Endpoint number: 0
    URB transfer type: URB_CONTROL (0x02)
    Packet Data Length: 8
    [Response in: 22]
    Control transfer stage: Setup (0)
Setup Data
    bmRequestType: 0x80
        1... .... = Direction: Device-to-host
        .00. .... = Type: Standard (0x0)
        ...0 0000 = Recipient: Device (0x00)
    bRequest: GET DESCRIPTOR (6)
    Descriptor Index: 0x00
    bDescriptorType: CONFIGURATION (0x02)
    Language Id: no language specified (0x0000)
    wLength: 84

0000  1c 00 00 00 00 00 00 00 00 00 00 00 00 00 0b 00   ................
0010  00 01 00 03 00 80 02 08 00 00 00 00 80 06 00 02   ................
0020  00 00 54 00                                       ..T.

No.     Time           Source                Destination           Protocol Length Info
     22 0.000000       1.3.0                 host                  USB      112    GET DESCRIPTOR Response CONFIGURATION

Frame 22: 112 bytes on wire (896 bits), 112 bytes captured (896 bits) on interface \\.\USBPcap1, id 0
USB URB
    [Source: 1.3.0]
    [Destination: host]
    USBPcap pseudoheader length: 28
    IRP ID: 0x0000000000000000
    IRP USBD_STATUS: USBD_STATUS_SUCCESS (0x00000000)
    URB Function: URB_FUNCTION_CONTROL_TRANSFER (0x0008)
    IRP information: 0x01, Direction: PDO -> FDO
        0000 000. = Reserved: 0x00
        .... ...1 = Direction: PDO -> FDO (0x1)
    URB bus id: 1
    Device address: 3
    Endpoint: 0x80, Direction: IN
        1... .... = Direction: IN (1)
        .... 0000 = Endpoint number: 0
    URB transfer type: URB_CONTROL (0x02)
    Packet Data Length: 84
    [Request in: 21]
    [Time from request: 0.000000000 seconds]
    Control transfer stage: Complete (3)
CONFIGURATION DESCRIPTOR
    bLength: 9
    bDescriptorType: 0x02 (CONFIGURATION)
    wTotalLength: 84
    bNumInterfaces: 3
    bConfigurationValue: 1
    iConfiguration: 0
    Configuration bmAttributes: 0xa0  NOT SELF-POWERED  REMOTE-WAKEUP
    bMaxPower: 50  (100mA)
INTERFACE DESCRIPTOR (0.0): class HID
    bLength: 9
    bDescriptorType: 0x04 (INTERFACE)
    bInterfaceNumber: 0
    bAlternateSetting: 0
    bNumEndpoints: 1
    bInterfaceClass: HID (0x03)
    bInterfaceSubClass: Boot Interface (0x01)
    bInterfaceProtocol: Mouse (0x02)
    iInterface: 0
HID DESCRIPTOR
ENDPOINT DESCRIPTOR
    bLength: 7
    bDescriptorType: 0x05 (ENDPOINT)
    bEndpointAddress: 0x81  IN  Endpoint:1
    bmAttributes: 0x03
    wMaxPacketSize: 7
    bInterval: 1
INTERFACE DESCRIPTOR (1.0): class HID
    bLength: 9
    bDescriptorType: 0x04 (INTERFACE)
    bInterfaceNumber: 1
    bAlternateSetting: 0
    bNumEndpoints: 1
    bInterfaceClass: HID (0x03)
    bInterfaceSubClass: Boot Interface (0x01)
    bInterfaceProtocol: Keyboard (0x01)
    iInterface: 0
HID DESCRIPTOR
ENDPOINT DESCRIPTOR
    bLength: 7
    bDescriptorType: 0x05 (ENDPOINT)
    bEndpointAddress: 0x82  IN  Endpoint:2
    bmAttributes: 0x03
    wMaxPacketSize: 8
    bInterval: 1
INTERFACE DESCRIPTOR (2.0): class HID
    bLength: 9
    bDescriptorType: 0x04 (INTERFACE)
    bInterfaceNumber: 2
    bAlternateSetting: 0
    bNumEndpoints: 1
    bInterfaceClass: HID (0x03)
    bInterfaceSubClass: No Subclass (0x00)
    bInterfaceProtocol: 0x01
    iInterface: 0
HID DESCRIPTOR
ENDPOINT DESCRIPTOR
    bLength: 7
    bDescriptorType: 0x05 (ENDPOINT)
    bEndpointAddress: 0x83  IN  Endpoint:3
    bmAttributes: 0x03
    wMaxPacketSize: 4
    bInterval: 1

0000  1c 00 00 00 00 00 00 00 00 00 00 00 00 00 08 00   ................
0010  01 01 00 03 00 80 02 54 00 00 00 03 09 02 54 00   .......T......T.
0020  03 01 00 a0 32 09 04 00 00 01 03 01 02 00 09 21   ....2..........!
0030  11 01 00 01 22 4a 00 07 05 81 03 07 00 01 09 04   ...."J..........
0040  01 00 01 03 01 01 00 09 21 11 01 00 01 22 2f 00   ........!...."/.
0050  07 05 82 03 08 00 01 09 04 02 00 01 03 00 01 00   ................
0060  09 21 11 01 00 01 22 19 00 07 05 83 03 04 00 01   .!....".........

No.     Time           Source                Destination           Protocol Length Info
     23 0.000000       host                  1.3.0                 USB      36     SET CONFIGURATION Request

Frame 23: 36 bytes on wire (288 bits), 36 bytes captured (288 bits) on interface \\.\USBPcap1, id 0
USB URB
    [Source: host]
    [Destination: 1.3.0]
    USBPcap pseudoheader length: 28
    IRP ID: 0x0000000000000000
    IRP USBD_STATUS: USBD_STATUS_SUCCESS (0x00000000)
    URB Function: URB_FUNCTION_SELECT_CONFIGURATION (0x0000)
    IRP information: 0x00, Direction: FDO -> PDO
        0000 000. = Reserved: 0x00
        .... ...0 = Direction: FDO -> PDO (0x0)
    URB bus id: 1
    Device address: 3
    Endpoint: 0x00, Direction: OUT
        0... .... = Direction: OUT (0)
        .... 0000 = Endpoint number: 0
    URB transfer type: URB_CONTROL (0x02)
    Packet Data Length: 8
    [Response in: 24]
    Control transfer stage: Setup (0)
Setup Data
    bmRequestType: 0x00
        0... .... = Direction: Host-to-device
        .00. .... = Type: Standard (0x0)
        ...0 0000 = Recipient: Device (0x00)
    bRequest: SET CONFIGURATION (9)
    bConfigurationValue: 1
    wIndex: 0 (0x0000)
    wLength: 0

0000  1c 00 00 00 00 00 00 00 00 00 00 00 00 00 00 00   ................
0010  00 01 00 03 00 00 02 08 00 00 00 00 00 09 01 00   ................
0020  00 00 00 00                                       ....

No.     Time           Source                Destination           Protocol Length Info
     24 0.000000       1.3.0                 host                  USB      28     SET CONFIGURATION Response

Frame 24: 28 bytes on wire (224 bits), 28 bytes captured (224 bits) on interface \\.\USBPcap1, id 0
USB URB
    [Source: 1.3.0]
    [Destination: host]
    USBPcap pseudoheader length: 28
    IRP ID: 0x0000000000000000
    IRP USBD_STATUS: USBD_STATUS_SUCCESS (0x00000000)
    URB Function: URB_FUNCTION_SELECT_CONFIGURATION (0x0000)
    IRP information: 0x01, Direction: PDO -> FDO
        0000 000. = Reserved: 0x00
        .... ...1 = Direction: PDO -> FDO (0x1)
    URB bus id: 1
    Device address: 3
    Endpoint: 0x00, Direction: OUT
        0... .... = Direction: OUT (0)
        .... 0000 = Endpoint number: 0
    URB transfer type: URB_CONTROL (0x02)
    Packet Data Length: 0
    [Request in: 23]
    [Time from request: 0.000000000 seconds]
    Control transfer stage: Complete (3)

0000  1c 00 00 00 00 00 00 00 00 00 00 00 00 00 00 00   ................
0010  01 01 00 03 00 00 02 00 00 00 00 03               ............

No.     Time           Source                Destination           Protocol Length Info
   4865 9.415696       host                  1.25.4                USB      91     URB_INTERRUPT out

Frame 4865: 91 bytes on wire (728 bits), 91 bytes captured (728 bits) on interface \\.\USBPcap1, id 0
USB URB
    [Source: host]
    [Destination: 1.25.4]
    USBPcap pseudoheader length: 27
    IRP ID: 0xffff83030faa5010
    IRP USBD_STATUS: USBD_STATUS_SUCCESS (0x00000000)
    URB Function: URB_FUNCTION_BULK_OR_INTERRUPT_TRANSFER (0x0009)
    IRP information: 0x00, Direction: FDO -> PDO
        0000 000. = Reserved: 0x00
        .... ...0 = Direction: FDO -> PDO (0x0)
    URB bus id: 1
    Device address: 25
    Endpoint: 0x04, Direction: OUT
        0... .... = Direction: OUT (0)
        .... 0100 = Endpoint number: 4
    URB transfer type: URB_INTERRUPT (0x01)
    Packet Data Length: 64
    [Response in: 4866]
    [bInterfaceClass: HID (0x03)]
HID Data: 568100000100000002000000bbbbbbbb000000000000000000000000000000000000000000000000000000000000000000000000000000000000000000000000

0000  1b 00 10 50 aa 0f 03 83 ff ff 00 00 00 00 09 00   ...P............
0010  00 01 00 19 00 04 01 40 00 00 00 56 81 00 00 01   .......@...V....
0020  00 00 00 02 00 00 00 bb bb bb bb 00 00 00 00 00   ................
0030  00 00 00 00 00 00 00 00 00 00 00 00 00 00 00 00   ................
0040  00 00 00 00 00 00 00 00 00 00 00 00 00 00 00 00   ................
0050  00 00 00 00 00 00 00 00 00 00 00                  ...........

No.     Time           Source                Destination           Protocol Length Info
   4866 9.416759       1.25.4                host                  USB      27     URB_INTERRUPT out

Frame 4866: 27 bytes on wire (216 bits), 27 bytes captured (216 bits) on interface \\.\USBPcap1, id 0
USB URB
    [Source: 1.25.4]
    [Destination: host]
    USBPcap pseudoheader length: 27
    IRP ID: 0xffff83030faa5010
    IRP USBD_STATUS: USBD_STATUS_SUCCESS (0x00000000)
    URB Function: URB_FUNCTION_BULK_OR_INTERRUPT_TRANSFER (0x0009)
    IRP information: 0x01, Direction: PDO -> FDO
        0000 000. = Reserved: 0x00
        .... ...1 = Direction: PDO -> FDO (0x1)
    URB bus id: 1
    Device address: 25
    Endpoint: 0x04, Direction: OUT
        0... .... = Direction: OUT (0)
        .... 0100 = Endpoint number: 4
    URB transfer type: URB_INTERRUPT (0x01)
    Packet Data Length: 0
    [Request in: 4865]
    [Time from request: 0.001063000 seconds]
    [bInterfaceClass: HID (0x03)]

0000  1b 00 10 50 aa 0f 03 83 ff ff 00 00 00 00 09 00   ...P............
0010  01 01 00 19 00 04 01 00 00 00 00                  ...........

No.     Time           Source                Destination           Protocol Length Info
   4867 9.417744       1.25.3                host                  USB      91     URB_INTERRUPT in

Frame 4867: 91 bytes on wire (728 bits), 91 bytes captured (728 bits) on interface \\.\USBPcap1, id 0
USB URB
    [Source: 1.25.3]
    [Destination: host]
    USBPcap pseudoheader length: 27
    IRP ID: 0xffff8303221f5a20
    IRP USBD_STATUS: USBD_STATUS_SUCCESS (0x00000000)
    URB Function: URB_FUNCTION_BULK_OR_INTERRUPT_TRANSFER (0x0009)
    IRP information: 0x01, Direction: PDO -> FDO
        0000 000. = Reserved: 0x00
        .... ...1 = Direction: PDO -> FDO (0x1)
    URB bus id: 1
    Device address: 25
    Endpoint: 0x83, Direction: IN
        1... .... = Direction: IN (1)
        .... 0011 = Endpoint number: 3
    URB transfer type: URB_INTERRUPT (0x01)
    Packet Data Length: 64
    [bInterfaceClass: HID (0x03)]
HID Data: 56810000000000000000000000000000000000000000000000000000000000000000000000000000000000000000000000000000000000000000000000000000

0000  1b 00 20 5a 1f 22 03 83 ff ff 00 00 00 00 09 00   .. Z."..........
0010  01 01 00 19 00 83 01 40 00 00 00 56 81 00 00 00   .......@...V....
0020  00 00 00 00 00 00 00 00 00 00 00 00 00 00 00 00   ................
0030  00 00 00 00 00 00 00 00 00 00 00 00 00 00 00 00   ................
0040  00 00 00 00 00 00 00 00 00 00 00 00 00 00 00 00   ................
0050  00 00 00 00 00 00 00 00 00 00 00                  ...........

No.     Time           Source                Destination           Protocol Length Info
   4868 9.417778       host                  1.25.3                USB      27     URB_INTERRUPT in

Frame 4868: 27 bytes on wire (216 bits), 27 bytes captured (216 bits) on interface \\.\USBPcap1, id 0
USB URB
    [Source: host]
    [Destination: 1.25.3]
    USBPcap pseudoheader length: 27
    IRP ID: 0xffff8303221f5a20
    IRP USBD_STATUS: USBD_STATUS_SUCCESS (0x00000000)
    URB Function: URB_FUNCTION_BULK_OR_INTERRUPT_TRANSFER (0x0009)
    IRP information: 0x00, Direction: FDO -> PDO
        0000 000. = Reserved: 0x00
        .... ...0 = Direction: FDO -> PDO (0x0)
    URB bus id: 1
    Device address: 25
    Endpoint: 0x83, Direction: IN
        1... .... = Direction: IN (1)
        .... 0011 = Endpoint number: 3
    URB transfer type: URB_INTERRUPT (0x01)
    Packet Data Length: 0
    [Response in: 4877]
    [bInterfaceClass: HID (0x03)]

0000  1b 00 20 5a 1f 22 03 83 ff ff 00 00 00 00 09 00   .. Z."..........
0010  00 01 00 19 00 83 01 00 00 00 00                  ...........

No.     Time           Source                Destination           Protocol Length Info
   4869 9.426675       host                  1.25.4                USB      91     URB_INTERRUPT out

Frame 4869: 91 bytes on wire (728 bits), 91 bytes captured (728 bits) on interface \\.\USBPcap1, id 0
USB URB
    [Source: host]
    [Destination: 1.25.4]
    USBPcap pseudoheader length: 27
    IRP ID: 0xffff83030a91c010
    IRP USBD_STATUS: USBD_STATUS_SUCCESS (0x00000000)
    URB Function: URB_FUNCTION_BULK_OR_INTERRUPT_TRANSFER (0x0009)
    IRP information: 0x00, Direction: FDO -> PDO
        0000 000. = Reserved: 0x00
        .... ...0 = Direction: FDO -> PDO (0x0)
    URB bus id: 1
    Device address: 25
    Endpoint: 0x04, Direction: OUT
        0... .... = Direction: OUT (0)
        .... 0100 = Endpoint number: 4
    URB transfer type: URB_INTERRUPT (0x01)
    Packet Data Length: 64
    [Response in: 4872]
    [bInterfaceClass: HID (0x03)]
HID Data: 568300000100000080010000ff0000000000ffff0000000000000000000000000000000000000000000000000000000000000000000000000000000000000000

0000  1b 00 10 c0 91 0a 03 83 ff ff 00 00 00 00 09 00   ................
0010  00 01 00 19 00 04 01 40 00 00 00 56 83 00 00 01   .......@...V....
0020  00 00 00 80 01 00 00 ff 00 00 00 00 00 ff ff 00   ................
0030  00 00 00 00 00 00 00 00 00 00 00 00 00 00 00 00   ................
0040  00 00 00 00 00 00 00 00 00 00 00 00 00 00 00 00   ................
0050  00 00 00 00 00 00 00 00 00 00 00                  ...........

No.     Time           Source                Destination           Protocol Length Info
   4872 9.427811       1.25.4                host                  USB      27     URB_INTERRUPT out

Frame 4872: 27 bytes on wire (216 bits), 27 bytes captured (216 bits) on interface \\.\USBPcap1, id 0
USB URB
    [Source: 1.25.4]
    [Destination: host]
    USBPcap pseudoheader length: 27
    IRP ID: 0xffff83030a91c010
    IRP USBD_STATUS: USBD_STATUS_SUCCESS (0x00000000)
    URB Function: URB_FUNCTION_BULK_OR_INTERRUPT_TRANSFER (0x0009)
    IRP information: 0x01, Direction: PDO -> FDO
        0000 000. = Reserved: 0x00
        .... ...1 = Direction: PDO -> FDO (0x1)
    URB bus id: 1
    Device address: 25
    Endpoint: 0x04, Direction: OUT
        0... .... = Direction: OUT (0)
        .... 0100 = Endpoint number: 4
    URB transfer type: URB_INTERRUPT (0x01)
    Packet Data Length: 0
    [Request in: 4869]
    [Time from request: 0.001136000 seconds]
    [bInterfaceClass: HID (0x03)]

0000  1b 00 10 c0 91 0a 03 83 ff ff 00 00 00 00 09 00   ................
0010  01 01 00 19 00 04 01 00 00 00 00                  ...........

No.     Time           Source                Destination           Protocol Length Info
   4873 9.428761       1.25.3                host                  USB      91     URB_INTERRUPT in

Frame 4873: 91 bytes on wire (728 bits), 91 bytes captured (728 bits) on interface \\.\USBPcap1, id 0
USB URB
    [Source: 1.25.3]
    [Destination: host]
    USBPcap pseudoheader length: 27
    IRP ID: 0xffff83030ee9ea20
    IRP USBD_STATUS: USBD_STATUS_SUCCESS (0x00000000)
    URB Function: URB_FUNCTION_BULK_OR_INTERRUPT_TRANSFER (0x0009)
    IRP information: 0x01, Direction: PDO -> FDO
        0000 000. = Reserved: 0x00
        .... ...1 = Direction: PDO -> FDO (0x1)
    URB bus id: 1
    Device address: 25
    Endpoint: 0x83, Direction: IN
        1... .... = Direction: IN (1)
        .... 0011 = Endpoint number: 3
    URB transfer type: URB_INTERRUPT (0x01)
    Packet Data Length: 64
    [bInterfaceClass: HID (0x03)]
HID Data: 56830000000000000000000000000000000000000000000000000000000000000000000000000000000000000000000000000000000000000000000000000000

0000  1b 00 20 ea e9 0e 03 83 ff ff 00 00 00 00 09 00   .. .............
0010  01 01 00 19 00 83 01 40 00 00 00 56 83 00 00 00   .......@...V....
0020  00 00 00 00 00 00 00 00 00 00 00 00 00 00 00 00   ................
0030  00 00 00 00 00 00 00 00 00 00 00 00 00 00 00 00   ................
0040  00 00 00 00 00 00 00 00 00 00 00 00 00 00 00 00   ................
0050  00 00 00 00 00 00 00 00 00 00 00                  ...........

No.     Time           Source                Destination           Protocol Length Info
   4874 9.428796       host                  1.25.3                USB      27     URB_INTERRUPT in

Frame 4874: 27 bytes on wire (216 bits), 27 bytes captured (216 bits) on interface \\.\USBPcap1, id 0
USB URB
    [Source: host]
    [Destination: 1.25.3]
    USBPcap pseudoheader length: 27
    IRP ID: 0xffff83030ee9ea20
    IRP USBD_STATUS: USBD_STATUS_SUCCESS (0x00000000)
    URB Function: URB_FUNCTION_BULK_OR_INTERRUPT_TRANSFER (0x0009)
    IRP information: 0x00, Direction: FDO -> PDO
        0000 000. = Reserved: 0x00
        .... ...0 = Direction: FDO -> PDO (0x0)
    URB bus id: 1
    Device address: 25
    Endpoint: 0x83, Direction: IN
        1... .... = Direction: IN (1)
        .... 0011 = Endpoint number: 3
    URB transfer type: URB_INTERRUPT (0x01)
    Packet Data Length: 0
    [Response in: 4883]
    [bInterfaceClass: HID (0x03)]

0000  1b 00 20 ea e9 0e 03 83 ff ff 00 00 00 00 09 00   .. .............
0010  00 01 00 19 00 83 01 00 00 00 00                  ...........

No.     Time           Source                Destination           Protocol Length Info
   4875 9.437383       host                  1.25.4                USB      91     URB_INTERRUPT out

Frame 4875: 91 bytes on wire (728 bits), 91 bytes captured (728 bits) on interface \\.\USBPcap1, id 0
USB URB
    [Source: host]
    [Destination: 1.25.4]
    USBPcap pseudoheader length: 27
    IRP ID: 0xffff830311b8d010
    IRP USBD_STATUS: USBD_STATUS_SUCCESS (0x00000000)
    URB Function: URB_FUNCTION_BULK_OR_INTERRUPT_TRANSFER (0x0009)
    IRP information: 0x00, Direction: FDO -> PDO
        0000 000. = Reserved: 0x00
        .... ...0 = Direction: FDO -> PDO (0x0)
    URB bus id: 1
    Device address: 25
    Endpoint: 0x04, Direction: OUT
        0... .... = Direction: OUT (0)
        .... 0100 = Endpoint number: 4
    URB transfer type: URB_INTERRUPT (0x01)
    Packet Data Length: 64
    [Response in: 4876]
    [bInterfaceClass: HID (0x03)]
HID Data: 56830100000000000000000000000000000000000000000000000000000000000000000000000000000000000000000000000000000000000000000000000000

0000  1b 00 10 d0 b8 11 03 83 ff ff 00 00 00 00 09 00   ................
0010  00 01 00 19 00 04 01 40 00 00 00 56 83 01 00 00   .......@...V....
0020  00 00 00 00 00 00 00 00 00 00 00 00 00 00 00 00   ................
0030  00 00 00 00 00 00 00 00 00 00 00 00 00 00 00 00   ................
0040  00 00 00 00 00 00 00 00 00 00 00 00 00 00 00 00   ................
0050  00 00 00 00 00 00 00 00 00 00 00                  ...........

No.     Time           Source                Destination           Protocol Length Info
   4876 9.437748       1.25.4                host                  USB      27     URB_INTERRUPT out

Frame 4876: 27 bytes on wire (216 bits), 27 bytes captured (216 bits) on interface \\.\USBPcap1, id 0
USB URB
    [Source: 1.25.4]
    [Destination: host]
    USBPcap pseudoheader length: 27
    IRP ID: 0xffff830311b8d010
    IRP USBD_STATUS: USBD_STATUS_SUCCESS (0x00000000)
    URB Function: URB_FUNCTION_BULK_OR_INTERRUPT_TRANSFER (0x0009)
    IRP information: 0x01, Direction: PDO -> FDO
        0000 000. = Reserved: 0x00
        .... ...1 = Direction: PDO -> FDO (0x1)
    URB bus id: 1
    Device address: 25
    Endpoint: 0x04, Direction: OUT
        0... .... = Direction: OUT (0)
        .... 0100 = Endpoint number: 4
    URB transfer type: URB_INTERRUPT (0x01)
    Packet Data Length: 0
    [Request in: 4875]
    [Time from request: 0.000365000 seconds]
    [bInterfaceClass: HID (0x03)]

0000  1b 00 10 d0 b8 11 03 83 ff ff 00 00 00 00 09 00   ................
0010  01 01 00 19 00 04 01 00 00 00 00                  ...........

No.     Time           Source                Destination           Protocol Length Info
   4877 9.438759       1.25.3                host                  USB      91     URB_INTERRUPT in

Frame 4877: 91 bytes on wire (728 bits), 91 bytes captured (728 bits) on interface \\.\USBPcap1, id 0
USB URB
    [Source: 1.25.3]
    [Destination: host]
    USBPcap pseudoheader length: 27
    IRP ID: 0xffff8303221f5a20
    IRP USBD_STATUS: USBD_STATUS_SUCCESS (0x00000000)
    URB Function: URB_FUNCTION_BULK_OR_INTERRUPT_TRANSFER (0x0009)
    IRP information: 0x01, Direction: PDO -> FDO
        0000 000. = Reserved: 0x00
        .... ...1 = Direction: PDO -> FDO (0x1)
    URB bus id: 1
    Device address: 25
    Endpoint: 0x83, Direction: IN
        1... .... = Direction: IN (1)
        .... 0011 = Endpoint number: 3
    URB transfer type: URB_INTERRUPT (0x01)
    Packet Data Length: 64
    [Request in: 4868]
    [Time from request: 0.020981000 seconds]
    [bInterfaceClass: HID (0x03)]
HID Data: 56830100000000000000000000000000000000000000000000000000000000000000000000000000000000000000000000000000000000000000000000000000

0000  1b 00 20 5a 1f 22 03 83 ff ff 00 00 00 00 09 00   .. Z."..........
0010  01 01 00 19 00 83 01 40 00 00 00 56 83 01 00 00   .......@...V....
0020  00 00 00 00 00 00 00 00 00 00 00 00 00 00 00 00   ................
0030  00 00 00 00 00 00 00 00 00 00 00 00 00 00 00 00   ................
0040  00 00 00 00 00 00 00 00 00 00 00 00 00 00 00 00   ................
0050  00 00 00 00 00 00 00 00 00 00 00                  ...........

No.     Time           Source                Destination           Protocol Length Info
   4878 9.438831       host                  1.25.3                USB      27     URB_INTERRUPT in

Frame 4878: 27 bytes on wire (216 bits), 27 bytes captured (216 bits) on interface \\.\USBPcap1, id 0
USB URB
    [Source: host]
    [Destination: 1.25.3]
    USBPcap pseudoheader length: 27
    IRP ID: 0xffff8303221f5a20
    IRP USBD_STATUS: USBD_STATUS_SUCCESS (0x00000000)
    URB Function: URB_FUNCTION_BULK_OR_INTERRUPT_TRANSFER (0x0009)
    IRP information: 0x00, Direction: FDO -> PDO
        0000 000. = Reserved: 0x00
        .... ...0 = Direction: FDO -> PDO (0x0)
    URB bus id: 1
    Device address: 25
    Endpoint: 0x83, Direction: IN
        1... .... = Direction: IN (1)
        .... 0011 = Endpoint number: 3
    URB transfer type: URB_INTERRUPT (0x01)
    Packet Data Length: 0
    [Response in: 4889]
    [bInterfaceClass: HID (0x03)]

0000  1b 00 20 5a 1f 22 03 83 ff ff 00 00 00 00 09 00   .. Z."..........
0010  00 01 00 19 00 83 01 00 00 00 00                  ...........

No.     Time           Source                Destination           Protocol Length Info
   4881 9.447615       host                  1.25.4                USB      91     URB_INTERRUPT out

Frame 4881: 91 bytes on wire (728 bits), 91 bytes captured (728 bits) on interface \\.\USBPcap1, id 0
USB URB
    [Source: host]
    [Destination: 1.25.4]
    USBPcap pseudoheader length: 27
    IRP ID: 0xffff830316229650
    IRP USBD_STATUS: USBD_STATUS_SUCCESS (0x00000000)
    URB Function: URB_FUNCTION_BULK_OR_INTERRUPT_TRANSFER (0x0009)
    IRP information: 0x00, Direction: FDO -> PDO
        0000 000. = Reserved: 0x00
        .... ...0 = Direction: FDO -> PDO (0x0)
    URB bus id: 1
    Device address: 25
    Endpoint: 0x04, Direction: OUT
        0... .... = Direction: OUT (0)
        .... 0100 = Endpoint number: 4
    URB transfer type: URB_INTERRUPT (0x01)
    Packet Data Length: 64
    [Response in: 4882]
    [bInterfaceClass: HID (0x03)]
HID Data: 41800000000000000000000000000000000000000000000000000000000000000000000000000000000000000000000000000000000000000000000000000000

0000  1b 00 50 96 22 16 03 83 ff ff 00 00 00 00 09 00   ..P."...........
0010  00 01 00 19 00 04 01 40 00 00 00 41 80 00 00 00   .......@...A....
0020  00 00 00 00 00 00 00 00 00 00 00 00 00 00 00 00   ................
0030  00 00 00 00 00 00 00 00 00 00 00 00 00 00 00 00   ................
0040  00 00 00 00 00 00 00 00 00 00 00 00 00 00 00 00   ................
0050  00 00 00 00 00 00 00 00 00 00 00                  ...........

No.     Time           Source                Destination           Protocol Length Info
   4882 9.448765       1.25.4                host                  USB      27     URB_INTERRUPT out

Frame 4882: 27 bytes on wire (216 bits), 27 bytes captured (216 bits) on interface \\.\USBPcap1, id 0
USB URB
    [Source: 1.25.4]
    [Destination: host]
    USBPcap pseudoheader length: 27
    IRP ID: 0xffff830316229650
    IRP USBD_STATUS: USBD_STATUS_SUCCESS (0x00000000)
    URB Function: URB_FUNCTION_BULK_OR_INTERRUPT_TRANSFER (0x0009)
    IRP information: 0x01, Direction: PDO -> FDO
        0000 000. = Reserved: 0x00
        .... ...1 = Direction: PDO -> FDO (0x1)
    URB bus id: 1
    Device address: 25
    Endpoint: 0x04, Direction: OUT
        0... .... = Direction: OUT (0)
        .... 0100 = Endpoint number: 4
    URB transfer type: URB_INTERRUPT (0x01)
    Packet Data Length: 0
    [Request in: 4881]
    [Time from request: 0.001150000 seconds]
    [bInterfaceClass: HID (0x03)]

0000  1b 00 50 96 22 16 03 83 ff ff 00 00 00 00 09 00   ..P."...........
0010  01 01 00 19 00 04 01 00 00 00 00                  ...........

No.     Time           Source                Destination           Protocol Length Info
   4883 9.449754       1.25.3                host                  USB      91     URB_INTERRUPT in

Frame 4883: 91 bytes on wire (728 bits), 91 bytes captured (728 bits) on interface \\.\USBPcap1, id 0
USB URB
    [Source: 1.25.3]
    [Destination: host]
    USBPcap pseudoheader length: 27
    IRP ID: 0xffff83030ee9ea20
    IRP USBD_STATUS: USBD_STATUS_SUCCESS (0x00000000)
    URB Function: URB_FUNCTION_BULK_OR_INTERRUPT_TRANSFER (0x0009)
    IRP information: 0x01, Direction: PDO -> FDO
        0000 000. = Reserved: 0x00
        .... ...1 = Direction: PDO -> FDO (0x1)
    URB bus id: 1
    Device address: 25
    Endpoint: 0x83, Direction: IN
        1... .... = Direction: IN (1)
        .... 0011 = Endpoint number: 3
    URB transfer type: URB_INTERRUPT (0x01)
    Packet Data Length: 64
    [Request in: 4874]
    [Time from request: 0.020958000 seconds]
    [bInterfaceClass: HID (0x03)]
HID Data: 41800000000000000000000000000000000000000000000000000000000000000000000000000000000000000000000000000000000000000000000000000000

0000  1b 00 20 ea e9 0e 03 83 ff ff 00 00 00 00 09 00   .. .............
0010  01 01 00 19 00 83 01 40 00 00 00 41 80 00 00 00   .......@...A....
0020  00 00 00 00 00 00 00 00 00 00 00 00 00 00 00 00   ................
0030  00 00 00 00 00 00 00 00 00 00 00 00 00 00 00 00   ................
0040  00 00 00 00 00 00 00 00 00 00 00 00 00 00 00 00   ................
0050  00 00 00 00 00 00 00 00 00 00 00                  ...........

No.     Time           Source                Destination           Protocol Length Info
   4884 9.449793       host                  1.25.3                USB      27     URB_INTERRUPT in

Frame 4884: 27 bytes on wire (216 bits), 27 bytes captured (216 bits) on interface \\.\USBPcap1, id 0
USB URB
    [Source: host]
    [Destination: 1.25.3]
    USBPcap pseudoheader length: 27
    IRP ID: 0xffff83030ee9ea20
    IRP USBD_STATUS: USBD_STATUS_SUCCESS (0x00000000)
    URB Function: URB_FUNCTION_BULK_OR_INTERRUPT_TRANSFER (0x0009)
    IRP information: 0x00, Direction: FDO -> PDO
        0000 000. = Reserved: 0x00
        .... ...0 = Direction: FDO -> PDO (0x0)
    URB bus id: 1
    Device address: 25
    Endpoint: 0x83, Direction: IN
        1... .... = Direction: IN (1)
        .... 0011 = Endpoint number: 3
    URB transfer type: URB_INTERRUPT (0x01)
    Packet Data Length: 0
    [Response in: 11857]
    [bInterfaceClass: HID (0x03)]

0000  1b 00 20 ea e9 0e 03 83 ff ff 00 00 00 00 09 00   .. .............
0010  00 01 00 19 00 83 01 00 00 00 00                  ...........

No.     Time           Source                Destination           Protocol Length Info
   4887 9.456455       host                  1.25.4                USB      91     URB_INTERRUPT out

Frame 4887: 91 bytes on wire (728 bits), 91 bytes captured (728 bits) on interface \\.\USBPcap1, id 0
USB URB
    [Source: host]
    [Destination: 1.25.4]
    USBPcap pseudoheader length: 27
    IRP ID: 0xffff83030fa9e4b0
    IRP USBD_STATUS: USBD_STATUS_SUCCESS (0x00000000)
    URB Function: URB_FUNCTION_BULK_OR_INTERRUPT_TRANSFER (0x0009)
    IRP information: 0x00, Direction: FDO -> PDO
        0000 000. = Reserved: 0x00
        .... ...0 = Direction: FDO -> PDO (0x0)
    URB bus id: 1
    Device address: 25
    Endpoint: 0x04, Direction: OUT
        0... .... = Direction: OUT (0)
        .... 0100 = Endpoint number: 4
    URB transfer type: URB_INTERRUPT (0x01)
    Packet Data Length: 64
    [Response in: 4888]
    [bInterfaceClass: HID (0x03)]
HID Data: 51280000ff0000000000000000000000000000000000000000000000000000000000000000000000000000000000000000000000000000000000000000000000

0000  1b 00 b0 e4 a9 0f 03 83 ff ff 00 00 00 00 09 00   ................
0010  00 01 00 19 00 04 01 40 00 00 00 51 28 00 00 ff   .......@...Q(...
0020  00 00 00 00 00 00 00 00 00 00 00 00 00 00 00 00   ................
0030  00 00 00 00 00 00 00 00 00 00 00 00 00 00 00 00   ................
0040  00 00 00 00 00 00 00 00 00 00 00 00 00 00 00 00   ................
0050  00 00 00 00 00 00 00 00 00 00 00                  ...........

No.     Time           Source                Destination           Protocol Length Info
   4888 9.456749       1.25.4                host                  USB      27     URB_INTERRUPT out

Frame 4888: 27 bytes on wire (216 bits), 27 bytes captured (216 bits) on interface \\.\USBPcap1, id 0
USB URB
    [Source: 1.25.4]
    [Destination: host]
    USBPcap pseudoheader length: 27
    IRP ID: 0xffff83030fa9e4b0
    IRP USBD_STATUS: USBD_STATUS_SUCCESS (0x00000000)
    URB Function: URB_FUNCTION_BULK_OR_INTERRUPT_TRANSFER (0x0009)
    IRP information: 0x01, Direction: PDO -> FDO
        0000 000. = Reserved: 0x00
        .... ...1 = Direction: PDO -> FDO (0x1)
    URB bus id: 1
    Device address: 25
    Endpoint: 0x04, Direction: OUT
        0... .... = Direction: OUT (0)
        .... 0100 = Endpoint number: 4
    URB transfer type: URB_INTERRUPT (0x01)
    Packet Data Length: 0
    [Request in: 4887]
    [Time from request: 0.000294000 seconds]
    [bInterfaceClass: HID (0x03)]

0000  1b 00 b0 e4 a9 0f 03 83 ff ff 00 00 00 00 09 00   ................
0010  01 01 00 19 00 04 01 00 00 00 00                  ...........

No.     Time           Source                Destination           Protocol Length Info
   4889 9.457755       1.25.3                host                  USB      91     URB_INTERRUPT in

Frame 4889: 91 bytes on wire (728 bits), 91 bytes captured (728 bits) on interface \\.\USBPcap1, id 0
USB URB
    [Source: 1.25.3]
    [Destination: host]
    USBPcap pseudoheader length: 27
    IRP ID: 0xffff8303221f5a20
    IRP USBD_STATUS: USBD_STATUS_SUCCESS (0x00000000)
    URB Function: URB_FUNCTION_BULK_OR_INTERRUPT_TRANSFER (0x0009)
    IRP information: 0x01, Direction: PDO -> FDO
        0000 000. = Reserved: 0x00
        .... ...1 = Direction: PDO -> FDO (0x1)
    URB bus id: 1
    Device address: 25
    Endpoint: 0x83, Direction: IN
        1... .... = Direction: IN (1)
        .... 0011 = Endpoint number: 3
    URB transfer type: URB_INTERRUPT (0x01)
    Packet Data Length: 64
    [Request in: 4878]
    [Time from request: 0.018924000 seconds]
    [bInterfaceClass: HID (0x03)]
HID Data: 51280000000000000000000000000000000000000000000000000000000000000000000000000000000000000000000000000000000000000000000000000000

0000  1b 00 20 5a 1f 22 03 83 ff ff 00 00 00 00 09 00   .. Z."..........
0010  01 01 00 19 00 83 01 40 00 00 00 51 28 00 00 00   .......@...Q(...
0020  00 00 00 00 00 00 00 00 00 00 00 00 00 00 00 00   ................
0030  00 00 00 00 00 00 00 00 00 00 00 00 00 00 00 00   ................
0040  00 00 00 00 00 00 00 00 00 00 00 00 00 00 00 00   ................
0050  00 00 00 00 00 00 00 00 00 00 00                  ...........

No.     Time           Source                Destination           Protocol Length Info
   4890 9.457800       host                  1.25.3                USB      27     URB_INTERRUPT in

Frame 4890: 27 bytes on wire (216 bits), 27 bytes captured (216 bits) on interface \\.\USBPcap1, id 0
USB URB
    [Source: host]
    [Destination: 1.25.3]
    USBPcap pseudoheader length: 27
    IRP ID: 0xffff8303221f5a20
    IRP USBD_STATUS: USBD_STATUS_SUCCESS (0x00000000)
    URB Function: URB_FUNCTION_BULK_OR_INTERRUPT_TRANSFER (0x0009)
    IRP information: 0x00, Direction: FDO -> PDO
        0000 000. = Reserved: 0x00
        .... ...0 = Direction: FDO -> PDO (0x0)
    URB bus id: 1
    Device address: 25
    Endpoint: 0x83, Direction: IN
        1... .... = Direction: IN (1)
        .... 0011 = Endpoint number: 3
    URB transfer type: URB_INTERRUPT (0x01)
    Packet Data Length: 0
    [Response in: 11861]
    [bInterfaceClass: HID (0x03)]

0000  1b 00 20 5a 1f 22 03 83 ff ff 00 00 00 00 09 00   .. Z."..........
0010  00 01 00 19 00 83 01 00 00 00 00                  ...........

No.     Time           Source                Destination           Protocol Length Info
  11855 17.998471      host                  1.25.4                USB      91     URB_INTERRUPT out

Frame 11855: 91 bytes on wire (728 bits), 91 bytes captured (728 bits) on interface \\.\USBPcap1, id 0
USB URB
    [Source: host]
    [Destination: 1.25.4]
    USBPcap pseudoheader length: 27
    IRP ID: 0xffff830311dfc010
    IRP USBD_STATUS: USBD_STATUS_SUCCESS (0x00000000)
    URB Function: URB_FUNCTION_BULK_OR_INTERRUPT_TRANSFER (0x0009)
    IRP information: 0x00, Direction: FDO -> PDO
        0000 000. = Reserved: 0x00
        .... ...0 = Direction: FDO -> PDO (0x0)
    URB bus id: 1
    Device address: 25
    Endpoint: 0x04, Direction: OUT
        0... .... = Direction: OUT (0)
        .... 0100 = Endpoint number: 4
    URB transfer type: URB_INTERRUPT (0x01)
    Packet Data Length: 64
    [Response in: 11856]
    [bInterfaceClass: HID (0x03)]
HID Data: 568100000100000002000000bbbbbbbb000000000000000000000000000000000000000000000000000000000000000000000000000000000000000000000000

0000  1b 00 10 c0 df 11 03 83 ff ff 00 00 00 00 09 00   ................
0010  00 01 00 19 00 04 01 40 00 00 00 56 81 00 00 01   .......@...V....
0020  00 00 00 02 00 00 00 bb bb bb bb 00 00 00 00 00   ................
0030  00 00 00 00 00 00 00 00 00 00 00 00 00 00 00 00   ................
0040  00 00 00 00 00 00 00 00 00 00 00 00 00 00 00 00   ................
0050  00 00 00 00 00 00 00 00 00 00 00                  ...........

No.     Time           Source                Destination           Protocol Length Info
  11856 17.998799      1.25.4                host                  USB      27     URB_INTERRUPT out

Frame 11856: 27 bytes on wire (216 bits), 27 bytes captured (216 bits) on interface \\.\USBPcap1, id 0
USB URB
    [Source: 1.25.4]
    [Destination: host]
    USBPcap pseudoheader length: 27
    IRP ID: 0xffff830311dfc010
    IRP USBD_STATUS: USBD_STATUS_SUCCESS (0x00000000)
    URB Function: URB_FUNCTION_BULK_OR_INTERRUPT_TRANSFER (0x0009)
    IRP information: 0x01, Direction: PDO -> FDO
        0000 000. = Reserved: 0x00
        .... ...1 = Direction: PDO -> FDO (0x1)
    URB bus id: 1
    Device address: 25
    Endpoint: 0x04, Direction: OUT
        0... .... = Direction: OUT (0)
        .... 0100 = Endpoint number: 4
    URB transfer type: URB_INTERRUPT (0x01)
    Packet Data Length: 0
    [Request in: 11855]
    [Time from request: 0.000328000 seconds]
    [bInterfaceClass: HID (0x03)]

0000  1b 00 10 c0 df 11 03 83 ff ff 00 00 00 00 09 00   ................
0010  01 01 00 19 00 04 01 00 00 00 00                  ...........

No.     Time           Source                Destination           Protocol Length Info
  11857 17.999778      1.25.3                host                  USB      91     URB_INTERRUPT in

Frame 11857: 91 bytes on wire (728 bits), 91 bytes captured (728 bits) on interface \\.\USBPcap1, id 0
USB URB
    [Source: 1.25.3]
    [Destination: host]
    USBPcap pseudoheader length: 27
    IRP ID: 0xffff83030ee9ea20
    IRP USBD_STATUS: USBD_STATUS_SUCCESS (0x00000000)
    URB Function: URB_FUNCTION_BULK_OR_INTERRUPT_TRANSFER (0x0009)
    IRP information: 0x01, Direction: PDO -> FDO
        0000 000. = Reserved: 0x00
        .... ...1 = Direction: PDO -> FDO (0x1)
    URB bus id: 1
    Device address: 25
    Endpoint: 0x83, Direction: IN
        1... .... = Direction: IN (1)
        .... 0011 = Endpoint number: 3
    URB transfer type: URB_INTERRUPT (0x01)
    Packet Data Length: 64
    [Request in: 4884]
    [Time from request: 8.549985000 seconds]
    [bInterfaceClass: HID (0x03)]
HID Data: 56810000000000000000000000000000000000000000000000000000000000000000000000000000000000000000000000000000000000000000000000000000

0000  1b 00 20 ea e9 0e 03 83 ff ff 00 00 00 00 09 00   .. .............
0010  01 01 00 19 00 83 01 40 00 00 00 56 81 00 00 00   .......@...V....
0020  00 00 00 00 00 00 00 00 00 00 00 00 00 00 00 00   ................
0030  00 00 00 00 00 00 00 00 00 00 00 00 00 00 00 00   ................
0040  00 00 00 00 00 00 00 00 00 00 00 00 00 00 00 00   ................
0050  00 00 00 00 00 00 00 00 00 00 00                  ...........

No.     Time           Source                Destination           Protocol Length Info
  11858 17.999825      host                  1.25.3                USB      27     URB_INTERRUPT in

Frame 11858: 27 bytes on wire (216 bits), 27 bytes captured (216 bits) on interface \\.\USBPcap1, id 0
USB URB
    [Source: host]
    [Destination: 1.25.3]
    USBPcap pseudoheader length: 27
    IRP ID: 0xffff83030ee9ea20
    IRP USBD_STATUS: USBD_STATUS_SUCCESS (0x00000000)
    URB Function: URB_FUNCTION_BULK_OR_INTERRUPT_TRANSFER (0x0009)
    IRP information: 0x00, Direction: FDO -> PDO
        0000 000. = Reserved: 0x00
        .... ...0 = Direction: FDO -> PDO (0x0)
    URB bus id: 1
    Device address: 25
    Endpoint: 0x83, Direction: IN
        1... .... = Direction: IN (1)
        .... 0011 = Endpoint number: 3
    URB transfer type: URB_INTERRUPT (0x01)
    Packet Data Length: 0
    [Response in: 11865]
    [bInterfaceClass: HID (0x03)]

0000  1b 00 20 ea e9 0e 03 83 ff ff 00 00 00 00 09 00   .. .............
0010  00 01 00 19 00 83 01 00 00 00 00                  ...........

No.     Time           Source                Destination           Protocol Length Info
  11859 18.006976      host                  1.25.4                USB      91     URB_INTERRUPT out

Frame 11859: 91 bytes on wire (728 bits), 91 bytes captured (728 bits) on interface \\.\USBPcap1, id 0
USB URB
    [Source: host]
    [Destination: 1.25.4]
    USBPcap pseudoheader length: 27
    IRP ID: 0xffff830308e03010
    IRP USBD_STATUS: USBD_STATUS_SUCCESS (0x00000000)
    URB Function: URB_FUNCTION_BULK_OR_INTERRUPT_TRANSFER (0x0009)
    IRP information: 0x00, Direction: FDO -> PDO
        0000 000. = Reserved: 0x00
        .... ...0 = Direction: FDO -> PDO (0x0)
    URB bus id: 1
    Device address: 25
    Endpoint: 0x04, Direction: OUT
        0... .... = Direction: OUT (0)
        .... 0100 = Endpoint number: 4
    URB transfer type: URB_INTERRUPT (0x01)
    Packet Data Length: 64
    [Response in: 11860]
    [bInterfaceClass: HID (0x03)]
HID Data: 568300000100000080010000ff0000000000ffff00000000d752ff00000000000000000000000000000000000000000000000000000000000000000000000000

0000  1b 00 10 30 e0 08 03 83 ff ff 00 00 00 00 09 00   ...0............
0010  00 01 00 19 00 04 01 40 00 00 00 56 83 00 00 01   .......@...V....
0020  00 00 00 80 01 00 00 ff 00 00 00 00 00 ff ff 00   ................
0030  00 00 00 d7 52 ff 00 00 00 00 00 00 00 00 00 00   ....R...........
0040  00 00 00 00 00 00 00 00 00 00 00 00 00 00 00 00   ................
0050  00 00 00 00 00 00 00 00 00 00 00                  ...........

No.     Time           Source                Destination           Protocol Length Info
  11860 18.007798      1.25.4                host                  USB      27     URB_INTERRUPT out

Frame 11860: 27 bytes on wire (216 bits), 27 bytes captured (216 bits) on interface \\.\USBPcap1, id 0
USB URB
    [Source: 1.25.4]
    [Destination: host]
    USBPcap pseudoheader length: 27
    IRP ID: 0xffff830308e03010
    IRP USBD_STATUS: USBD_STATUS_SUCCESS (0x00000000)
    URB Function: URB_FUNCTION_BULK_OR_INTERRUPT_TRANSFER (0x0009)
    IRP information: 0x01, Direction: PDO -> FDO
        0000 000. = Reserved: 0x00
        .... ...1 = Direction: PDO -> FDO (0x1)
    URB bus id: 1
    Device address: 25
    Endpoint: 0x04, Direction: OUT
        0... .... = Direction: OUT (0)
        .... 0100 = Endpoint number: 4
    URB transfer type: URB_INTERRUPT (0x01)
    Packet Data Length: 0
    [Request in: 11859]
    [Time from request: 0.000822000 seconds]
    [bInterfaceClass: HID (0x03)]

0000  1b 00 10 30 e0 08 03 83 ff ff 00 00 00 00 09 00   ...0............
0010  01 01 00 19 00 04 01 00 00 00 00                  ...........

No.     Time           Source                Destination           Protocol Length Info
  11861 18.008765      1.25.3                host                  USB      91     URB_INTERRUPT in

Frame 11861: 91 bytes on wire (728 bits), 91 bytes captured (728 bits) on interface \\.\USBPcap1, id 0
USB URB
    [Source: 1.25.3]
    [Destination: host]
    USBPcap pseudoheader length: 27
    IRP ID: 0xffff8303221f5a20
    IRP USBD_STATUS: USBD_STATUS_SUCCESS (0x00000000)
    URB Function: URB_FUNCTION_BULK_OR_INTERRUPT_TRANSFER (0x0009)
    IRP information: 0x01, Direction: PDO -> FDO
        0000 000. = Reserved: 0x00
        .... ...1 = Direction: PDO -> FDO (0x1)
    URB bus id: 1
    Device address: 25
    Endpoint: 0x83, Direction: IN
        1... .... = Direction: IN (1)
        .... 0011 = Endpoint number: 3
    URB transfer type: URB_INTERRUPT (0x01)
    Packet Data Length: 64
    [Request in: 4890]
    [Time from request: 8.550965000 seconds]
    [bInterfaceClass: HID (0x03)]
HID Data: 56830000000000000000000000000000000000000000000000000000000000000000000000000000000000000000000000000000000000000000000000000000

0000  1b 00 20 5a 1f 22 03 83 ff ff 00 00 00 00 09 00   .. Z."..........
0010  01 01 00 19 00 83 01 40 00 00 00 56 83 00 00 00   .......@...V....
0020  00 00 00 00 00 00 00 00 00 00 00 00 00 00 00 00   ................
0030  00 00 00 00 00 00 00 00 00 00 00 00 00 00 00 00   ................
0040  00 00 00 00 00 00 00 00 00 00 00 00 00 00 00 00   ................
0050  00 00 00 00 00 00 00 00 00 00 00                  ...........

No.     Time           Source                Destination           Protocol Length Info
  11862 18.008894      host                  1.25.3                USB      27     URB_INTERRUPT in

Frame 11862: 27 bytes on wire (216 bits), 27 bytes captured (216 bits) on interface \\.\USBPcap1, id 0
USB URB
    [Source: host]
    [Destination: 1.25.3]
    USBPcap pseudoheader length: 27
    IRP ID: 0xffff8303221f5a20
    IRP USBD_STATUS: USBD_STATUS_SUCCESS (0x00000000)
    URB Function: URB_FUNCTION_BULK_OR_INTERRUPT_TRANSFER (0x0009)
    IRP information: 0x00, Direction: FDO -> PDO
        0000 000. = Reserved: 0x00
        .... ...0 = Direction: FDO -> PDO (0x0)
    URB bus id: 1
    Device address: 25
    Endpoint: 0x83, Direction: IN
        1... .... = Direction: IN (1)
        .... 0011 = Endpoint number: 3
    URB transfer type: URB_INTERRUPT (0x01)
    Packet Data Length: 0
    [Response in: 11869]
    [bInterfaceClass: HID (0x03)]

0000  1b 00 20 5a 1f 22 03 83 ff ff 00 00 00 00 09 00   .. Z."..........
0010  00 01 00 19 00 83 01 00 00 00 00                  ...........

No.     Time           Source                Destination           Protocol Length Info
  11863 18.018636      host                  1.25.4                USB      91     URB_INTERRUPT out

Frame 11863: 91 bytes on wire (728 bits), 91 bytes captured (728 bits) on interface \\.\USBPcap1, id 0
USB URB
    [Source: host]
    [Destination: 1.25.4]
    USBPcap pseudoheader length: 27
    IRP ID: 0xffff830310297990
    IRP USBD_STATUS: USBD_STATUS_SUCCESS (0x00000000)
    URB Function: URB_FUNCTION_BULK_OR_INTERRUPT_TRANSFER (0x0009)
    IRP information: 0x00, Direction: FDO -> PDO
        0000 000. = Reserved: 0x00
        .... ...0 = Direction: FDO -> PDO (0x0)
    URB bus id: 1
    Device address: 25
    Endpoint: 0x04, Direction: OUT
        0... .... = Direction: OUT (0)
        .... 0100 = Endpoint number: 4
    URB transfer type: URB_INTERRUPT (0x01)
    Packet Data Length: 64
    [Response in: 11864]
    [bInterfaceClass: HID (0x03)]
HID Data: 56830100000000000000000000000000000000000000000000000000000000000000000000000000000000000000000000000000000000000000000000000000

0000  1b 00 90 79 29 10 03 83 ff ff 00 00 00 00 09 00   ...y)...........
0010  00 01 00 19 00 04 01 40 00 00 00 56 83 01 00 00   .......@...V....
0020  00 00 00 00 00 00 00 00 00 00 00 00 00 00 00 00   ................
0030  00 00 00 00 00 00 00 00 00 00 00 00 00 00 00 00   ................
0040  00 00 00 00 00 00 00 00 00 00 00 00 00 00 00 00   ................
0050  00 00 00 00 00 00 00 00 00 00 00                  ...........

No.     Time           Source                Destination           Protocol Length Info
  11864 18.019784      1.25.4                host                  USB      27     URB_INTERRUPT out

Frame 11864: 27 bytes on wire (216 bits), 27 bytes captured (216 bits) on interface \\.\USBPcap1, id 0
USB URB
    [Source: 1.25.4]
    [Destination: host]
    USBPcap pseudoheader length: 27
    IRP ID: 0xffff830310297990
    IRP USBD_STATUS: USBD_STATUS_SUCCESS (0x00000000)
    URB Function: URB_FUNCTION_BULK_OR_INTERRUPT_TRANSFER (0x0009)
    IRP information: 0x01, Direction: PDO -> FDO
        0000 000. = Reserved: 0x00
        .... ...1 = Direction: PDO -> FDO (0x1)
    URB bus id: 1
    Device address: 25
    Endpoint: 0x04, Direction: OUT
        0... .... = Direction: OUT (0)
        .... 0100 = Endpoint number: 4
    URB transfer type: URB_INTERRUPT (0x01)
    Packet Data Length: 0
    [Request in: 11863]
    [Time from request: 0.001148000 seconds]
    [bInterfaceClass: HID (0x03)]

0000  1b 00 90 79 29 10 03 83 ff ff 00 00 00 00 09 00   ...y)...........
0010  01 01 00 19 00 04 01 00 00 00 00                  ...........

No.     Time           Source                Destination           Protocol Length Info
  11865 18.020771      1.25.3                host                  USB      91     URB_INTERRUPT in

Frame 11865: 91 bytes on wire (728 bits), 91 bytes captured (728 bits) on interface \\.\USBPcap1, id 0
USB URB
    [Source: 1.25.3]
    [Destination: host]
    USBPcap pseudoheader length: 27
    IRP ID: 0xffff83030ee9ea20
    IRP USBD_STATUS: USBD_STATUS_SUCCESS (0x00000000)
    URB Function: URB_FUNCTION_BULK_OR_INTERRUPT_TRANSFER (0x0009)
    IRP information: 0x01, Direction: PDO -> FDO
        0000 000. = Reserved: 0x00
        .... ...1 = Direction: PDO -> FDO (0x1)
    URB bus id: 1
    Device address: 25
    Endpoint: 0x83, Direction: IN
        1... .... = Direction: IN (1)
        .... 0011 = Endpoint number: 3
    URB transfer type: URB_INTERRUPT (0x01)
    Packet Data Length: 64
    [Request in: 11858]
    [Time from request: 0.020946000 seconds]
    [bInterfaceClass: HID (0x03)]
HID Data: 56830100000000000000000000000000000000000000000000000000000000000000000000000000000000000000000000000000000000000000000000000000

0000  1b 00 20 ea e9 0e 03 83 ff ff 00 00 00 00 09 00   .. .............
0010  01 01 00 19 00 83 01 40 00 00 00 56 83 01 00 00   .......@...V....
0020  00 00 00 00 00 00 00 00 00 00 00 00 00 00 00 00   ................
0030  00 00 00 00 00 00 00 00 00 00 00 00 00 00 00 00   ................
0040  00 00 00 00 00 00 00 00 00 00 00 00 00 00 00 00   ................
0050  00 00 00 00 00 00 00 00 00 00 00                  ...........

No.     Time           Source                Destination           Protocol Length Info
  11866 18.020811      host                  1.25.3                USB      27     URB_INTERRUPT in

Frame 11866: 27 bytes on wire (216 bits), 27 bytes captured (216 bits) on interface \\.\USBPcap1, id 0
USB URB
    [Source: host]
    [Destination: 1.25.3]
    USBPcap pseudoheader length: 27
    IRP ID: 0xffff83030ee9ea20
    IRP USBD_STATUS: USBD_STATUS_SUCCESS (0x00000000)
    URB Function: URB_FUNCTION_BULK_OR_INTERRUPT_TRANSFER (0x0009)
    IRP information: 0x00, Direction: FDO -> PDO
        0000 000. = Reserved: 0x00
        .... ...0 = Direction: FDO -> PDO (0x0)
    URB bus id: 1
    Device address: 25
    Endpoint: 0x83, Direction: IN
        1... .... = Direction: IN (1)
        .... 0011 = Endpoint number: 3
    URB transfer type: URB_INTERRUPT (0x01)
    Packet Data Length: 0
    [Response in: 11873]
    [bInterfaceClass: HID (0x03)]

0000  1b 00 20 ea e9 0e 03 83 ff ff 00 00 00 00 09 00   .. .............
0010  00 01 00 19 00 83 01 00 00 00 00                  ...........

No.     Time           Source                Destination           Protocol Length Info
  11867 18.027388      host                  1.25.4                USB      91     URB_INTERRUPT out

Frame 11867: 91 bytes on wire (728 bits), 91 bytes captured (728 bits) on interface \\.\USBPcap1, id 0
USB URB
    [Source: host]
    [Destination: 1.25.4]
    USBPcap pseudoheader length: 27
    IRP ID: 0xffff8303109b5010
    IRP USBD_STATUS: USBD_STATUS_SUCCESS (0x00000000)
    URB Function: URB_FUNCTION_BULK_OR_INTERRUPT_TRANSFER (0x0009)
    IRP information: 0x00, Direction: FDO -> PDO
        0000 000. = Reserved: 0x00
        .... ...0 = Direction: FDO -> PDO (0x0)
    URB bus id: 1
    Device address: 25
    Endpoint: 0x04, Direction: OUT
        0... .... = Direction: OUT (0)
        .... 0100 = Endpoint number: 4
    URB transfer type: URB_INTERRUPT (0x01)
    Packet Data Length: 64
    [Response in: 11868]
    [bInterfaceClass: HID (0x03)]
HID Data: 41800000000000000000000000000000000000000000000000000000000000000000000000000000000000000000000000000000000000000000000000000000

0000  1b 00 10 50 9b 10 03 83 ff ff 00 00 00 00 09 00   ...P............
0010  00 01 00 19 00 04 01 40 00 00 00 41 80 00 00 00   .......@...A....
0020  00 00 00 00 00 00 00 00 00 00 00 00 00 00 00 00   ................
0030  00 00 00 00 00 00 00 00 00 00 00 00 00 00 00 00   ................
0040  00 00 00 00 00 00 00 00 00 00 00 00 00 00 00 00   ................
0050  00 00 00 00 00 00 00 00 00 00 00                  ...........

No.     Time           Source                Destination           Protocol Length Info
  11868 18.027767      1.25.4                host                  USB      27     URB_INTERRUPT out

Frame 11868: 27 bytes on wire (216 bits), 27 bytes captured (216 bits) on interface \\.\USBPcap1, id 0
USB URB
    [Source: 1.25.4]
    [Destination: host]
    USBPcap pseudoheader length: 27
    IRP ID: 0xffff8303109b5010
    IRP USBD_STATUS: USBD_STATUS_SUCCESS (0x00000000)
    URB Function: URB_FUNCTION_BULK_OR_INTERRUPT_TRANSFER (0x0009)
    IRP information: 0x01, Direction: PDO -> FDO
        0000 000. = Reserved: 0x00
        .... ...1 = Direction: PDO -> FDO (0x1)
    URB bus id: 1
    Device address: 25
    Endpoint: 0x04, Direction: OUT
        0... .... = Direction: OUT (0)
        .... 0100 = Endpoint number: 4
    URB transfer type: URB_INTERRUPT (0x01)
    Packet Data Length: 0
    [Request in: 11867]
    [Time from request: 0.000379000 seconds]
    [bInterfaceClass: HID (0x03)]

0000  1b 00 10 50 9b 10 03 83 ff ff 00 00 00 00 09 00   ...P............
0010  01 01 00 19 00 04 01 00 00 00 00                  ...........

No.     Time           Source                Destination           Protocol Length Info
  11869 18.028796      1.25.3                host                  USB      91     URB_INTERRUPT in

Frame 11869: 91 bytes on wire (728 bits), 91 bytes captured (728 bits) on interface \\.\USBPcap1, id 0
USB URB
    [Source: 1.25.3]
    [Destination: host]
    USBPcap pseudoheader length: 27
    IRP ID: 0xffff8303221f5a20
    IRP USBD_STATUS: USBD_STATUS_SUCCESS (0x00000000)
    URB Function: URB_FUNCTION_BULK_OR_INTERRUPT_TRANSFER (0x0009)
    IRP information: 0x01, Direction: PDO -> FDO
        0000 000. = Reserved: 0x00
        .... ...1 = Direction: PDO -> FDO (0x1)
    URB bus id: 1
    Device address: 25
    Endpoint: 0x83, Direction: IN
        1... .... = Direction: IN (1)
        .... 0011 = Endpoint number: 3
    URB transfer type: URB_INTERRUPT (0x01)
    Packet Data Length: 64
    [Request in: 11862]
    [Time from request: 0.019902000 seconds]
    [bInterfaceClass: HID (0x03)]
HID Data: 41800000000000000000000000000000000000000000000000000000000000000000000000000000000000000000000000000000000000000000000000000000

0000  1b 00 20 5a 1f 22 03 83 ff ff 00 00 00 00 09 00   .. Z."..........
0010  01 01 00 19 00 83 01 40 00 00 00 41 80 00 00 00   .......@...A....
0020  00 00 00 00 00 00 00 00 00 00 00 00 00 00 00 00   ................
0030  00 00 00 00 00 00 00 00 00 00 00 00 00 00 00 00   ................
0040  00 00 00 00 00 00 00 00 00 00 00 00 00 00 00 00   ................
0050  00 00 00 00 00 00 00 00 00 00 00                  ...........

No.     Time           Source                Destination           Protocol Length Info
  11870 18.028846      host                  1.25.3                USB      27     URB_INTERRUPT in

Frame 11870: 27 bytes on wire (216 bits), 27 bytes captured (216 bits) on interface \\.\USBPcap1, id 0
USB URB
    [Source: host]
    [Destination: 1.25.3]
    USBPcap pseudoheader length: 27
    IRP ID: 0xffff8303221f5a20
    IRP USBD_STATUS: USBD_STATUS_SUCCESS (0x00000000)
    URB Function: URB_FUNCTION_BULK_OR_INTERRUPT_TRANSFER (0x0009)
    IRP information: 0x00, Direction: FDO -> PDO
        0000 000. = Reserved: 0x00
        .... ...0 = Direction: FDO -> PDO (0x0)
    URB bus id: 1
    Device address: 25
    Endpoint: 0x83, Direction: IN
        1... .... = Direction: IN (1)
        .... 0011 = Endpoint number: 3
    URB transfer type: URB_INTERRUPT (0x01)
    Packet Data Length: 0
    [Response in: 12215]
    [bInterfaceClass: HID (0x03)]

0000  1b 00 20 5a 1f 22 03 83 ff ff 00 00 00 00 09 00   .. Z."..........
0010  00 01 00 19 00 83 01 00 00 00 00                  ...........

No.     Time           Source                Destination           Protocol Length Info
  11871 18.036731      host                  1.25.4                USB      91     URB_INTERRUPT out

Frame 11871: 91 bytes on wire (728 bits), 91 bytes captured (728 bits) on interface \\.\USBPcap1, id 0
USB URB
    [Source: host]
    [Destination: 1.25.4]
    USBPcap pseudoheader length: 27
    IRP ID: 0xffff830322be9410
    IRP USBD_STATUS: USBD_STATUS_SUCCESS (0x00000000)
    URB Function: URB_FUNCTION_BULK_OR_INTERRUPT_TRANSFER (0x0009)
    IRP information: 0x00, Direction: FDO -> PDO
        0000 000. = Reserved: 0x00
        .... ...0 = Direction: FDO -> PDO (0x0)
    URB bus id: 1
    Device address: 25
    Endpoint: 0x04, Direction: OUT
        0... .... = Direction: OUT (0)
        .... 0100 = Endpoint number: 4
    URB transfer type: URB_INTERRUPT (0x01)
    Packet Data Length: 64
    [Response in: 11872]
    [bInterfaceClass: HID (0x03)]
HID Data: 51280000ff0000000000000000000000000000000000000000000000000000000000000000000000000000000000000000000000000000000000000000000000

0000  1b 00 10 94 be 22 03 83 ff ff 00 00 00 00 09 00   ....."..........
0010  00 01 00 19 00 04 01 40 00 00 00 51 28 00 00 ff   .......@...Q(...
0020  00 00 00 00 00 00 00 00 00 00 00 00 00 00 00 00   ................
0030  00 00 00 00 00 00 00 00 00 00 00 00 00 00 00 00   ................
0040  00 00 00 00 00 00 00 00 00 00 00 00 00 00 00 00   ................
0050  00 00 00 00 00 00 00 00 00 00 00                  ...........

No.     Time           Source                Destination           Protocol Length Info
  11872 18.037785      1.25.4                host                  USB      27     URB_INTERRUPT out

Frame 11872: 27 bytes on wire (216 bits), 27 bytes captured (216 bits) on interface \\.\USBPcap1, id 0
USB URB
    [Source: 1.25.4]
    [Destination: host]
    USBPcap pseudoheader length: 27
    IRP ID: 0xffff830322be9410
    IRP USBD_STATUS: USBD_STATUS_SUCCESS (0x00000000)
    URB Function: URB_FUNCTION_BULK_OR_INTERRUPT_TRANSFER (0x0009)
    IRP information: 0x01, Direction: PDO -> FDO
        0000 000. = Reserved: 0x00
        .... ...1 = Direction: PDO -> FDO (0x1)
    URB bus id: 1
    Device address: 25
    Endpoint: 0x04, Direction: OUT
        0... .... = Direction: OUT (0)
        .... 0100 = Endpoint number: 4
    URB transfer type: URB_INTERRUPT (0x01)
    Packet Data Length: 0
    [Request in: 11871]
    [Time from request: 0.001054000 seconds]
    [bInterfaceClass: HID (0x03)]

0000  1b 00 10 94 be 22 03 83 ff ff 00 00 00 00 09 00   ....."..........
0010  01 01 00 19 00 04 01 00 00 00 00                  ...........

No.     Time           Source                Destination           Protocol Length Info
  11873 18.038780      1.25.3                host                  USB      91     URB_INTERRUPT in

Frame 11873: 91 bytes on wire (728 bits), 91 bytes captured (728 bits) on interface \\.\USBPcap1, id 0
USB URB
    [Source: 1.25.3]
    [Destination: host]
    USBPcap pseudoheader length: 27
    IRP ID: 0xffff83030ee9ea20
    IRP USBD_STATUS: USBD_STATUS_SUCCESS (0x00000000)
    URB Function: URB_FUNCTION_BULK_OR_INTERRUPT_TRANSFER (0x0009)
    IRP information: 0x01, Direction: PDO -> FDO
        0000 000. = Reserved: 0x00
        .... ...1 = Direction: PDO -> FDO (0x1)
    URB bus id: 1
    Device address: 25
    Endpoint: 0x83, Direction: IN
        1... .... = Direction: IN (1)
        .... 0011 = Endpoint number: 3
    URB transfer type: URB_INTERRUPT (0x01)
    Packet Data Length: 64
    [Request in: 11866]
    [Time from request: 0.017969000 seconds]
    [bInterfaceClass: HID (0x03)]
HID Data: 51280000000000000000000000000000000000000000000000000000000000000000000000000000000000000000000000000000000000000000000000000000

0000  1b 00 20 ea e9 0e 03 83 ff ff 00 00 00 00 09 00   .. .............
0010  01 01 00 19 00 83 01 40 00 00 00 51 28 00 00 00   .......@...Q(...
0020  00 00 00 00 00 00 00 00 00 00 00 00 00 00 00 00   ................
0030  00 00 00 00 00 00 00 00 00 00 00 00 00 00 00 00   ................
0040  00 00 00 00 00 00 00 00 00 00 00 00 00 00 00 00   ................
0050  00 00 00 00 00 00 00 00 00 00 00                  ...........

No.     Time           Source                Destination           Protocol Length Info
  11874 18.038818      host                  1.25.3                USB      27     URB_INTERRUPT in

Frame 11874: 27 bytes on wire (216 bits), 27 bytes captured (216 bits) on interface \\.\USBPcap1, id 0
USB URB
    [Source: host]
    [Destination: 1.25.3]
    USBPcap pseudoheader length: 27
    IRP ID: 0xffff83030ee9ea20
    IRP USBD_STATUS: USBD_STATUS_SUCCESS (0x00000000)
    URB Function: URB_FUNCTION_BULK_OR_INTERRUPT_TRANSFER (0x0009)
    IRP information: 0x00, Direction: FDO -> PDO
        0000 000. = Reserved: 0x00
        .... ...0 = Direction: FDO -> PDO (0x0)
    URB bus id: 1
    Device address: 25
    Endpoint: 0x83, Direction: IN
        1... .... = Direction: IN (1)
        .... 0011 = Endpoint number: 3
    URB transfer type: URB_INTERRUPT (0x01)
    Packet Data Length: 0
    [Response in: 12219]
    [bInterfaceClass: HID (0x03)]

0000  1b 00 20 ea e9 0e 03 83 ff ff 00 00 00 00 09 00   .. .............
0010  00 01 00 19 00 83 01 00 00 00 00                  ...........

No.     Time           Source                Destination           Protocol Length Info
  12213 22.594844      host                  1.25.4                USB      91     URB_INTERRUPT out

Frame 12213: 91 bytes on wire (728 bits), 91 bytes captured (728 bits) on interface \\.\USBPcap1, id 0
USB URB
    [Source: host]
    [Destination: 1.25.4]
    USBPcap pseudoheader length: 27
    IRP ID: 0xffff830311b8d010
    IRP USBD_STATUS: USBD_STATUS_SUCCESS (0x00000000)
    URB Function: URB_FUNCTION_BULK_OR_INTERRUPT_TRANSFER (0x0009)
    IRP information: 0x00, Direction: FDO -> PDO
        0000 000. = Reserved: 0x00
        .... ...0 = Direction: FDO -> PDO (0x0)
    URB bus id: 1
    Device address: 25
    Endpoint: 0x04, Direction: OUT
        0... .... = Direction: OUT (0)
        .... 0100 = Endpoint number: 4
    URB transfer type: URB_INTERRUPT (0x01)
    Packet Data Length: 64
    [Response in: 12214]
    [bInterfaceClass: HID (0x03)]
HID Data: 568100000100000002000000bbbbbbbb000000000000000000000000000000000000000000000000000000000000000000000000000000000000000000000000

0000  1b 00 10 d0 b8 11 03 83 ff ff 00 00 00 00 09 00   ................
0010  00 01 00 19 00 04 01 40 00 00 00 56 81 00 00 01   .......@...V....
0020  00 00 00 02 00 00 00 bb bb bb bb 00 00 00 00 00   ................
0030  00 00 00 00 00 00 00 00 00 00 00 00 00 00 00 00   ................
0040  00 00 00 00 00 00 00 00 00 00 00 00 00 00 00 00   ................
0050  00 00 00 00 00 00 00 00 00 00 00                  ...........

No.     Time           Source                Destination           Protocol Length Info
  12214 22.595797      1.25.4                host                  USB      27     URB_INTERRUPT out

Frame 12214: 27 bytes on wire (216 bits), 27 bytes captured (216 bits) on interface \\.\USBPcap1, id 0
USB URB
    [Source: 1.25.4]
    [Destination: host]
    USBPcap pseudoheader length: 27
    IRP ID: 0xffff830311b8d010
    IRP USBD_STATUS: USBD_STATUS_SUCCESS (0x00000000)
    URB Function: URB_FUNCTION_BULK_OR_INTERRUPT_TRANSFER (0x0009)
    IRP information: 0x01, Direction: PDO -> FDO
        0000 000. = Reserved: 0x00
        .... ...1 = Direction: PDO -> FDO (0x1)
    URB bus id: 1
    Device address: 25
    Endpoint: 0x04, Direction: OUT
        0... .... = Direction: OUT (0)
        .... 0100 = Endpoint number: 4
    URB transfer type: URB_INTERRUPT (0x01)
    Packet Data Length: 0
    [Request in: 12213]
    [Time from request: 0.000953000 seconds]
    [bInterfaceClass: HID (0x03)]

0000  1b 00 10 d0 b8 11 03 83 ff ff 00 00 00 00 09 00   ................
0010  01 01 00 19 00 04 01 00 00 00 00                  ...........

No.     Time           Source                Destination           Protocol Length Info
  12215 22.596772      1.25.3                host                  USB      91     URB_INTERRUPT in

Frame 12215: 91 bytes on wire (728 bits), 91 bytes captured (728 bits) on interface \\.\USBPcap1, id 0
USB URB
    [Source: 1.25.3]
    [Destination: host]
    USBPcap pseudoheader length: 27
    IRP ID: 0xffff8303221f5a20
    IRP USBD_STATUS: USBD_STATUS_SUCCESS (0x00000000)
    URB Function: URB_FUNCTION_BULK_OR_INTERRUPT_TRANSFER (0x0009)
    IRP information: 0x01, Direction: PDO -> FDO
        0000 000. = Reserved: 0x00
        .... ...1 = Direction: PDO -> FDO (0x1)
    URB bus id: 1
    Device address: 25
    Endpoint: 0x83, Direction: IN
        1... .... = Direction: IN (1)
        .... 0011 = Endpoint number: 3
    URB transfer type: URB_INTERRUPT (0x01)
    Packet Data Length: 64
    [Request in: 11870]
    [Time from request: 4.567926000 seconds]
    [bInterfaceClass: HID (0x03)]
HID Data: 56810000000000000000000000000000000000000000000000000000000000000000000000000000000000000000000000000000000000000000000000000000

0000  1b 00 20 5a 1f 22 03 83 ff ff 00 00 00 00 09 00   .. Z."..........
0010  01 01 00 19 00 83 01 40 00 00 00 56 81 00 00 00   .......@...V....
0020  00 00 00 00 00 00 00 00 00 00 00 00 00 00 00 00   ................
0030  00 00 00 00 00 00 00 00 00 00 00 00 00 00 00 00   ................
0040  00 00 00 00 00 00 00 00 00 00 00 00 00 00 00 00   ................
0050  00 00 00 00 00 00 00 00 00 00 00                  ...........

No.     Time           Source                Destination           Protocol Length Info
  12216 22.596854      host                  1.25.3                USB      27     URB_INTERRUPT in

Frame 12216: 27 bytes on wire (216 bits), 27 bytes captured (216 bits) on interface \\.\USBPcap1, id 0
USB URB
    [Source: host]
    [Destination: 1.25.3]
    USBPcap pseudoheader length: 27
    IRP ID: 0xffff8303221f5a20
    IRP USBD_STATUS: USBD_STATUS_SUCCESS (0x00000000)
    URB Function: URB_FUNCTION_BULK_OR_INTERRUPT_TRANSFER (0x0009)
    IRP information: 0x00, Direction: FDO -> PDO
        0000 000. = Reserved: 0x00
        .... ...0 = Direction: FDO -> PDO (0x0)
    URB bus id: 1
    Device address: 25
    Endpoint: 0x83, Direction: IN
        1... .... = Direction: IN (1)
        .... 0011 = Endpoint number: 3
    URB transfer type: URB_INTERRUPT (0x01)
    Packet Data Length: 0
    [Response in: 12223]
    [bInterfaceClass: HID (0x03)]

0000  1b 00 20 5a 1f 22 03 83 ff ff 00 00 00 00 09 00   .. Z."..........
0010  00 01 00 19 00 83 01 00 00 00 00                  ...........

No.     Time           Source                Destination           Protocol Length Info
  12217 22.603983      host                  1.25.4                USB      91     URB_INTERRUPT out

Frame 12217: 91 bytes on wire (728 bits), 91 bytes captured (728 bits) on interface \\.\USBPcap1, id 0
USB URB
    [Source: host]
    [Destination: 1.25.4]
    USBPcap pseudoheader length: 27
    IRP ID: 0xffff830308e03010
    IRP USBD_STATUS: USBD_STATUS_SUCCESS (0x00000000)
    URB Function: URB_FUNCTION_BULK_OR_INTERRUPT_TRANSFER (0x0009)
    IRP information: 0x00, Direction: FDO -> PDO
        0000 000. = Reserved: 0x00
        .... ...0 = Direction: FDO -> PDO (0x0)
    URB bus id: 1
    Device address: 25
    Endpoint: 0x04, Direction: OUT
        0... .... = Direction: OUT (0)
        .... 0100 = Endpoint number: 4
    URB transfer type: URB_INTERRUPT (0x01)
    Packet Data Length: 64
    [Response in: 12218]
    [bInterfaceClass: HID (0x03)]
HID Data: 568300000100000080010000ff0000000000ffff00000000d752ff000000000000000000000000d752ff00000000000000000000000000000000000000000000

0000  1b 00 10 30 e0 08 03 83 ff ff 00 00 00 00 09 00   ...0............
0010  00 01 00 19 00 04 01 40 00 00 00 56 83 00 00 01   .......@...V....
0020  00 00 00 80 01 00 00 ff 00 00 00 00 00 ff ff 00   ................
0030  00 00 00 d7 52 ff 00 00 00 00 00 00 00 00 00 00   ....R...........
0040  00 00 d7 52 ff 00 00 00 00 00 00 00 00 00 00 00   ...R............
0050  00 00 00 00 00 00 00 00 00 00 00                  ...........

No.     Time           Source                Destination           Protocol Length Info
  12218 22.604786      1.25.4                host                  USB      27     URB_INTERRUPT out

Frame 12218: 27 bytes on wire (216 bits), 27 bytes captured (216 bits) on interface \\.\USBPcap1, id 0
USB URB
    [Source: 1.25.4]
    [Destination: host]
    USBPcap pseudoheader length: 27
    IRP ID: 0xffff830308e03010
    IRP USBD_STATUS: USBD_STATUS_SUCCESS (0x00000000)
    URB Function: URB_FUNCTION_BULK_OR_INTERRUPT_TRANSFER (0x0009)
    IRP information: 0x01, Direction: PDO -> FDO
        0000 000. = Reserved: 0x00
        .... ...1 = Direction: PDO -> FDO (0x1)
    URB bus id: 1
    Device address: 25
    Endpoint: 0x04, Direction: OUT
        0... .... = Direction: OUT (0)
        .... 0100 = Endpoint number: 4
    URB transfer type: URB_INTERRUPT (0x01)
    Packet Data Length: 0
    [Request in: 12217]
    [Time from request: 0.000803000 seconds]
    [bInterfaceClass: HID (0x03)]

0000  1b 00 10 30 e0 08 03 83 ff ff 00 00 00 00 09 00   ...0............
0010  01 01 00 19 00 04 01 00 00 00 00                  ...........

No.     Time           Source                Destination           Protocol Length Info
  12219 22.605780      1.25.3                host                  USB      91     URB_INTERRUPT in

Frame 12219: 91 bytes on wire (728 bits), 91 bytes captured (728 bits) on interface \\.\USBPcap1, id 0
USB URB
    [Source: 1.25.3]
    [Destination: host]
    USBPcap pseudoheader length: 27
    IRP ID: 0xffff83030ee9ea20
    IRP USBD_STATUS: USBD_STATUS_SUCCESS (0x00000000)
    URB Function: URB_FUNCTION_BULK_OR_INTERRUPT_TRANSFER (0x0009)
    IRP information: 0x01, Direction: PDO -> FDO
        0000 000. = Reserved: 0x00
        .... ...1 = Direction: PDO -> FDO (0x1)
    URB bus id: 1
    Device address: 25
    Endpoint: 0x83, Direction: IN
        1... .... = Direction: IN (1)
        .... 0011 = Endpoint number: 3
    URB transfer type: URB_INTERRUPT (0x01)
    Packet Data Length: 64
    [Request in: 11874]
    [Time from request: 4.566962000 seconds]
    [bInterfaceClass: HID (0x03)]
HID Data: 56830000000000000000000000000000000000000000000000000000000000000000000000000000000000000000000000000000000000000000000000000000

0000  1b 00 20 ea e9 0e 03 83 ff ff 00 00 00 00 09 00   .. .............
0010  01 01 00 19 00 83 01 40 00 00 00 56 83 00 00 00   .......@...V....
0020  00 00 00 00 00 00 00 00 00 00 00 00 00 00 00 00   ................
0030  00 00 00 00 00 00 00 00 00 00 00 00 00 00 00 00   ................
0040  00 00 00 00 00 00 00 00 00 00 00 00 00 00 00 00   ................
0050  00 00 00 00 00 00 00 00 00 00 00                  ...........

No.     Time           Source                Destination           Protocol Length Info
  12220 22.605818      host                  1.25.3                USB      27     URB_INTERRUPT in

Frame 12220: 27 bytes on wire (216 bits), 27 bytes captured (216 bits) on interface \\.\USBPcap1, id 0
USB URB
    [Source: host]
    [Destination: 1.25.3]
    USBPcap pseudoheader length: 27
    IRP ID: 0xffff83030ee9ea20
    IRP USBD_STATUS: USBD_STATUS_SUCCESS (0x00000000)
    URB Function: URB_FUNCTION_BULK_OR_INTERRUPT_TRANSFER (0x0009)
    IRP information: 0x00, Direction: FDO -> PDO
        0000 000. = Reserved: 0x00
        .... ...0 = Direction: FDO -> PDO (0x0)
    URB bus id: 1
    Device address: 25
    Endpoint: 0x83, Direction: IN
        1... .... = Direction: IN (1)
        .... 0011 = Endpoint number: 3
    URB transfer type: URB_INTERRUPT (0x01)
    Packet Data Length: 0
    [Response in: 12227]
    [bInterfaceClass: HID (0x03)]

0000  1b 00 20 ea e9 0e 03 83 ff ff 00 00 00 00 09 00   .. .............
0010  00 01 00 19 00 83 01 00 00 00 00                  ...........

No.     Time           Source                Destination           Protocol Length Info
  12221 22.614684      host                  1.25.4                USB      91     URB_INTERRUPT out

Frame 12221: 91 bytes on wire (728 bits), 91 bytes captured (728 bits) on interface \\.\USBPcap1, id 0
USB URB
    [Source: host]
    [Destination: 1.25.4]
    USBPcap pseudoheader length: 27
    IRP ID: 0xffff830322be9410
    IRP USBD_STATUS: USBD_STATUS_SUCCESS (0x00000000)
    URB Function: URB_FUNCTION_BULK_OR_INTERRUPT_TRANSFER (0x0009)
    IRP information: 0x00, Direction: FDO -> PDO
        0000 000. = Reserved: 0x00
        .... ...0 = Direction: FDO -> PDO (0x0)
    URB bus id: 1
    Device address: 25
    Endpoint: 0x04, Direction: OUT
        0... .... = Direction: OUT (0)
        .... 0100 = Endpoint number: 4
    URB transfer type: URB_INTERRUPT (0x01)
    Packet Data Length: 64
    [Response in: 12222]
    [bInterfaceClass: HID (0x03)]
HID Data: 56830100000000000000000000000000000000000000000000000000000000000000000000000000000000000000000000000000000000000000000000000000

0000  1b 00 10 94 be 22 03 83 ff ff 00 00 00 00 09 00   ....."..........
0010  00 01 00 19 00 04 01 40 00 00 00 56 83 01 00 00   .......@...V....
0020  00 00 00 00 00 00 00 00 00 00 00 00 00 00 00 00   ................
0030  00 00 00 00 00 00 00 00 00 00 00 00 00 00 00 00   ................
0040  00 00 00 00 00 00 00 00 00 00 00 00 00 00 00 00   ................
0050  00 00 00 00 00 00 00 00 00 00 00                  ...........

No.     Time           Source                Destination           Protocol Length Info
  12222 22.615796      1.25.4                host                  USB      27     URB_INTERRUPT out

Frame 12222: 27 bytes on wire (216 bits), 27 bytes captured (216 bits) on interface \\.\USBPcap1, id 0
USB URB
    [Source: 1.25.4]
    [Destination: host]
    USBPcap pseudoheader length: 27
    IRP ID: 0xffff830322be9410
    IRP USBD_STATUS: USBD_STATUS_SUCCESS (0x00000000)
    URB Function: URB_FUNCTION_BULK_OR_INTERRUPT_TRANSFER (0x0009)
    IRP information: 0x01, Direction: PDO -> FDO
        0000 000. = Reserved: 0x00
        .... ...1 = Direction: PDO -> FDO (0x1)
    URB bus id: 1
    Device address: 25
    Endpoint: 0x04, Direction: OUT
        0... .... = Direction: OUT (0)
        .... 0100 = Endpoint number: 4
    URB transfer type: URB_INTERRUPT (0x01)
    Packet Data Length: 0
    [Request in: 12221]
    [Time from request: 0.001112000 seconds]
    [bInterfaceClass: HID (0x03)]

0000  1b 00 10 94 be 22 03 83 ff ff 00 00 00 00 09 00   ....."..........
0010  01 01 00 19 00 04 01 00 00 00 00                  ...........

No.     Time           Source                Destination           Protocol Length Info
  12223 22.616785      1.25.3                host                  USB      91     URB_INTERRUPT in

Frame 12223: 91 bytes on wire (728 bits), 91 bytes captured (728 bits) on interface \\.\USBPcap1, id 0
USB URB
    [Source: 1.25.3]
    [Destination: host]
    USBPcap pseudoheader length: 27
    IRP ID: 0xffff8303221f5a20
    IRP USBD_STATUS: USBD_STATUS_SUCCESS (0x00000000)
    URB Function: URB_FUNCTION_BULK_OR_INTERRUPT_TRANSFER (0x0009)
    IRP information: 0x01, Direction: PDO -> FDO
        0000 000. = Reserved: 0x00
        .... ...1 = Direction: PDO -> FDO (0x1)
    URB bus id: 1
    Device address: 25
    Endpoint: 0x83, Direction: IN
        1... .... = Direction: IN (1)
        .... 0011 = Endpoint number: 3
    URB transfer type: URB_INTERRUPT (0x01)
    Packet Data Length: 64
    [Request in: 12216]
    [Time from request: 0.019931000 seconds]
    [bInterfaceClass: HID (0x03)]
HID Data: 56830100000000000000000000000000000000000000000000000000000000000000000000000000000000000000000000000000000000000000000000000000

0000  1b 00 20 5a 1f 22 03 83 ff ff 00 00 00 00 09 00   .. Z."..........
0010  01 01 00 19 00 83 01 40 00 00 00 56 83 01 00 00   .......@...V....
0020  00 00 00 00 00 00 00 00 00 00 00 00 00 00 00 00   ................
0030  00 00 00 00 00 00 00 00 00 00 00 00 00 00 00 00   ................
0040  00 00 00 00 00 00 00 00 00 00 00 00 00 00 00 00   ................
0050  00 00 00 00 00 00 00 00 00 00 00                  ...........

No.     Time           Source                Destination           Protocol Length Info
  12224 22.616845      host                  1.25.3                USB      27     URB_INTERRUPT in

Frame 12224: 27 bytes on wire (216 bits), 27 bytes captured (216 bits) on interface \\.\USBPcap1, id 0
USB URB
    [Source: host]
    [Destination: 1.25.3]
    USBPcap pseudoheader length: 27
    IRP ID: 0xffff8303221f5a20
    IRP USBD_STATUS: USBD_STATUS_SUCCESS (0x00000000)
    URB Function: URB_FUNCTION_BULK_OR_INTERRUPT_TRANSFER (0x0009)
    IRP information: 0x00, Direction: FDO -> PDO
        0000 000. = Reserved: 0x00
        .... ...0 = Direction: FDO -> PDO (0x0)
    URB bus id: 1
    Device address: 25
    Endpoint: 0x83, Direction: IN
        1... .... = Direction: IN (1)
        .... 0011 = Endpoint number: 3
    URB transfer type: URB_INTERRUPT (0x01)
    Packet Data Length: 0
    [Response in: 12231]
    [bInterfaceClass: HID (0x03)]

0000  1b 00 20 5a 1f 22 03 83 ff ff 00 00 00 00 09 00   .. Z."..........
0010  00 01 00 19 00 83 01 00 00 00 00                  ...........

No.     Time           Source                Destination           Protocol Length Info
  12225 22.625655      host                  1.25.4                USB      91     URB_INTERRUPT out

Frame 12225: 91 bytes on wire (728 bits), 91 bytes captured (728 bits) on interface \\.\USBPcap1, id 0
USB URB
    [Source: host]
    [Destination: 1.25.4]
    USBPcap pseudoheader length: 27
    IRP ID: 0xffff830308cc2260
    IRP USBD_STATUS: USBD_STATUS_SUCCESS (0x00000000)
    URB Function: URB_FUNCTION_BULK_OR_INTERRUPT_TRANSFER (0x0009)
    IRP information: 0x00, Direction: FDO -> PDO
        0000 000. = Reserved: 0x00
        .... ...0 = Direction: FDO -> PDO (0x0)
    URB bus id: 1
    Device address: 25
    Endpoint: 0x04, Direction: OUT
        0... .... = Direction: OUT (0)
        .... 0100 = Endpoint number: 4
    URB transfer type: URB_INTERRUPT (0x01)
    Packet Data Length: 64
    [Response in: 12226]
    [bInterfaceClass: HID (0x03)]
HID Data: 41800000000000000000000000000000000000000000000000000000000000000000000000000000000000000000000000000000000000000000000000000000

0000  1b 00 60 22 cc 08 03 83 ff ff 00 00 00 00 09 00   ..`"............
0010  00 01 00 19 00 04 01 40 00 00 00 41 80 00 00 00   .......@...A....
0020  00 00 00 00 00 00 00 00 00 00 00 00 00 00 00 00   ................
0030  00 00 00 00 00 00 00 00 00 00 00 00 00 00 00 00   ................
0040  00 00 00 00 00 00 00 00 00 00 00 00 00 00 00 00   ................
0050  00 00 00 00 00 00 00 00 00 00 00                  ...........

No.     Time           Source                Destination           Protocol Length Info
  12226 22.626776      1.25.4                host                  USB      27     URB_INTERRUPT out

Frame 12226: 27 bytes on wire (216 bits), 27 bytes captured (216 bits) on interface \\.\USBPcap1, id 0
USB URB
    [Source: 1.25.4]
    [Destination: host]
    USBPcap pseudoheader length: 27
    IRP ID: 0xffff830308cc2260
    IRP USBD_STATUS: USBD_STATUS_SUCCESS (0x00000000)
    URB Function: URB_FUNCTION_BULK_OR_INTERRUPT_TRANSFER (0x0009)
    IRP information: 0x01, Direction: PDO -> FDO
        0000 000. = Reserved: 0x00
        .... ...1 = Direction: PDO -> FDO (0x1)
    URB bus id: 1
    Device address: 25
    Endpoint: 0x04, Direction: OUT
        0... .... = Direction: OUT (0)
        .... 0100 = Endpoint number: 4
    URB transfer type: URB_INTERRUPT (0x01)
    Packet Data Length: 0
    [Request in: 12225]
    [Time from request: 0.001121000 seconds]
    [bInterfaceClass: HID (0x03)]

0000  1b 00 60 22 cc 08 03 83 ff ff 00 00 00 00 09 00   ..`"............
0010  01 01 00 19 00 04 01 00 00 00 00                  ...........

No.     Time           Source                Destination           Protocol Length Info
  12227 22.627769      1.25.3                host                  USB      91     URB_INTERRUPT in

Frame 12227: 91 bytes on wire (728 bits), 91 bytes captured (728 bits) on interface \\.\USBPcap1, id 0
USB URB
    [Source: 1.25.3]
    [Destination: host]
    USBPcap pseudoheader length: 27
    IRP ID: 0xffff83030ee9ea20
    IRP USBD_STATUS: USBD_STATUS_SUCCESS (0x00000000)
    URB Function: URB_FUNCTION_BULK_OR_INTERRUPT_TRANSFER (0x0009)
    IRP information: 0x01, Direction: PDO -> FDO
        0000 000. = Reserved: 0x00
        .... ...1 = Direction: PDO -> FDO (0x1)
    URB bus id: 1
    Device address: 25
    Endpoint: 0x83, Direction: IN
        1... .... = Direction: IN (1)
        .... 0011 = Endpoint number: 3
    URB transfer type: URB_INTERRUPT (0x01)
    Packet Data Length: 64
    [Request in: 12220]
    [Time from request: 0.021951000 seconds]
    [bInterfaceClass: HID (0x03)]
HID Data: 41800000000000000000000000000000000000000000000000000000000000000000000000000000000000000000000000000000000000000000000000000000

0000  1b 00 20 ea e9 0e 03 83 ff ff 00 00 00 00 09 00   .. .............
0010  01 01 00 19 00 83 01 40 00 00 00 41 80 00 00 00   .......@...A....
0020  00 00 00 00 00 00 00 00 00 00 00 00 00 00 00 00   ................
0030  00 00 00 00 00 00 00 00 00 00 00 00 00 00 00 00   ................
0040  00 00 00 00 00 00 00 00 00 00 00 00 00 00 00 00   ................
0050  00 00 00 00 00 00 00 00 00 00 00                  ...........

No.     Time           Source                Destination           Protocol Length Info
  12228 22.627826      host                  1.25.3                USB      27     URB_INTERRUPT in

Frame 12228: 27 bytes on wire (216 bits), 27 bytes captured (216 bits) on interface \\.\USBPcap1, id 0
USB URB
    [Source: host]
    [Destination: 1.25.3]
    USBPcap pseudoheader length: 27
    IRP ID: 0xffff83030ee9ea20
    IRP USBD_STATUS: USBD_STATUS_SUCCESS (0x00000000)
    URB Function: URB_FUNCTION_BULK_OR_INTERRUPT_TRANSFER (0x0009)
    IRP information: 0x00, Direction: FDO -> PDO
        0000 000. = Reserved: 0x00
        .... ...0 = Direction: FDO -> PDO (0x0)
    URB bus id: 1
    Device address: 25
    Endpoint: 0x83, Direction: IN
        1... .... = Direction: IN (1)
        .... 0011 = Endpoint number: 3
    URB transfer type: URB_INTERRUPT (0x01)
    Packet Data Length: 0
    [Response in: 12455]
    [bInterfaceClass: HID (0x03)]

0000  1b 00 20 ea e9 0e 03 83 ff ff 00 00 00 00 09 00   .. .............
0010  00 01 00 19 00 83 01 00 00 00 00                  ...........

No.     Time           Source                Destination           Protocol Length Info
  12229 22.637666      host                  1.25.4                USB      91     URB_INTERRUPT out

Frame 12229: 91 bytes on wire (728 bits), 91 bytes captured (728 bits) on interface \\.\USBPcap1, id 0
USB URB
    [Source: host]
    [Destination: 1.25.4]
    USBPcap pseudoheader length: 27
    IRP ID: 0xffff8303105d4260
    IRP USBD_STATUS: USBD_STATUS_SUCCESS (0x00000000)
    URB Function: URB_FUNCTION_BULK_OR_INTERRUPT_TRANSFER (0x0009)
    IRP information: 0x00, Direction: FDO -> PDO
        0000 000. = Reserved: 0x00
        .... ...0 = Direction: FDO -> PDO (0x0)
    URB bus id: 1
    Device address: 25
    Endpoint: 0x04, Direction: OUT
        0... .... = Direction: OUT (0)
        .... 0100 = Endpoint number: 4
    URB transfer type: URB_INTERRUPT (0x01)
    Packet Data Length: 64
    [Response in: 12230]
    [bInterfaceClass: HID (0x03)]
HID Data: 51280000ff0000000000000000000000000000000000000000000000000000000000000000000000000000000000000000000000000000000000000000000000

0000  1b 00 60 42 5d 10 03 83 ff ff 00 00 00 00 09 00   ..`B]...........
0010  00 01 00 19 00 04 01 40 00 00 00 51 28 00 00 ff   .......@...Q(...
0020  00 00 00 00 00 00 00 00 00 00 00 00 00 00 00 00   ................
0030  00 00 00 00 00 00 00 00 00 00 00 00 00 00 00 00   ................
0040  00 00 00 00 00 00 00 00 00 00 00 00 00 00 00 00   ................
0050  00 00 00 00 00 00 00 00 00 00 00                  ...........

No.     Time           Source                Destination           Protocol Length Info
  12230 22.638794      1.25.4                host                  USB      27     URB_INTERRUPT out

Frame 12230: 27 bytes on wire (216 bits), 27 bytes captured (216 bits) on interface \\.\USBPcap1, id 0
USB URB
    [Source: 1.25.4]
    [Destination: host]
    USBPcap pseudoheader length: 27
    IRP ID: 0xffff8303105d4260
    IRP USBD_STATUS: USBD_STATUS_SUCCESS (0x00000000)
    URB Function: URB_FUNCTION_BULK_OR_INTERRUPT_TRANSFER (0x0009)
    IRP information: 0x01, Direction: PDO -> FDO
        0000 000. = Reserved: 0x00
        .... ...1 = Direction: PDO -> FDO (0x1)
    URB bus id: 1
    Device address: 25
    Endpoint: 0x04, Direction: OUT
        0... .... = Direction: OUT (0)
        .... 0100 = Endpoint number: 4
    URB transfer type: URB_INTERRUPT (0x01)
    Packet Data Length: 0
    [Request in: 12229]
    [Time from request: 0.001128000 seconds]
    [bInterfaceClass: HID (0x03)]

0000  1b 00 60 42 5d 10 03 83 ff ff 00 00 00 00 09 00   ..`B]...........
0010  01 01 00 19 00 04 01 00 00 00 00                  ...........

No.     Time           Source                Destination           Protocol Length Info
  12231 22.639790      1.25.3                host                  USB      91     URB_INTERRUPT in

Frame 12231: 91 bytes on wire (728 bits), 91 bytes captured (728 bits) on interface \\.\USBPcap1, id 0
USB URB
    [Source: 1.25.3]
    [Destination: host]
    USBPcap pseudoheader length: 27
    IRP ID: 0xffff8303221f5a20
    IRP USBD_STATUS: USBD_STATUS_SUCCESS (0x00000000)
    URB Function: URB_FUNCTION_BULK_OR_INTERRUPT_TRANSFER (0x0009)
    IRP information: 0x01, Direction: PDO -> FDO
        0000 000. = Reserved: 0x00
        .... ...1 = Direction: PDO -> FDO (0x1)
    URB bus id: 1
    Device address: 25
    Endpoint: 0x83, Direction: IN
        1... .... = Direction: IN (1)
        .... 0011 = Endpoint number: 3
    URB transfer type: URB_INTERRUPT (0x01)
    Packet Data Length: 64
    [Request in: 12224]
    [Time from request: 0.022945000 seconds]
    [bInterfaceClass: HID (0x03)]
HID Data: 51280000000000000000000000000000000000000000000000000000000000000000000000000000000000000000000000000000000000000000000000000000

0000  1b 00 20 5a 1f 22 03 83 ff ff 00 00 00 00 09 00   .. Z."..........
0010  01 01 00 19 00 83 01 40 00 00 00 51 28 00 00 00   .......@...Q(...
0020  00 00 00 00 00 00 00 00 00 00 00 00 00 00 00 00   ................
0030  00 00 00 00 00 00 00 00 00 00 00 00 00 00 00 00   ................
0040  00 00 00 00 00 00 00 00 00 00 00 00 00 00 00 00   ................
0050  00 00 00 00 00 00 00 00 00 00 00                  ...........

No.     Time           Source                Destination           Protocol Length Info
  12232 22.639840      host                  1.25.3                USB      27     URB_INTERRUPT in

Frame 12232: 27 bytes on wire (216 bits), 27 bytes captured (216 bits) on interface \\.\USBPcap1, id 0
USB URB
    [Source: host]
    [Destination: 1.25.3]
    USBPcap pseudoheader length: 27
    IRP ID: 0xffff8303221f5a20
    IRP USBD_STATUS: USBD_STATUS_SUCCESS (0x00000000)
    URB Function: URB_FUNCTION_BULK_OR_INTERRUPT_TRANSFER (0x0009)
    IRP information: 0x00, Direction: FDO -> PDO
        0000 000. = Reserved: 0x00
        .... ...0 = Direction: FDO -> PDO (0x0)
    URB bus id: 1
    Device address: 25
    Endpoint: 0x83, Direction: IN
        1... .... = Direction: IN (1)
        .... 0011 = Endpoint number: 3
    URB transfer type: URB_INTERRUPT (0x01)
    Packet Data Length: 0
    [Response in: 12459]
    [bInterfaceClass: HID (0x03)]

0000  1b 00 20 5a 1f 22 03 83 ff ff 00 00 00 00 09 00   .. Z."..........
0010  00 01 00 19 00 83 01 00 00 00 00                  ...........

No.     Time           Source                Destination           Protocol Length Info
  12453 24.369520      host                  1.25.4                USB      91     URB_INTERRUPT out

Frame 12453: 91 bytes on wire (728 bits), 91 bytes captured (728 bits) on interface \\.\USBPcap1, id 0
USB URB
    [Source: host]
    [Destination: 1.25.4]
    USBPcap pseudoheader length: 27
    IRP ID: 0xffff83030a2c7010
    IRP USBD_STATUS: USBD_STATUS_SUCCESS (0x00000000)
    URB Function: URB_FUNCTION_BULK_OR_INTERRUPT_TRANSFER (0x0009)
    IRP information: 0x00, Direction: FDO -> PDO
        0000 000. = Reserved: 0x00
        .... ...0 = Direction: FDO -> PDO (0x0)
    URB bus id: 1
    Device address: 25
    Endpoint: 0x04, Direction: OUT
        0... .... = Direction: OUT (0)
        .... 0100 = Endpoint number: 4
    URB transfer type: URB_INTERRUPT (0x01)
    Packet Data Length: 64
    [Response in: 12454]
    [bInterfaceClass: HID (0x03)]
HID Data: 568100000100000002000000bbbbbbbb000000000000000000000000000000000000000000000000000000000000000000000000000000000000000000000000

0000  1b 00 10 70 2c 0a 03 83 ff ff 00 00 00 00 09 00   ...p,...........
0010  00 01 00 19 00 04 01 40 00 00 00 56 81 00 00 01   .......@...V....
0020  00 00 00 02 00 00 00 bb bb bb bb 00 00 00 00 00   ................
0030  00 00 00 00 00 00 00 00 00 00 00 00 00 00 00 00   ................
0040  00 00 00 00 00 00 00 00 00 00 00 00 00 00 00 00   ................
0050  00 00 00 00 00 00 00 00 00 00 00                  ...........

No.     Time           Source                Destination           Protocol Length Info
  12454 24.370785      1.25.4                host                  USB      27     URB_INTERRUPT out

Frame 12454: 27 bytes on wire (216 bits), 27 bytes captured (216 bits) on interface \\.\USBPcap1, id 0
USB URB
    [Source: 1.25.4]
    [Destination: host]
    USBPcap pseudoheader length: 27
    IRP ID: 0xffff83030a2c7010
    IRP USBD_STATUS: USBD_STATUS_SUCCESS (0x00000000)
    URB Function: URB_FUNCTION_BULK_OR_INTERRUPT_TRANSFER (0x0009)
    IRP information: 0x01, Direction: PDO -> FDO
        0000 000. = Reserved: 0x00
        .... ...1 = Direction: PDO -> FDO (0x1)
    URB bus id: 1
    Device address: 25
    Endpoint: 0x04, Direction: OUT
        0... .... = Direction: OUT (0)
        .... 0100 = Endpoint number: 4
    URB transfer type: URB_INTERRUPT (0x01)
    Packet Data Length: 0
    [Request in: 12453]
    [Time from request: 0.001265000 seconds]
    [bInterfaceClass: HID (0x03)]

0000  1b 00 10 70 2c 0a 03 83 ff ff 00 00 00 00 09 00   ...p,...........
0010  01 01 00 19 00 04 01 00 00 00 00                  ...........

No.     Time           Source                Destination           Protocol Length Info
  12455 24.371774      1.25.3                host                  USB      91     URB_INTERRUPT in

Frame 12455: 91 bytes on wire (728 bits), 91 bytes captured (728 bits) on interface \\.\USBPcap1, id 0
USB URB
    [Source: 1.25.3]
    [Destination: host]
    USBPcap pseudoheader length: 27
    IRP ID: 0xffff83030ee9ea20
    IRP USBD_STATUS: USBD_STATUS_SUCCESS (0x00000000)
    URB Function: URB_FUNCTION_BULK_OR_INTERRUPT_TRANSFER (0x0009)
    IRP information: 0x01, Direction: PDO -> FDO
        0000 000. = Reserved: 0x00
        .... ...1 = Direction: PDO -> FDO (0x1)
    URB bus id: 1
    Device address: 25
    Endpoint: 0x83, Direction: IN
        1... .... = Direction: IN (1)
        .... 0011 = Endpoint number: 3
    URB transfer type: URB_INTERRUPT (0x01)
    Packet Data Length: 64
    [Request in: 12228]
    [Time from request: 1.743948000 seconds]
    [bInterfaceClass: HID (0x03)]
HID Data: 56810000000000000000000000000000000000000000000000000000000000000000000000000000000000000000000000000000000000000000000000000000

0000  1b 00 20 ea e9 0e 03 83 ff ff 00 00 00 00 09 00   .. .............
0010  01 01 00 19 00 83 01 40 00 00 00 56 81 00 00 00   .......@...V....
0020  00 00 00 00 00 00 00 00 00 00 00 00 00 00 00 00   ................
0030  00 00 00 00 00 00 00 00 00 00 00 00 00 00 00 00   ................
0040  00 00 00 00 00 00 00 00 00 00 00 00 00 00 00 00   ................
0050  00 00 00 00 00 00 00 00 00 00 00                  ...........

No.     Time           Source                Destination           Protocol Length Info
  12456 24.371847      host                  1.25.3                USB      27     URB_INTERRUPT in

Frame 12456: 27 bytes on wire (216 bits), 27 bytes captured (216 bits) on interface \\.\USBPcap1, id 0
USB URB
    [Source: host]
    [Destination: 1.25.3]
    USBPcap pseudoheader length: 27
    IRP ID: 0xffff83030ee9ea20
    IRP USBD_STATUS: USBD_STATUS_SUCCESS (0x00000000)
    URB Function: URB_FUNCTION_BULK_OR_INTERRUPT_TRANSFER (0x0009)
    IRP information: 0x00, Direction: FDO -> PDO
        0000 000. = Reserved: 0x00
        .... ...0 = Direction: FDO -> PDO (0x0)
    URB bus id: 1
    Device address: 25
    Endpoint: 0x83, Direction: IN
        1... .... = Direction: IN (1)
        .... 0011 = Endpoint number: 3
    URB transfer type: URB_INTERRUPT (0x01)
    Packet Data Length: 0
    [Response in: 12463]
    [bInterfaceClass: HID (0x03)]

0000  1b 00 20 ea e9 0e 03 83 ff ff 00 00 00 00 09 00   .. .............
0010  00 01 00 19 00 83 01 00 00 00 00                  ...........

No.     Time           Source                Destination           Protocol Length Info
  12457 24.379573      host                  1.25.4                USB      91     URB_INTERRUPT out

Frame 12457: 91 bytes on wire (728 bits), 91 bytes captured (728 bits) on interface \\.\USBPcap1, id 0
USB URB
    [Source: host]
    [Destination: 1.25.4]
    USBPcap pseudoheader length: 27
    IRP ID: 0xffff83030a0b4010
    IRP USBD_STATUS: USBD_STATUS_SUCCESS (0x00000000)
    URB Function: URB_FUNCTION_BULK_OR_INTERRUPT_TRANSFER (0x0009)
    IRP information: 0x00, Direction: FDO -> PDO
        0000 000. = Reserved: 0x00
        .... ...0 = Direction: FDO -> PDO (0x0)
    URB bus id: 1
    Device address: 25
    Endpoint: 0x04, Direction: OUT
        0... .... = Direction: OUT (0)
        .... 0100 = Endpoint number: 4
    URB transfer type: URB_INTERRUPT (0x01)
    Packet Data Length: 64
    [Response in: 12458]
    [bInterfaceClass: HID (0x03)]
HID Data: 568300000100000080010000ff0000000000ffff00000000d752ff000000000000000000000000d752ff000000000000000000000000d752ff00000000000000

0000  1b 00 10 40 0b 0a 03 83 ff ff 00 00 00 00 09 00   ...@............
0010  00 01 00 19 00 04 01 40 00 00 00 56 83 00 00 01   .......@...V....
0020  00 00 00 80 01 00 00 ff 00 00 00 00 00 ff ff 00   ................
0030  00 00 00 d7 52 ff 00 00 00 00 00 00 00 00 00 00   ....R...........
0040  00 00 d7 52 ff 00 00 00 00 00 00 00 00 00 00 00   ...R............
0050  00 d7 52 ff 00 00 00 00 00 00 00                  ..R........

No.     Time           Source                Destination           Protocol Length Info
  12458 24.380783      1.25.4                host                  USB      27     URB_INTERRUPT out

Frame 12458: 27 bytes on wire (216 bits), 27 bytes captured (216 bits) on interface \\.\USBPcap1, id 0
USB URB
    [Source: 1.25.4]
    [Destination: host]
    USBPcap pseudoheader length: 27
    IRP ID: 0xffff83030a0b4010
    IRP USBD_STATUS: USBD_STATUS_SUCCESS (0x00000000)
    URB Function: URB_FUNCTION_BULK_OR_INTERRUPT_TRANSFER (0x0009)
    IRP information: 0x01, Direction: PDO -> FDO
        0000 000. = Reserved: 0x00
        .... ...1 = Direction: PDO -> FDO (0x1)
    URB bus id: 1
    Device address: 25
    Endpoint: 0x04, Direction: OUT
        0... .... = Direction: OUT (0)
        .... 0100 = Endpoint number: 4
    URB transfer type: URB_INTERRUPT (0x01)
    Packet Data Length: 0
    [Request in: 12457]
    [Time from request: 0.001210000 seconds]
    [bInterfaceClass: HID (0x03)]

0000  1b 00 10 40 0b 0a 03 83 ff ff 00 00 00 00 09 00   ...@............
0010  01 01 00 19 00 04 01 00 00 00 00                  ...........

No.     Time           Source                Destination           Protocol Length Info
  12459 24.381816      1.25.3                host                  USB      91     URB_INTERRUPT in

Frame 12459: 91 bytes on wire (728 bits), 91 bytes captured (728 bits) on interface \\.\USBPcap1, id 0
USB URB
    [Source: 1.25.3]
    [Destination: host]
    USBPcap pseudoheader length: 27
    IRP ID: 0xffff8303221f5a20
    IRP USBD_STATUS: USBD_STATUS_SUCCESS (0x00000000)
    URB Function: URB_FUNCTION_BULK_OR_INTERRUPT_TRANSFER (0x0009)
    IRP information: 0x01, Direction: PDO -> FDO
        0000 000. = Reserved: 0x00
        .... ...1 = Direction: PDO -> FDO (0x1)
    URB bus id: 1
    Device address: 25
    Endpoint: 0x83, Direction: IN
        1... .... = Direction: IN (1)
        .... 0011 = Endpoint number: 3
    URB transfer type: URB_INTERRUPT (0x01)
    Packet Data Length: 64
    [Request in: 12232]
    [Time from request: 1.741976000 seconds]
    [bInterfaceClass: HID (0x03)]
HID Data: 56830000000000000000000000000000000000000000000000000000000000000000000000000000000000000000000000000000000000000000000000000000

0000  1b 00 20 5a 1f 22 03 83 ff ff 00 00 00 00 09 00   .. Z."..........
0010  01 01 00 19 00 83 01 40 00 00 00 56 83 00 00 00   .......@...V....
0020  00 00 00 00 00 00 00 00 00 00 00 00 00 00 00 00   ................
0030  00 00 00 00 00 00 00 00 00 00 00 00 00 00 00 00   ................
0040  00 00 00 00 00 00 00 00 00 00 00 00 00 00 00 00   ................
0050  00 00 00 00 00 00 00 00 00 00 00                  ...........

No.     Time           Source                Destination           Protocol Length Info
  12460 24.381857      host                  1.25.3                USB      27     URB_INTERRUPT in

Frame 12460: 27 bytes on wire (216 bits), 27 bytes captured (216 bits) on interface \\.\USBPcap1, id 0
USB URB
    [Source: host]
    [Destination: 1.25.3]
    USBPcap pseudoheader length: 27
    IRP ID: 0xffff8303221f5a20
    IRP USBD_STATUS: USBD_STATUS_SUCCESS (0x00000000)
    URB Function: URB_FUNCTION_BULK_OR_INTERRUPT_TRANSFER (0x0009)
    IRP information: 0x00, Direction: FDO -> PDO
        0000 000. = Reserved: 0x00
        .... ...0 = Direction: FDO -> PDO (0x0)
    URB bus id: 1
    Device address: 25
    Endpoint: 0x83, Direction: IN
        1... .... = Direction: IN (1)
        .... 0011 = Endpoint number: 3
    URB transfer type: URB_INTERRUPT (0x01)
    Packet Data Length: 0
    [Response in: 12467]
    [bInterfaceClass: HID (0x03)]

0000  1b 00 20 5a 1f 22 03 83 ff ff 00 00 00 00 09 00   .. Z."..........
0010  00 01 00 19 00 83 01 00 00 00 00                  ...........

No.     Time           Source                Destination           Protocol Length Info
  12461 24.391190      host                  1.25.4                USB      91     URB_INTERRUPT out

Frame 12461: 91 bytes on wire (728 bits), 91 bytes captured (728 bits) on interface \\.\USBPcap1, id 0
USB URB
    [Source: host]
    [Destination: 1.25.4]
    USBPcap pseudoheader length: 27
    IRP ID: 0xffff83030a0b4010
    IRP USBD_STATUS: USBD_STATUS_SUCCESS (0x00000000)
    URB Function: URB_FUNCTION_BULK_OR_INTERRUPT_TRANSFER (0x0009)
    IRP information: 0x00, Direction: FDO -> PDO
        0000 000. = Reserved: 0x00
        .... ...0 = Direction: FDO -> PDO (0x0)
    URB bus id: 1
    Device address: 25
    Endpoint: 0x04, Direction: OUT
        0... .... = Direction: OUT (0)
        .... 0100 = Endpoint number: 4
    URB transfer type: URB_INTERRUPT (0x01)
    Packet Data Length: 64
    [Response in: 12462]
    [bInterfaceClass: HID (0x03)]
HID Data: 56830100000000000000000000000000000000000000000000000000000000000000000000000000000000000000000000000000000000000000000000000000

0000  1b 00 10 40 0b 0a 03 83 ff ff 00 00 00 00 09 00   ...@............
0010  00 01 00 19 00 04 01 40 00 00 00 56 83 01 00 00   .......@...V....
0020  00 00 00 00 00 00 00 00 00 00 00 00 00 00 00 00   ................
0030  00 00 00 00 00 00 00 00 00 00 00 00 00 00 00 00   ................
0040  00 00 00 00 00 00 00 00 00 00 00 00 00 00 00 00   ................
0050  00 00 00 00 00 00 00 00 00 00 00                  ...........

No.     Time           Source                Destination           Protocol Length Info
  12462 24.391768      1.25.4                host                  USB      27     URB_INTERRUPT out

Frame 12462: 27 bytes on wire (216 bits), 27 bytes captured (216 bits) on interface \\.\USBPcap1, id 0
USB URB
    [Source: 1.25.4]
    [Destination: host]
    USBPcap pseudoheader length: 27
    IRP ID: 0xffff83030a0b4010
    IRP USBD_STATUS: USBD_STATUS_SUCCESS (0x00000000)
    URB Function: URB_FUNCTION_BULK_OR_INTERRUPT_TRANSFER (0x0009)
    IRP information: 0x01, Direction: PDO -> FDO
        0000 000. = Reserved: 0x00
        .... ...1 = Direction: PDO -> FDO (0x1)
    URB bus id: 1
    Device address: 25
    Endpoint: 0x04, Direction: OUT
        0... .... = Direction: OUT (0)
        .... 0100 = Endpoint number: 4
    URB transfer type: URB_INTERRUPT (0x01)
    Packet Data Length: 0
    [Request in: 12461]
    [Time from request: 0.000578000 seconds]
    [bInterfaceClass: HID (0x03)]

0000  1b 00 10 40 0b 0a 03 83 ff ff 00 00 00 00 09 00   ...@............
0010  01 01 00 19 00 04 01 00 00 00 00                  ...........

No.     Time           Source                Destination           Protocol Length Info
  12463 24.392776      1.25.3                host                  USB      91     URB_INTERRUPT in

Frame 12463: 91 bytes on wire (728 bits), 91 bytes captured (728 bits) on interface \\.\USBPcap1, id 0
USB URB
    [Source: 1.25.3]
    [Destination: host]
    USBPcap pseudoheader length: 27
    IRP ID: 0xffff83030ee9ea20
    IRP USBD_STATUS: USBD_STATUS_SUCCESS (0x00000000)
    URB Function: URB_FUNCTION_BULK_OR_INTERRUPT_TRANSFER (0x0009)
    IRP information: 0x01, Direction: PDO -> FDO
        0000 000. = Reserved: 0x00
        .... ...1 = Direction: PDO -> FDO (0x1)
    URB bus id: 1
    Device address: 25
    Endpoint: 0x83, Direction: IN
        1... .... = Direction: IN (1)
        .... 0011 = Endpoint number: 3
    URB transfer type: URB_INTERRUPT (0x01)
    Packet Data Length: 64
    [Request in: 12456]
    [Time from request: 0.020929000 seconds]
    [bInterfaceClass: HID (0x03)]
HID Data: 56830100000000000000000000000000000000000000000000000000000000000000000000000000000000000000000000000000000000000000000000000000

0000  1b 00 20 ea e9 0e 03 83 ff ff 00 00 00 00 09 00   .. .............
0010  01 01 00 19 00 83 01 40 00 00 00 56 83 01 00 00   .......@...V....
0020  00 00 00 00 00 00 00 00 00 00 00 00 00 00 00 00   ................
0030  00 00 00 00 00 00 00 00 00 00 00 00 00 00 00 00   ................
0040  00 00 00 00 00 00 00 00 00 00 00 00 00 00 00 00   ................
0050  00 00 00 00 00 00 00 00 00 00 00                  ...........

No.     Time           Source                Destination           Protocol Length Info
  12464 24.392830      host                  1.25.3                USB      27     URB_INTERRUPT in

Frame 12464: 27 bytes on wire (216 bits), 27 bytes captured (216 bits) on interface \\.\USBPcap1, id 0
USB URB
    [Source: host]
    [Destination: 1.25.3]
    USBPcap pseudoheader length: 27
    IRP ID: 0xffff83030ee9ea20
    IRP USBD_STATUS: USBD_STATUS_SUCCESS (0x00000000)
    URB Function: URB_FUNCTION_BULK_OR_INTERRUPT_TRANSFER (0x0009)
    IRP information: 0x00, Direction: FDO -> PDO
        0000 000. = Reserved: 0x00
        .... ...0 = Direction: FDO -> PDO (0x0)
    URB bus id: 1
    Device address: 25
    Endpoint: 0x83, Direction: IN
        1... .... = Direction: IN (1)
        .... 0011 = Endpoint number: 3
    URB transfer type: URB_INTERRUPT (0x01)
    Packet Data Length: 0
    [Response in: 12471]
    [bInterfaceClass: HID (0x03)]

0000  1b 00 20 ea e9 0e 03 83 ff ff 00 00 00 00 09 00   .. .............
0010  00 01 00 19 00 83 01 00 00 00 00                  ...........

No.     Time           Source                Destination           Protocol Length Info
  12465 24.401816      host                  1.25.4                USB      91     URB_INTERRUPT out

Frame 12465: 91 bytes on wire (728 bits), 91 bytes captured (728 bits) on interface \\.\USBPcap1, id 0
USB URB
    [Source: host]
    [Destination: 1.25.4]
    USBPcap pseudoheader length: 27
    IRP ID: 0xffff83030a2c7010
    IRP USBD_STATUS: USBD_STATUS_SUCCESS (0x00000000)
    URB Function: URB_FUNCTION_BULK_OR_INTERRUPT_TRANSFER (0x0009)
    IRP information: 0x00, Direction: FDO -> PDO
        0000 000. = Reserved: 0x00
        .... ...0 = Direction: FDO -> PDO (0x0)
    URB bus id: 1
    Device address: 25
    Endpoint: 0x04, Direction: OUT
        0... .... = Direction: OUT (0)
        .... 0100 = Endpoint number: 4
    URB transfer type: URB_INTERRUPT (0x01)
    Packet Data Length: 64
    [Response in: 12466]
    [bInterfaceClass: HID (0x03)]
HID Data: 41800000000000000000000000000000000000000000000000000000000000000000000000000000000000000000000000000000000000000000000000000000

0000  1b 00 10 70 2c 0a 03 83 ff ff 00 00 00 00 09 00   ...p,...........
0010  00 01 00 19 00 04 01 40 00 00 00 41 80 00 00 00   .......@...A....
0020  00 00 00 00 00 00 00 00 00 00 00 00 00 00 00 00   ................
0030  00 00 00 00 00 00 00 00 00 00 00 00 00 00 00 00   ................
0040  00 00 00 00 00 00 00 00 00 00 00 00 00 00 00 00   ................
0050  00 00 00 00 00 00 00 00 00 00 00                  ...........

No.     Time           Source                Destination           Protocol Length Info
  12466 24.402798      1.25.4                host                  USB      27     URB_INTERRUPT out

Frame 12466: 27 bytes on wire (216 bits), 27 bytes captured (216 bits) on interface \\.\USBPcap1, id 0
USB URB
    [Source: 1.25.4]
    [Destination: host]
    USBPcap pseudoheader length: 27
    IRP ID: 0xffff83030a2c7010
    IRP USBD_STATUS: USBD_STATUS_SUCCESS (0x00000000)
    URB Function: URB_FUNCTION_BULK_OR_INTERRUPT_TRANSFER (0x0009)
    IRP information: 0x01, Direction: PDO -> FDO
        0000 000. = Reserved: 0x00
        .... ...1 = Direction: PDO -> FDO (0x1)
    URB bus id: 1
    Device address: 25
    Endpoint: 0x04, Direction: OUT
        0... .... = Direction: OUT (0)
        .... 0100 = Endpoint number: 4
    URB transfer type: URB_INTERRUPT (0x01)
    Packet Data Length: 0
    [Request in: 12465]
    [Time from request: 0.000982000 seconds]
    [bInterfaceClass: HID (0x03)]

0000  1b 00 10 70 2c 0a 03 83 ff ff 00 00 00 00 09 00   ...p,...........
0010  01 01 00 19 00 04 01 00 00 00 00                  ...........

No.     Time           Source                Destination           Protocol Length Info
  12467 24.403785      1.25.3                host                  USB      91     URB_INTERRUPT in

Frame 12467: 91 bytes on wire (728 bits), 91 bytes captured (728 bits) on interface \\.\USBPcap1, id 0
USB URB
    [Source: 1.25.3]
    [Destination: host]
    USBPcap pseudoheader length: 27
    IRP ID: 0xffff8303221f5a20
    IRP USBD_STATUS: USBD_STATUS_SUCCESS (0x00000000)
    URB Function: URB_FUNCTION_BULK_OR_INTERRUPT_TRANSFER (0x0009)
    IRP information: 0x01, Direction: PDO -> FDO
        0000 000. = Reserved: 0x00
        .... ...1 = Direction: PDO -> FDO (0x1)
    URB bus id: 1
    Device address: 25
    Endpoint: 0x83, Direction: IN
        1... .... = Direction: IN (1)
        .... 0011 = Endpoint number: 3
    URB transfer type: URB_INTERRUPT (0x01)
    Packet Data Length: 64
    [Request in: 12460]
    [Time from request: 0.021928000 seconds]
    [bInterfaceClass: HID (0x03)]
HID Data: 41800000000000000000000000000000000000000000000000000000000000000000000000000000000000000000000000000000000000000000000000000000

0000  1b 00 20 5a 1f 22 03 83 ff ff 00 00 00 00 09 00   .. Z."..........
0010  01 01 00 19 00 83 01 40 00 00 00 41 80 00 00 00   .......@...A....
0020  00 00 00 00 00 00 00 00 00 00 00 00 00 00 00 00   ................
0030  00 00 00 00 00 00 00 00 00 00 00 00 00 00 00 00   ................
0040  00 00 00 00 00 00 00 00 00 00 00 00 00 00 00 00   ................
0050  00 00 00 00 00 00 00 00 00 00 00                  ...........

No.     Time           Source                Destination           Protocol Length Info
  12468 24.403857      host                  1.25.3                USB      27     URB_INTERRUPT in

Frame 12468: 27 bytes on wire (216 bits), 27 bytes captured (216 bits) on interface \\.\USBPcap1, id 0
USB URB
    [Source: host]
    [Destination: 1.25.3]
    USBPcap pseudoheader length: 27
    IRP ID: 0xffff8303221f5a20
    IRP USBD_STATUS: USBD_STATUS_SUCCESS (0x00000000)
    URB Function: URB_FUNCTION_BULK_OR_INTERRUPT_TRANSFER (0x0009)
    IRP information: 0x00, Direction: FDO -> PDO
        0000 000. = Reserved: 0x00
        .... ...0 = Direction: FDO -> PDO (0x0)
    URB bus id: 1
    Device address: 25
    Endpoint: 0x83, Direction: IN
        1... .... = Direction: IN (1)
        .... 0011 = Endpoint number: 3
    URB transfer type: URB_INTERRUPT (0x01)
    Packet Data Length: 0
    [Response in: 12743]
    [bInterfaceClass: HID (0x03)]

0000  1b 00 20 5a 1f 22 03 83 ff ff 00 00 00 00 09 00   .. Z."..........
0010  00 01 00 19 00 83 01 00 00 00 00                  ...........

No.     Time           Source                Destination           Protocol Length Info
  12469 24.413527      host                  1.25.4                USB      91     URB_INTERRUPT out

Frame 12469: 91 bytes on wire (728 bits), 91 bytes captured (728 bits) on interface \\.\USBPcap1, id 0
USB URB
    [Source: host]
    [Destination: 1.25.4]
    USBPcap pseudoheader length: 27
    IRP ID: 0xffff83030a2c7010
    IRP USBD_STATUS: USBD_STATUS_SUCCESS (0x00000000)
    URB Function: URB_FUNCTION_BULK_OR_INTERRUPT_TRANSFER (0x0009)
    IRP information: 0x00, Direction: FDO -> PDO
        0000 000. = Reserved: 0x00
        .... ...0 = Direction: FDO -> PDO (0x0)
    URB bus id: 1
    Device address: 25
    Endpoint: 0x04, Direction: OUT
        0... .... = Direction: OUT (0)
        .... 0100 = Endpoint number: 4
    URB transfer type: URB_INTERRUPT (0x01)
    Packet Data Length: 64
    [Response in: 12470]
    [bInterfaceClass: HID (0x03)]
HID Data: 51280000ff0000000000000000000000000000000000000000000000000000000000000000000000000000000000000000000000000000000000000000000000

0000  1b 00 10 70 2c 0a 03 83 ff ff 00 00 00 00 09 00   ...p,...........
0010  00 01 00 19 00 04 01 40 00 00 00 51 28 00 00 ff   .......@...Q(...
0020  00 00 00 00 00 00 00 00 00 00 00 00 00 00 00 00   ................
0030  00 00 00 00 00 00 00 00 00 00 00 00 00 00 00 00   ................
0040  00 00 00 00 00 00 00 00 00 00 00 00 00 00 00 00   ................
0050  00 00 00 00 00 00 00 00 00 00 00                  ...........

No.     Time           Source                Destination           Protocol Length Info
  12470 24.414798      1.25.4                host                  USB      27     URB_INTERRUPT out

Frame 12470: 27 bytes on wire (216 bits), 27 bytes captured (216 bits) on interface \\.\USBPcap1, id 0
USB URB
    [Source: 1.25.4]
    [Destination: host]
    USBPcap pseudoheader length: 27
    IRP ID: 0xffff83030a2c7010
    IRP USBD_STATUS: USBD_STATUS_SUCCESS (0x00000000)
    URB Function: URB_FUNCTION_BULK_OR_INTERRUPT_TRANSFER (0x0009)
    IRP information: 0x01, Direction: PDO -> FDO
        0000 000. = Reserved: 0x00
        .... ...1 = Direction: PDO -> FDO (0x1)
    URB bus id: 1
    Device address: 25
    Endpoint: 0x04, Direction: OUT
        0... .... = Direction: OUT (0)
        .... 0100 = Endpoint number: 4
    URB transfer type: URB_INTERRUPT (0x01)
    Packet Data Length: 0
    [Request in: 12469]
    [Time from request: 0.001271000 seconds]
    [bInterfaceClass: HID (0x03)]

0000  1b 00 10 70 2c 0a 03 83 ff ff 00 00 00 00 09 00   ...p,...........
0010  01 01 00 19 00 04 01 00 00 00 00                  ...........

No.     Time           Source                Destination           Protocol Length Info
  12471 24.415784      1.25.3                host                  USB      91     URB_INTERRUPT in

Frame 12471: 91 bytes on wire (728 bits), 91 bytes captured (728 bits) on interface \\.\USBPcap1, id 0
USB URB
    [Source: 1.25.3]
    [Destination: host]
    USBPcap pseudoheader length: 27
    IRP ID: 0xffff83030ee9ea20
    IRP USBD_STATUS: USBD_STATUS_SUCCESS (0x00000000)
    URB Function: URB_FUNCTION_BULK_OR_INTERRUPT_TRANSFER (0x0009)
    IRP information: 0x01, Direction: PDO -> FDO
        0000 000. = Reserved: 0x00
        .... ...1 = Direction: PDO -> FDO (0x1)
    URB bus id: 1
    Device address: 25
    Endpoint: 0x83, Direction: IN
        1... .... = Direction: IN (1)
        .... 0011 = Endpoint number: 3
    URB transfer type: URB_INTERRUPT (0x01)
    Packet Data Length: 64
    [Request in: 12464]
    [Time from request: 0.022954000 seconds]
    [bInterfaceClass: HID (0x03)]
HID Data: 51280000000000000000000000000000000000000000000000000000000000000000000000000000000000000000000000000000000000000000000000000000

0000  1b 00 20 ea e9 0e 03 83 ff ff 00 00 00 00 09 00   .. .............
0010  01 01 00 19 00 83 01 40 00 00 00 51 28 00 00 00   .......@...Q(...
0020  00 00 00 00 00 00 00 00 00 00 00 00 00 00 00 00   ................
0030  00 00 00 00 00 00 00 00 00 00 00 00 00 00 00 00   ................
0040  00 00 00 00 00 00 00 00 00 00 00 00 00 00 00 00   ................
0050  00 00 00 00 00 00 00 00 00 00 00                  ...........

No.     Time           Source                Destination           Protocol Length Info
  12472 24.415821      host                  1.25.3                USB      27     URB_INTERRUPT in

Frame 12472: 27 bytes on wire (216 bits), 27 bytes captured (216 bits) on interface \\.\USBPcap1, id 0
USB URB
    [Source: host]
    [Destination: 1.25.3]
    USBPcap pseudoheader length: 27
    IRP ID: 0xffff83030ee9ea20
    IRP USBD_STATUS: USBD_STATUS_SUCCESS (0x00000000)
    URB Function: URB_FUNCTION_BULK_OR_INTERRUPT_TRANSFER (0x0009)
    IRP information: 0x00, Direction: FDO -> PDO
        0000 000. = Reserved: 0x00
        .... ...0 = Direction: FDO -> PDO (0x0)
    URB bus id: 1
    Device address: 25
    Endpoint: 0x83, Direction: IN
        1... .... = Direction: IN (1)
        .... 0011 = Endpoint number: 3
    URB transfer type: URB_INTERRUPT (0x01)
    Packet Data Length: 0
    [Response in: 12747]
    [bInterfaceClass: HID (0x03)]

0000  1b 00 20 ea e9 0e 03 83 ff ff 00 00 00 00 09 00   .. .............
0010  00 01 00 19 00 83 01 00 00 00 00                  ...........

No.     Time           Source                Destination           Protocol Length Info
  12741 25.549308      host                  1.25.4                USB      91     URB_INTERRUPT out

Frame 12741: 91 bytes on wire (728 bits), 91 bytes captured (728 bits) on interface \\.\USBPcap1, id 0
USB URB
    [Source: host]
    [Destination: 1.25.4]
    USBPcap pseudoheader length: 27
    IRP ID: 0xffff83030a2c7010
    IRP USBD_STATUS: USBD_STATUS_SUCCESS (0x00000000)
    URB Function: URB_FUNCTION_BULK_OR_INTERRUPT_TRANSFER (0x0009)
    IRP information: 0x00, Direction: FDO -> PDO
        0000 000. = Reserved: 0x00
        .... ...0 = Direction: FDO -> PDO (0x0)
    URB bus id: 1
    Device address: 25
    Endpoint: 0x04, Direction: OUT
        0... .... = Direction: OUT (0)
        .... 0100 = Endpoint number: 4
    URB transfer type: URB_INTERRUPT (0x01)
    Packet Data Length: 64
    [Response in: 12742]
    [bInterfaceClass: HID (0x03)]
HID Data: 568100000100000002000000bbbbbbbb000000000000000000000000000000000000000000000000000000000000000000000000000000000000000000000000

0000  1b 00 10 70 2c 0a 03 83 ff ff 00 00 00 00 09 00   ...p,...........
0010  00 01 00 19 00 04 01 40 00 00 00 56 81 00 00 01   .......@...V....
0020  00 00 00 02 00 00 00 bb bb bb bb 00 00 00 00 00   ................
0030  00 00 00 00 00 00 00 00 00 00 00 00 00 00 00 00   ................
0040  00 00 00 00 00 00 00 00 00 00 00 00 00 00 00 00   ................
0050  00 00 00 00 00 00 00 00 00 00 00                  ...........

No.     Time           Source                Destination           Protocol Length Info
  12742 25.549806      1.25.4                host                  USB      27     URB_INTERRUPT out

Frame 12742: 27 bytes on wire (216 bits), 27 bytes captured (216 bits) on interface \\.\USBPcap1, id 0
USB URB
    [Source: 1.25.4]
    [Destination: host]
    USBPcap pseudoheader length: 27
    IRP ID: 0xffff83030a2c7010
    IRP USBD_STATUS: USBD_STATUS_SUCCESS (0x00000000)
    URB Function: URB_FUNCTION_BULK_OR_INTERRUPT_TRANSFER (0x0009)
    IRP information: 0x01, Direction: PDO -> FDO
        0000 000. = Reserved: 0x00
        .... ...1 = Direction: PDO -> FDO (0x1)
    URB bus id: 1
    Device address: 25
    Endpoint: 0x04, Direction: OUT
        0... .... = Direction: OUT (0)
        .... 0100 = Endpoint number: 4
    URB transfer type: URB_INTERRUPT (0x01)
    Packet Data Length: 0
    [Request in: 12741]
    [Time from request: 0.000498000 seconds]
    [bInterfaceClass: HID (0x03)]

0000  1b 00 10 70 2c 0a 03 83 ff ff 00 00 00 00 09 00   ...p,...........
0010  01 01 00 19 00 04 01 00 00 00 00                  ...........

No.     Time           Source                Destination           Protocol Length Info
  12743 25.550778      1.25.3                host                  USB      91     URB_INTERRUPT in

Frame 12743: 91 bytes on wire (728 bits), 91 bytes captured (728 bits) on interface \\.\USBPcap1, id 0
USB URB
    [Source: 1.25.3]
    [Destination: host]
    USBPcap pseudoheader length: 27
    IRP ID: 0xffff8303221f5a20
    IRP USBD_STATUS: USBD_STATUS_SUCCESS (0x00000000)
    URB Function: URB_FUNCTION_BULK_OR_INTERRUPT_TRANSFER (0x0009)
    IRP information: 0x01, Direction: PDO -> FDO
        0000 000. = Reserved: 0x00
        .... ...1 = Direction: PDO -> FDO (0x1)
    URB bus id: 1
    Device address: 25
    Endpoint: 0x83, Direction: IN
        1... .... = Direction: IN (1)
        .... 0011 = Endpoint number: 3
    URB transfer type: URB_INTERRUPT (0x01)
    Packet Data Length: 64
    [Request in: 12468]
    [Time from request: 1.146921000 seconds]
    [bInterfaceClass: HID (0x03)]
HID Data: 56810000000000000000000000000000000000000000000000000000000000000000000000000000000000000000000000000000000000000000000000000000

0000  1b 00 20 5a 1f 22 03 83 ff ff 00 00 00 00 09 00   .. Z."..........
0010  01 01 00 19 00 83 01 40 00 00 00 56 81 00 00 00   .......@...V....
0020  00 00 00 00 00 00 00 00 00 00 00 00 00 00 00 00   ................
0030  00 00 00 00 00 00 00 00 00 00 00 00 00 00 00 00   ................
0040  00 00 00 00 00 00 00 00 00 00 00 00 00 00 00 00   ................
0050  00 00 00 00 00 00 00 00 00 00 00                  ...........

No.     Time           Source                Destination           Protocol Length Info
  12744 25.550850      host                  1.25.3                USB      27     URB_INTERRUPT in

Frame 12744: 27 bytes on wire (216 bits), 27 bytes captured (216 bits) on interface \\.\USBPcap1, id 0
USB URB
    [Source: host]
    [Destination: 1.25.3]
    USBPcap pseudoheader length: 27
    IRP ID: 0xffff8303221f5a20
    IRP USBD_STATUS: USBD_STATUS_SUCCESS (0x00000000)
    URB Function: URB_FUNCTION_BULK_OR_INTERRUPT_TRANSFER (0x0009)
    IRP information: 0x00, Direction: FDO -> PDO
        0000 000. = Reserved: 0x00
        .... ...0 = Direction: FDO -> PDO (0x0)
    URB bus id: 1
    Device address: 25
    Endpoint: 0x83, Direction: IN
        1... .... = Direction: IN (1)
        .... 0011 = Endpoint number: 3
    URB transfer type: URB_INTERRUPT (0x01)
    Packet Data Length: 0
    [Response in: 12751]
    [bInterfaceClass: HID (0x03)]

0000  1b 00 20 5a 1f 22 03 83 ff ff 00 00 00 00 09 00   .. Z."..........
0010  00 01 00 19 00 83 01 00 00 00 00                  ...........

No.     Time           Source                Destination           Protocol Length Info
  12745 25.557894      host                  1.25.4                USB      91     URB_INTERRUPT out

Frame 12745: 91 bytes on wire (728 bits), 91 bytes captured (728 bits) on interface \\.\USBPcap1, id 0
USB URB
    [Source: host]
    [Destination: 1.25.4]
    USBPcap pseudoheader length: 27
    IRP ID: 0xffff83030a2c7010
    IRP USBD_STATUS: USBD_STATUS_SUCCESS (0x00000000)
    URB Function: URB_FUNCTION_BULK_OR_INTERRUPT_TRANSFER (0x0009)
    IRP information: 0x00, Direction: FDO -> PDO
        0000 000. = Reserved: 0x00
        .... ...0 = Direction: FDO -> PDO (0x0)
    URB bus id: 1
    Device address: 25
    Endpoint: 0x04, Direction: OUT
        0... .... = Direction: OUT (0)
        .... 0100 = Endpoint number: 4
    URB transfer type: URB_INTERRUPT (0x01)
    Packet Data Length: 64
    [Response in: 12746]
    [bInterfaceClass: HID (0x03)]
HID Data: 568300000100000080010000ff0000000000ffff00000000d752ff000000000000000000000000d752ff000000000000000000000000d752ff00000000000000

0000  1b 00 10 70 2c 0a 03 83 ff ff 00 00 00 00 09 00   ...p,...........
0010  00 01 00 19 00 04 01 40 00 00 00 56 83 00 00 01   .......@...V....
0020  00 00 00 80 01 00 00 ff 00 00 00 00 00 ff ff 00   ................
0030  00 00 00 d7 52 ff 00 00 00 00 00 00 00 00 00 00   ....R...........
0040  00 00 d7 52 ff 00 00 00 00 00 00 00 00 00 00 00   ...R............
0050  00 d7 52 ff 00 00 00 00 00 00 00                  ..R........

No.     Time           Source                Destination           Protocol Length Info
  12746 25.558799      1.25.4                host                  USB      27     URB_INTERRUPT out

Frame 12746: 27 bytes on wire (216 bits), 27 bytes captured (216 bits) on interface \\.\USBPcap1, id 0
USB URB
    [Source: 1.25.4]
    [Destination: host]
    USBPcap pseudoheader length: 27
    IRP ID: 0xffff83030a2c7010
    IRP USBD_STATUS: USBD_STATUS_SUCCESS (0x00000000)
    URB Function: URB_FUNCTION_BULK_OR_INTERRUPT_TRANSFER (0x0009)
    IRP information: 0x01, Direction: PDO -> FDO
        0000 000. = Reserved: 0x00
        .... ...1 = Direction: PDO -> FDO (0x1)
    URB bus id: 1
    Device address: 25
    Endpoint: 0x04, Direction: OUT
        0... .... = Direction: OUT (0)
        .... 0100 = Endpoint number: 4
    URB transfer type: URB_INTERRUPT (0x01)
    Packet Data Length: 0
    [Request in: 12745]
    [Time from request: 0.000905000 seconds]
    [bInterfaceClass: HID (0x03)]

0000  1b 00 10 70 2c 0a 03 83 ff ff 00 00 00 00 09 00   ...p,...........
0010  01 01 00 19 00 04 01 00 00 00 00                  ...........

No.     Time           Source                Destination           Protocol Length Info
  12747 25.559806      1.25.3                host                  USB      91     URB_INTERRUPT in

Frame 12747: 91 bytes on wire (728 bits), 91 bytes captured (728 bits) on interface \\.\USBPcap1, id 0
USB URB
    [Source: 1.25.3]
    [Destination: host]
    USBPcap pseudoheader length: 27
    IRP ID: 0xffff83030ee9ea20
    IRP USBD_STATUS: USBD_STATUS_SUCCESS (0x00000000)
    URB Function: URB_FUNCTION_BULK_OR_INTERRUPT_TRANSFER (0x0009)
    IRP information: 0x01, Direction: PDO -> FDO
        0000 000. = Reserved: 0x00
        .... ...1 = Direction: PDO -> FDO (0x1)
    URB bus id: 1
    Device address: 25
    Endpoint: 0x83, Direction: IN
        1... .... = Direction: IN (1)
        .... 0011 = Endpoint number: 3
    URB transfer type: URB_INTERRUPT (0x01)
    Packet Data Length: 64
    [Request in: 12472]
    [Time from request: 1.143985000 seconds]
    [bInterfaceClass: HID (0x03)]
HID Data: 56830000000000000000000000000000000000000000000000000000000000000000000000000000000000000000000000000000000000000000000000000000

0000  1b 00 20 ea e9 0e 03 83 ff ff 00 00 00 00 09 00   .. .............
0010  01 01 00 19 00 83 01 40 00 00 00 56 83 00 00 00   .......@...V....
0020  00 00 00 00 00 00 00 00 00 00 00 00 00 00 00 00   ................
0030  00 00 00 00 00 00 00 00 00 00 00 00 00 00 00 00   ................
0040  00 00 00 00 00 00 00 00 00 00 00 00 00 00 00 00   ................
0050  00 00 00 00 00 00 00 00 00 00 00                  ...........

No.     Time           Source                Destination           Protocol Length Info
  12748 25.559839      host                  1.25.3                USB      27     URB_INTERRUPT in

Frame 12748: 27 bytes on wire (216 bits), 27 bytes captured (216 bits) on interface \\.\USBPcap1, id 0
USB URB
    [Source: host]
    [Destination: 1.25.3]
    USBPcap pseudoheader length: 27
    IRP ID: 0xffff83030ee9ea20
    IRP USBD_STATUS: USBD_STATUS_SUCCESS (0x00000000)
    URB Function: URB_FUNCTION_BULK_OR_INTERRUPT_TRANSFER (0x0009)
    IRP information: 0x00, Direction: FDO -> PDO
        0000 000. = Reserved: 0x00
        .... ...0 = Direction: FDO -> PDO (0x0)
    URB bus id: 1
    Device address: 25
    Endpoint: 0x83, Direction: IN
        1... .... = Direction: IN (1)
        .... 0011 = Endpoint number: 3
    URB transfer type: URB_INTERRUPT (0x01)
    Packet Data Length: 0
    [Response in: 12755]
    [bInterfaceClass: HID (0x03)]

0000  1b 00 20 ea e9 0e 03 83 ff ff 00 00 00 00 09 00   .. .............
0010  00 01 00 19 00 83 01 00 00 00 00                  ...........

No.     Time           Source                Destination           Protocol Length Info
  12749 25.567252      host                  1.25.4                USB      91     URB_INTERRUPT out

Frame 12749: 91 bytes on wire (728 bits), 91 bytes captured (728 bits) on interface \\.\USBPcap1, id 0
USB URB
    [Source: host]
    [Destination: 1.25.4]
    USBPcap pseudoheader length: 27
    IRP ID: 0xffff83030a2c7010
    IRP USBD_STATUS: USBD_STATUS_SUCCESS (0x00000000)
    URB Function: URB_FUNCTION_BULK_OR_INTERRUPT_TRANSFER (0x0009)
    IRP information: 0x00, Direction: FDO -> PDO
        0000 000. = Reserved: 0x00
        .... ...0 = Direction: FDO -> PDO (0x0)
    URB bus id: 1
    Device address: 25
    Endpoint: 0x04, Direction: OUT
        0... .... = Direction: OUT (0)
        .... 0100 = Endpoint number: 4
    URB transfer type: URB_INTERRUPT (0x01)
    Packet Data Length: 64
    [Response in: 12750]
    [bInterfaceClass: HID (0x03)]
HID Data: 568301000000000000d752ff00000000000000000000000000000000000000000000000000000000000000000000000000000000000000000000000000000000

0000  1b 00 10 70 2c 0a 03 83 ff ff 00 00 00 00 09 00   ...p,...........
0010  00 01 00 19 00 04 01 40 00 00 00 56 83 01 00 00   .......@...V....
0020  00 00 00 00 d7 52 ff 00 00 00 00 00 00 00 00 00   .....R..........
0030  00 00 00 00 00 00 00 00 00 00 00 00 00 00 00 00   ................
0040  00 00 00 00 00 00 00 00 00 00 00 00 00 00 00 00   ................
0050  00 00 00 00 00 00 00 00 00 00 00                  ...........

No.     Time           Source                Destination           Protocol Length Info
  12750 25.567782      1.25.4                host                  USB      27     URB_INTERRUPT out

Frame 12750: 27 bytes on wire (216 bits), 27 bytes captured (216 bits) on interface \\.\USBPcap1, id 0
USB URB
    [Source: 1.25.4]
    [Destination: host]
    USBPcap pseudoheader length: 27
    IRP ID: 0xffff83030a2c7010
    IRP USBD_STATUS: USBD_STATUS_SUCCESS (0x00000000)
    URB Function: URB_FUNCTION_BULK_OR_INTERRUPT_TRANSFER (0x0009)
    IRP information: 0x01, Direction: PDO -> FDO
        0000 000. = Reserved: 0x00
        .... ...1 = Direction: PDO -> FDO (0x1)
    URB bus id: 1
    Device address: 25
    Endpoint: 0x04, Direction: OUT
        0... .... = Direction: OUT (0)
        .... 0100 = Endpoint number: 4
    URB transfer type: URB_INTERRUPT (0x01)
    Packet Data Length: 0
    [Request in: 12749]
    [Time from request: 0.000530000 seconds]
    [bInterfaceClass: HID (0x03)]

0000  1b 00 10 70 2c 0a 03 83 ff ff 00 00 00 00 09 00   ...p,...........
0010  01 01 00 19 00 04 01 00 00 00 00                  ...........

No.     Time           Source                Destination           Protocol Length Info
  12751 25.568781      1.25.3                host                  USB      91     URB_INTERRUPT in

Frame 12751: 91 bytes on wire (728 bits), 91 bytes captured (728 bits) on interface \\.\USBPcap1, id 0
USB URB
    [Source: 1.25.3]
    [Destination: host]
    USBPcap pseudoheader length: 27
    IRP ID: 0xffff8303221f5a20
    IRP USBD_STATUS: USBD_STATUS_SUCCESS (0x00000000)
    URB Function: URB_FUNCTION_BULK_OR_INTERRUPT_TRANSFER (0x0009)
    IRP information: 0x01, Direction: PDO -> FDO
        0000 000. = Reserved: 0x00
        .... ...1 = Direction: PDO -> FDO (0x1)
    URB bus id: 1
    Device address: 25
    Endpoint: 0x83, Direction: IN
        1... .... = Direction: IN (1)
        .... 0011 = Endpoint number: 3
    URB transfer type: URB_INTERRUPT (0x01)
    Packet Data Length: 64
    [Request in: 12744]
    [Time from request: 0.017931000 seconds]
    [bInterfaceClass: HID (0x03)]
HID Data: 56830100000000000000000000000000000000000000000000000000000000000000000000000000000000000000000000000000000000000000000000000000

0000  1b 00 20 5a 1f 22 03 83 ff ff 00 00 00 00 09 00   .. Z."..........
0010  01 01 00 19 00 83 01 40 00 00 00 56 83 01 00 00   .......@...V....
0020  00 00 00 00 00 00 00 00 00 00 00 00 00 00 00 00   ................
0030  00 00 00 00 00 00 00 00 00 00 00 00 00 00 00 00   ................
0040  00 00 00 00 00 00 00 00 00 00 00 00 00 00 00 00   ................
0050  00 00 00 00 00 00 00 00 00 00 00                  ...........

No.     Time           Source                Destination           Protocol Length Info
  12752 25.568840      host                  1.25.3                USB      27     URB_INTERRUPT in

Frame 12752: 27 bytes on wire (216 bits), 27 bytes captured (216 bits) on interface \\.\USBPcap1, id 0
USB URB
    [Source: host]
    [Destination: 1.25.3]
    USBPcap pseudoheader length: 27
    IRP ID: 0xffff8303221f5a20
    IRP USBD_STATUS: USBD_STATUS_SUCCESS (0x00000000)
    URB Function: URB_FUNCTION_BULK_OR_INTERRUPT_TRANSFER (0x0009)
    IRP information: 0x00, Direction: FDO -> PDO
        0000 000. = Reserved: 0x00
        .... ...0 = Direction: FDO -> PDO (0x0)
    URB bus id: 1
    Device address: 25
    Endpoint: 0x83, Direction: IN
        1... .... = Direction: IN (1)
        .... 0011 = Endpoint number: 3
    URB transfer type: URB_INTERRUPT (0x01)
    Packet Data Length: 0
    [Response in: 12759]
    [bInterfaceClass: HID (0x03)]

0000  1b 00 20 5a 1f 22 03 83 ff ff 00 00 00 00 09 00   .. Z."..........
0010  00 01 00 19 00 83 01 00 00 00 00                  ...........

No.     Time           Source                Destination           Protocol Length Info
  12753 25.575414      host                  1.25.4                USB      91     URB_INTERRUPT out

Frame 12753: 91 bytes on wire (728 bits), 91 bytes captured (728 bits) on interface \\.\USBPcap1, id 0
USB URB
    [Source: host]
    [Destination: 1.25.4]
    USBPcap pseudoheader length: 27
    IRP ID: 0xffff83030d132900
    IRP USBD_STATUS: USBD_STATUS_SUCCESS (0x00000000)
    URB Function: URB_FUNCTION_BULK_OR_INTERRUPT_TRANSFER (0x0009)
    IRP information: 0x00, Direction: FDO -> PDO
        0000 000. = Reserved: 0x00
        .... ...0 = Direction: FDO -> PDO (0x0)
    URB bus id: 1
    Device address: 25
    Endpoint: 0x04, Direction: OUT
        0... .... = Direction: OUT (0)
        .... 0100 = Endpoint number: 4
    URB transfer type: URB_INTERRUPT (0x01)
    Packet Data Length: 64
    [Response in: 12754]
    [bInterfaceClass: HID (0x03)]
HID Data: 41800000000000000000000000000000000000000000000000000000000000000000000000000000000000000000000000000000000000000000000000000000

0000  1b 00 00 29 13 0d 03 83 ff ff 00 00 00 00 09 00   ...)............
0010  00 01 00 19 00 04 01 40 00 00 00 41 80 00 00 00   .......@...A....
0020  00 00 00 00 00 00 00 00 00 00 00 00 00 00 00 00   ................
0030  00 00 00 00 00 00 00 00 00 00 00 00 00 00 00 00   ................
0040  00 00 00 00 00 00 00 00 00 00 00 00 00 00 00 00   ................
0050  00 00 00 00 00 00 00 00 00 00 00                  ...........

No.     Time           Source                Destination           Protocol Length Info
  12754 25.575780      1.25.4                host                  USB      27     URB_INTERRUPT out

Frame 12754: 27 bytes on wire (216 bits), 27 bytes captured (216 bits) on interface \\.\USBPcap1, id 0
USB URB
    [Source: 1.25.4]
    [Destination: host]
    USBPcap pseudoheader length: 27
    IRP ID: 0xffff83030d132900
    IRP USBD_STATUS: USBD_STATUS_SUCCESS (0x00000000)
    URB Function: URB_FUNCTION_BULK_OR_INTERRUPT_TRANSFER (0x0009)
    IRP information: 0x01, Direction: PDO -> FDO
        0000 000. = Reserved: 0x00
        .... ...1 = Direction: PDO -> FDO (0x1)
    URB bus id: 1
    Device address: 25
    Endpoint: 0x04, Direction: OUT
        0... .... = Direction: OUT (0)
        .... 0100 = Endpoint number: 4
    URB transfer type: URB_INTERRUPT (0x01)
    Packet Data Length: 0
    [Request in: 12753]
    [Time from request: 0.000366000 seconds]
    [bInterfaceClass: HID (0x03)]

0000  1b 00 00 29 13 0d 03 83 ff ff 00 00 00 00 09 00   ...)............
0010  01 01 00 19 00 04 01 00 00 00 00                  ...........

No.     Time           Source                Destination           Protocol Length Info
  12755 25.576774      1.25.3                host                  USB      91     URB_INTERRUPT in

Frame 12755: 91 bytes on wire (728 bits), 91 bytes captured (728 bits) on interface \\.\USBPcap1, id 0
USB URB
    [Source: 1.25.3]
    [Destination: host]
    USBPcap pseudoheader length: 27
    IRP ID: 0xffff83030ee9ea20
    IRP USBD_STATUS: USBD_STATUS_SUCCESS (0x00000000)
    URB Function: URB_FUNCTION_BULK_OR_INTERRUPT_TRANSFER (0x0009)
    IRP information: 0x01, Direction: PDO -> FDO
        0000 000. = Reserved: 0x00
        .... ...1 = Direction: PDO -> FDO (0x1)
    URB bus id: 1
    Device address: 25
    Endpoint: 0x83, Direction: IN
        1... .... = Direction: IN (1)
        .... 0011 = Endpoint number: 3
    URB transfer type: URB_INTERRUPT (0x01)
    Packet Data Length: 64
    [Request in: 12748]
    [Time from request: 0.016935000 seconds]
    [bInterfaceClass: HID (0x03)]
HID Data: 41800000000000000000000000000000000000000000000000000000000000000000000000000000000000000000000000000000000000000000000000000000

0000  1b 00 20 ea e9 0e 03 83 ff ff 00 00 00 00 09 00   .. .............
0010  01 01 00 19 00 83 01 40 00 00 00 41 80 00 00 00   .......@...A....
0020  00 00 00 00 00 00 00 00 00 00 00 00 00 00 00 00   ................
0030  00 00 00 00 00 00 00 00 00 00 00 00 00 00 00 00   ................
0040  00 00 00 00 00 00 00 00 00 00 00 00 00 00 00 00   ................
0050  00 00 00 00 00 00 00 00 00 00 00                  ...........

No.     Time           Source                Destination           Protocol Length Info
  12756 25.576816      host                  1.25.3                USB      27     URB_INTERRUPT in

Frame 12756: 27 bytes on wire (216 bits), 27 bytes captured (216 bits) on interface \\.\USBPcap1, id 0
USB URB
    [Source: host]
    [Destination: 1.25.3]
    USBPcap pseudoheader length: 27
    IRP ID: 0xffff83030ee9ea20
    IRP USBD_STATUS: USBD_STATUS_SUCCESS (0x00000000)
    URB Function: URB_FUNCTION_BULK_OR_INTERRUPT_TRANSFER (0x0009)
    IRP information: 0x00, Direction: FDO -> PDO
        0000 000. = Reserved: 0x00
        .... ...0 = Direction: FDO -> PDO (0x0)
    URB bus id: 1
    Device address: 25
    Endpoint: 0x83, Direction: IN
        1... .... = Direction: IN (1)
        .... 0011 = Endpoint number: 3
    URB transfer type: URB_INTERRUPT (0x01)
    Packet Data Length: 0
    [Response in: 13005]
    [bInterfaceClass: HID (0x03)]

0000  1b 00 20 ea e9 0e 03 83 ff ff 00 00 00 00 09 00   .. .............
0010  00 01 00 19 00 83 01 00 00 00 00                  ...........

No.     Time           Source                Destination           Protocol Length Info
  12757 25.585660      host                  1.25.4                USB      91     URB_INTERRUPT out

Frame 12757: 91 bytes on wire (728 bits), 91 bytes captured (728 bits) on interface \\.\USBPcap1, id 0
USB URB
    [Source: host]
    [Destination: 1.25.4]
    USBPcap pseudoheader length: 27
    IRP ID: 0xffff83030a2c7010
    IRP USBD_STATUS: USBD_STATUS_SUCCESS (0x00000000)
    URB Function: URB_FUNCTION_BULK_OR_INTERRUPT_TRANSFER (0x0009)
    IRP information: 0x00, Direction: FDO -> PDO
        0000 000. = Reserved: 0x00
        .... ...0 = Direction: FDO -> PDO (0x0)
    URB bus id: 1
    Device address: 25
    Endpoint: 0x04, Direction: OUT
        0... .... = Direction: OUT (0)
        .... 0100 = Endpoint number: 4
    URB transfer type: URB_INTERRUPT (0x01)
    Packet Data Length: 64
    [Response in: 12758]
    [bInterfaceClass: HID (0x03)]
HID Data: 51280000ff0000000000000000000000000000000000000000000000000000000000000000000000000000000000000000000000000000000000000000000000

0000  1b 00 10 70 2c 0a 03 83 ff ff 00 00 00 00 09 00   ...p,...........
0010  00 01 00 19 00 04 01 40 00 00 00 51 28 00 00 ff   .......@...Q(...
0020  00 00 00 00 00 00 00 00 00 00 00 00 00 00 00 00   ................
0030  00 00 00 00 00 00 00 00 00 00 00 00 00 00 00 00   ................
0040  00 00 00 00 00 00 00 00 00 00 00 00 00 00 00 00   ................
0050  00 00 00 00 00 00 00 00 00 00 00                  ...........

No.     Time           Source                Destination           Protocol Length Info
  12758 25.586778      1.25.4                host                  USB      27     URB_INTERRUPT out

Frame 12758: 27 bytes on wire (216 bits), 27 bytes captured (216 bits) on interface \\.\USBPcap1, id 0
USB URB
    [Source: 1.25.4]
    [Destination: host]
    USBPcap pseudoheader length: 27
    IRP ID: 0xffff83030a2c7010
    IRP USBD_STATUS: USBD_STATUS_SUCCESS (0x00000000)
    URB Function: URB_FUNCTION_BULK_OR_INTERRUPT_TRANSFER (0x0009)
    IRP information: 0x01, Direction: PDO -> FDO
        0000 000. = Reserved: 0x00
        .... ...1 = Direction: PDO -> FDO (0x1)
    URB bus id: 1
    Device address: 25
    Endpoint: 0x04, Direction: OUT
        0... .... = Direction: OUT (0)
        .... 0100 = Endpoint number: 4
    URB transfer type: URB_INTERRUPT (0x01)
    Packet Data Length: 0
    [Request in: 12757]
    [Time from request: 0.001118000 seconds]
    [bInterfaceClass: HID (0x03)]

0000  1b 00 10 70 2c 0a 03 83 ff ff 00 00 00 00 09 00   ...p,...........
0010  01 01 00 19 00 04 01 00 00 00 00                  ...........

No.     Time           Source                Destination           Protocol Length Info
  12759 25.587781      1.25.3                host                  USB      91     URB_INTERRUPT in

Frame 12759: 91 bytes on wire (728 bits), 91 bytes captured (728 bits) on interface \\.\USBPcap1, id 0
USB URB
    [Source: 1.25.3]
    [Destination: host]
    USBPcap pseudoheader length: 27
    IRP ID: 0xffff8303221f5a20
    IRP USBD_STATUS: USBD_STATUS_SUCCESS (0x00000000)
    URB Function: URB_FUNCTION_BULK_OR_INTERRUPT_TRANSFER (0x0009)
    IRP information: 0x01, Direction: PDO -> FDO
        0000 000. = Reserved: 0x00
        .... ...1 = Direction: PDO -> FDO (0x1)
    URB bus id: 1
    Device address: 25
    Endpoint: 0x83, Direction: IN
        1... .... = Direction: IN (1)
        .... 0011 = Endpoint number: 3
    URB transfer type: URB_INTERRUPT (0x01)
    Packet Data Length: 64
    [Request in: 12752]
    [Time from request: 0.018941000 seconds]
    [bInterfaceClass: HID (0x03)]
HID Data: 51280000000000000000000000000000000000000000000000000000000000000000000000000000000000000000000000000000000000000000000000000000

0000  1b 00 20 5a 1f 22 03 83 ff ff 00 00 00 00 09 00   .. Z."..........
0010  01 01 00 19 00 83 01 40 00 00 00 51 28 00 00 00   .......@...Q(...
0020  00 00 00 00 00 00 00 00 00 00 00 00 00 00 00 00   ................
0030  00 00 00 00 00 00 00 00 00 00 00 00 00 00 00 00   ................
0040  00 00 00 00 00 00 00 00 00 00 00 00 00 00 00 00   ................
0050  00 00 00 00 00 00 00 00 00 00 00                  ...........

No.     Time           Source                Destination           Protocol Length Info
  12760 25.587834      host                  1.25.3                USB      27     URB_INTERRUPT in

Frame 12760: 27 bytes on wire (216 bits), 27 bytes captured (216 bits) on interface \\.\USBPcap1, id 0
USB URB
    [Source: host]
    [Destination: 1.25.3]
    USBPcap pseudoheader length: 27
    IRP ID: 0xffff8303221f5a20
    IRP USBD_STATUS: USBD_STATUS_SUCCESS (0x00000000)
    URB Function: URB_FUNCTION_BULK_OR_INTERRUPT_TRANSFER (0x0009)
    IRP information: 0x00, Direction: FDO -> PDO
        0000 000. = Reserved: 0x00
        .... ...0 = Direction: FDO -> PDO (0x0)
    URB bus id: 1
    Device address: 25
    Endpoint: 0x83, Direction: IN
        1... .... = Direction: IN (1)
        .... 0011 = Endpoint number: 3
    URB transfer type: URB_INTERRUPT (0x01)
    Packet Data Length: 0
    [Response in: 13009]
    [bInterfaceClass: HID (0x03)]

0000  1b 00 20 5a 1f 22 03 83 ff ff 00 00 00 00 09 00   .. Z."..........
0010  00 01 00 19 00 83 01 00 00 00 00                  ...........

No.     Time           Source                Destination           Protocol Length Info
  13003 26.567300      host                  1.25.4                USB      91     URB_INTERRUPT out

Frame 13003: 91 bytes on wire (728 bits), 91 bytes captured (728 bits) on interface \\.\USBPcap1, id 0
USB URB
    [Source: host]
    [Destination: 1.25.4]
    USBPcap pseudoheader length: 27
    IRP ID: 0xffff83030a2c7010
    IRP USBD_STATUS: USBD_STATUS_SUCCESS (0x00000000)
    URB Function: URB_FUNCTION_BULK_OR_INTERRUPT_TRANSFER (0x0009)
    IRP information: 0x00, Direction: FDO -> PDO
        0000 000. = Reserved: 0x00
        .... ...0 = Direction: FDO -> PDO (0x0)
    URB bus id: 1
    Device address: 25
    Endpoint: 0x04, Direction: OUT
        0... .... = Direction: OUT (0)
        .... 0100 = Endpoint number: 4
    URB transfer type: URB_INTERRUPT (0x01)
    Packet Data Length: 64
    [Response in: 13004]
    [bInterfaceClass: HID (0x03)]
HID Data: 568100000100000002000000bbbbbbbb000000000000000000000000000000000000000000000000000000000000000000000000000000000000000000000000

0000  1b 00 10 70 2c 0a 03 83 ff ff 00 00 00 00 09 00   ...p,...........
0010  00 01 00 19 00 04 01 40 00 00 00 56 81 00 00 01   .......@...V....
0020  00 00 00 02 00 00 00 bb bb bb bb 00 00 00 00 00   ................
0030  00 00 00 00 00 00 00 00 00 00 00 00 00 00 00 00   ................
0040  00 00 00 00 00 00 00 00 00 00 00 00 00 00 00 00   ................
0050  00 00 00 00 00 00 00 00 00 00 00                  ...........

No.     Time           Source                Destination           Protocol Length Info
  13004 26.567784      1.25.4                host                  USB      27     URB_INTERRUPT out

Frame 13004: 27 bytes on wire (216 bits), 27 bytes captured (216 bits) on interface \\.\USBPcap1, id 0
USB URB
    [Source: 1.25.4]
    [Destination: host]
    USBPcap pseudoheader length: 27
    IRP ID: 0xffff83030a2c7010
    IRP USBD_STATUS: USBD_STATUS_SUCCESS (0x00000000)
    URB Function: URB_FUNCTION_BULK_OR_INTERRUPT_TRANSFER (0x0009)
    IRP information: 0x01, Direction: PDO -> FDO
        0000 000. = Reserved: 0x00
        .... ...1 = Direction: PDO -> FDO (0x1)
    URB bus id: 1
    Device address: 25
    Endpoint: 0x04, Direction: OUT
        0... .... = Direction: OUT (0)
        .... 0100 = Endpoint number: 4
    URB transfer type: URB_INTERRUPT (0x01)
    Packet Data Length: 0
    [Request in: 13003]
    [Time from request: 0.000484000 seconds]
    [bInterfaceClass: HID (0x03)]

0000  1b 00 10 70 2c 0a 03 83 ff ff 00 00 00 00 09 00   ...p,...........
0010  01 01 00 19 00 04 01 00 00 00 00                  ...........

No.     Time           Source                Destination           Protocol Length Info
  13005 26.568796      1.25.3                host                  USB      91     URB_INTERRUPT in

Frame 13005: 91 bytes on wire (728 bits), 91 bytes captured (728 bits) on interface \\.\USBPcap1, id 0
USB URB
    [Source: 1.25.3]
    [Destination: host]
    USBPcap pseudoheader length: 27
    IRP ID: 0xffff83030ee9ea20
    IRP USBD_STATUS: USBD_STATUS_SUCCESS (0x00000000)
    URB Function: URB_FUNCTION_BULK_OR_INTERRUPT_TRANSFER (0x0009)
    IRP information: 0x01, Direction: PDO -> FDO
        0000 000. = Reserved: 0x00
        .... ...1 = Direction: PDO -> FDO (0x1)
    URB bus id: 1
    Device address: 25
    Endpoint: 0x83, Direction: IN
        1... .... = Direction: IN (1)
        .... 0011 = Endpoint number: 3
    URB transfer type: URB_INTERRUPT (0x01)
    Packet Data Length: 64
    [Request in: 12756]
    [Time from request: 0.991980000 seconds]
    [bInterfaceClass: HID (0x03)]
HID Data: 56810000000000000000000000000000000000000000000000000000000000000000000000000000000000000000000000000000000000000000000000000000

0000  1b 00 20 ea e9 0e 03 83 ff ff 00 00 00 00 09 00   .. .............
0010  01 01 00 19 00 83 01 40 00 00 00 56 81 00 00 00   .......@...V....
0020  00 00 00 00 00 00 00 00 00 00 00 00 00 00 00 00   ................
0030  00 00 00 00 00 00 00 00 00 00 00 00 00 00 00 00   ................
0040  00 00 00 00 00 00 00 00 00 00 00 00 00 00 00 00   ................
0050  00 00 00 00 00 00 00 00 00 00 00                  ...........

No.     Time           Source                Destination           Protocol Length Info
  13006 26.568840      host                  1.25.3                USB      27     URB_INTERRUPT in

Frame 13006: 27 bytes on wire (216 bits), 27 bytes captured (216 bits) on interface \\.\USBPcap1, id 0
USB URB
    [Source: host]
    [Destination: 1.25.3]
    USBPcap pseudoheader length: 27
    IRP ID: 0xffff83030ee9ea20
    IRP USBD_STATUS: USBD_STATUS_SUCCESS (0x00000000)
    URB Function: URB_FUNCTION_BULK_OR_INTERRUPT_TRANSFER (0x0009)
    IRP information: 0x00, Direction: FDO -> PDO
        0000 000. = Reserved: 0x00
        .... ...0 = Direction: FDO -> PDO (0x0)
    URB bus id: 1
    Device address: 25
    Endpoint: 0x83, Direction: IN
        1... .... = Direction: IN (1)
        .... 0011 = Endpoint number: 3
    URB transfer type: URB_INTERRUPT (0x01)
    Packet Data Length: 0
    [Response in: 13013]
    [bInterfaceClass: HID (0x03)]

0000  1b 00 20 ea e9 0e 03 83 ff ff 00 00 00 00 09 00   .. .............
0010  00 01 00 19 00 83 01 00 00 00 00                  ...........

No.     Time           Source                Destination           Protocol Length Info
  13007 26.577563      host                  1.25.4                USB      91     URB_INTERRUPT out

Frame 13007: 91 bytes on wire (728 bits), 91 bytes captured (728 bits) on interface \\.\USBPcap1, id 0
USB URB
    [Source: host]
    [Destination: 1.25.4]
    USBPcap pseudoheader length: 27
    IRP ID: 0xffff83030d132900
    IRP USBD_STATUS: USBD_STATUS_SUCCESS (0x00000000)
    URB Function: URB_FUNCTION_BULK_OR_INTERRUPT_TRANSFER (0x0009)
    IRP information: 0x00, Direction: FDO -> PDO
        0000 000. = Reserved: 0x00
        .... ...0 = Direction: FDO -> PDO (0x0)
    URB bus id: 1
    Device address: 25
    Endpoint: 0x04, Direction: OUT
        0... .... = Direction: OUT (0)
        .... 0100 = Endpoint number: 4
    URB transfer type: URB_INTERRUPT (0x01)
    Packet Data Length: 64
    [Response in: 13008]
    [bInterfaceClass: HID (0x03)]
HID Data: 568300000100000080010000ff0000000000ffff00000000d752ff000000000000000000000000d752ff000000000000000000000000d752ff00000000000000

0000  1b 00 00 29 13 0d 03 83 ff ff 00 00 00 00 09 00   ...)............
0010  00 01 00 19 00 04 01 40 00 00 00 56 83 00 00 01   .......@...V....
0020  00 00 00 80 01 00 00 ff 00 00 00 00 00 ff ff 00   ................
0030  00 00 00 d7 52 ff 00 00 00 00 00 00 00 00 00 00   ....R...........
0040  00 00 d7 52 ff 00 00 00 00 00 00 00 00 00 00 00   ...R............
0050  00 d7 52 ff 00 00 00 00 00 00 00                  ..R........

No.     Time           Source                Destination           Protocol Length Info
  13008 26.578798      1.25.4                host                  USB      27     URB_INTERRUPT out

Frame 13008: 27 bytes on wire (216 bits), 27 bytes captured (216 bits) on interface \\.\USBPcap1, id 0
USB URB
    [Source: 1.25.4]
    [Destination: host]
    USBPcap pseudoheader length: 27
    IRP ID: 0xffff83030d132900
    IRP USBD_STATUS: USBD_STATUS_SUCCESS (0x00000000)
    URB Function: URB_FUNCTION_BULK_OR_INTERRUPT_TRANSFER (0x0009)
    IRP information: 0x01, Direction: PDO -> FDO
        0000 000. = Reserved: 0x00
        .... ...1 = Direction: PDO -> FDO (0x1)
    URB bus id: 1
    Device address: 25
    Endpoint: 0x04, Direction: OUT
        0... .... = Direction: OUT (0)
        .... 0100 = Endpoint number: 4
    URB transfer type: URB_INTERRUPT (0x01)
    Packet Data Length: 0
    [Request in: 13007]
    [Time from request: 0.001235000 seconds]
    [bInterfaceClass: HID (0x03)]

0000  1b 00 00 29 13 0d 03 83 ff ff 00 00 00 00 09 00   ...)............
0010  01 01 00 19 00 04 01 00 00 00 00                  ...........

No.     Time           Source                Destination           Protocol Length Info
  13009 26.579795      1.25.3                host                  USB      91     URB_INTERRUPT in

Frame 13009: 91 bytes on wire (728 bits), 91 bytes captured (728 bits) on interface \\.\USBPcap1, id 0
USB URB
    [Source: 1.25.3]
    [Destination: host]
    USBPcap pseudoheader length: 27
    IRP ID: 0xffff8303221f5a20
    IRP USBD_STATUS: USBD_STATUS_SUCCESS (0x00000000)
    URB Function: URB_FUNCTION_BULK_OR_INTERRUPT_TRANSFER (0x0009)
    IRP information: 0x01, Direction: PDO -> FDO
        0000 000. = Reserved: 0x00
        .... ...1 = Direction: PDO -> FDO (0x1)
    URB bus id: 1
    Device address: 25
    Endpoint: 0x83, Direction: IN
        1... .... = Direction: IN (1)
        .... 0011 = Endpoint number: 3
    URB transfer type: URB_INTERRUPT (0x01)
    Packet Data Length: 64
    [Request in: 12760]
    [Time from request: 0.991961000 seconds]
    [bInterfaceClass: HID (0x03)]
HID Data: 56830000000000000000000000000000000000000000000000000000000000000000000000000000000000000000000000000000000000000000000000000000

0000  1b 00 20 5a 1f 22 03 83 ff ff 00 00 00 00 09 00   .. Z."..........
0010  01 01 00 19 00 83 01 40 00 00 00 56 83 00 00 00   .......@...V....
0020  00 00 00 00 00 00 00 00 00 00 00 00 00 00 00 00   ................
0030  00 00 00 00 00 00 00 00 00 00 00 00 00 00 00 00   ................
0040  00 00 00 00 00 00 00 00 00 00 00 00 00 00 00 00   ................
0050  00 00 00 00 00 00 00 00 00 00 00                  ...........

No.     Time           Source                Destination           Protocol Length Info
  13010 26.579860      host                  1.25.3                USB      27     URB_INTERRUPT in

Frame 13010: 27 bytes on wire (216 bits), 27 bytes captured (216 bits) on interface \\.\USBPcap1, id 0
USB URB
    [Source: host]
    [Destination: 1.25.3]
    USBPcap pseudoheader length: 27
    IRP ID: 0xffff8303221f5a20
    IRP USBD_STATUS: USBD_STATUS_SUCCESS (0x00000000)
    URB Function: URB_FUNCTION_BULK_OR_INTERRUPT_TRANSFER (0x0009)
    IRP information: 0x00, Direction: FDO -> PDO
        0000 000. = Reserved: 0x00
        .... ...0 = Direction: FDO -> PDO (0x0)
    URB bus id: 1
    Device address: 25
    Endpoint: 0x83, Direction: IN
        1... .... = Direction: IN (1)
        .... 0011 = Endpoint number: 3
    URB transfer type: URB_INTERRUPT (0x01)
    Packet Data Length: 0
    [Response in: 13017]
    [bInterfaceClass: HID (0x03)]

0000  1b 00 20 5a 1f 22 03 83 ff ff 00 00 00 00 09 00   .. Z."..........
0010  00 01 00 19 00 83 01 00 00 00 00                  ...........

No.     Time           Source                Destination           Protocol Length Info
  13011 26.589268      host                  1.25.4                USB      91     URB_INTERRUPT out

Frame 13011: 91 bytes on wire (728 bits), 91 bytes captured (728 bits) on interface \\.\USBPcap1, id 0
USB URB
    [Source: host]
    [Destination: 1.25.4]
    USBPcap pseudoheader length: 27
    IRP ID: 0xffff83030a2c7010
    IRP USBD_STATUS: USBD_STATUS_SUCCESS (0x00000000)
    URB Function: URB_FUNCTION_BULK_OR_INTERRUPT_TRANSFER (0x0009)
    IRP information: 0x00, Direction: FDO -> PDO
        0000 000. = Reserved: 0x00
        .... ...0 = Direction: FDO -> PDO (0x0)
    URB bus id: 1
    Device address: 25
    Endpoint: 0x04, Direction: OUT
        0... .... = Direction: OUT (0)
        .... 0100 = Endpoint number: 4
    URB transfer type: URB_INTERRUPT (0x01)
    Packet Data Length: 64
    [Response in: 13012]
    [bInterfaceClass: HID (0x03)]
HID Data: 568301000000000000d752ff000000000000000000000000d752ff00000000000000000000000000000000000000000000000000000000000000000000000000

0000  1b 00 10 70 2c 0a 03 83 ff ff 00 00 00 00 09 00   ...p,...........
0010  00 01 00 19 00 04 01 40 00 00 00 56 83 01 00 00   .......@...V....
0020  00 00 00 00 d7 52 ff 00 00 00 00 00 00 00 00 00   .....R..........
0030  00 00 00 d7 52 ff 00 00 00 00 00 00 00 00 00 00   ....R...........
0040  00 00 00 00 00 00 00 00 00 00 00 00 00 00 00 00   ................
0050  00 00 00 00 00 00 00 00 00 00 00                  ...........

No.     Time           Source                Destination           Protocol Length Info
  13012 26.589803      1.25.4                host                  USB      27     URB_INTERRUPT out

Frame 13012: 27 bytes on wire (216 bits), 27 bytes captured (216 bits) on interface \\.\USBPcap1, id 0
USB URB
    [Source: 1.25.4]
    [Destination: host]
    USBPcap pseudoheader length: 27
    IRP ID: 0xffff83030a2c7010
    IRP USBD_STATUS: USBD_STATUS_SUCCESS (0x00000000)
    URB Function: URB_FUNCTION_BULK_OR_INTERRUPT_TRANSFER (0x0009)
    IRP information: 0x01, Direction: PDO -> FDO
        0000 000. = Reserved: 0x00
        .... ...1 = Direction: PDO -> FDO (0x1)
    URB bus id: 1
    Device address: 25
    Endpoint: 0x04, Direction: OUT
        0... .... = Direction: OUT (0)
        .... 0100 = Endpoint number: 4
    URB transfer type: URB_INTERRUPT (0x01)
    Packet Data Length: 0
    [Request in: 13011]
    [Time from request: 0.000535000 seconds]
    [bInterfaceClass: HID (0x03)]

0000  1b 00 10 70 2c 0a 03 83 ff ff 00 00 00 00 09 00   ...p,...........
0010  01 01 00 19 00 04 01 00 00 00 00                  ...........

No.     Time           Source                Destination           Protocol Length Info
  13013 26.590815      1.25.3                host                  USB      91     URB_INTERRUPT in

Frame 13013: 91 bytes on wire (728 bits), 91 bytes captured (728 bits) on interface \\.\USBPcap1, id 0
USB URB
    [Source: 1.25.3]
    [Destination: host]
    USBPcap pseudoheader length: 27
    IRP ID: 0xffff83030ee9ea20
    IRP USBD_STATUS: USBD_STATUS_SUCCESS (0x00000000)
    URB Function: URB_FUNCTION_BULK_OR_INTERRUPT_TRANSFER (0x0009)
    IRP information: 0x01, Direction: PDO -> FDO
        0000 000. = Reserved: 0x00
        .... ...1 = Direction: PDO -> FDO (0x1)
    URB bus id: 1
    Device address: 25
    Endpoint: 0x83, Direction: IN
        1... .... = Direction: IN (1)
        .... 0011 = Endpoint number: 3
    URB transfer type: URB_INTERRUPT (0x01)
    Packet Data Length: 64
    [Request in: 13006]
    [Time from request: 0.021975000 seconds]
    [bInterfaceClass: HID (0x03)]
HID Data: 56830100000000000000000000000000000000000000000000000000000000000000000000000000000000000000000000000000000000000000000000000000

0000  1b 00 20 ea e9 0e 03 83 ff ff 00 00 00 00 09 00   .. .............
0010  01 01 00 19 00 83 01 40 00 00 00 56 83 01 00 00   .......@...V....
0020  00 00 00 00 00 00 00 00 00 00 00 00 00 00 00 00   ................
0030  00 00 00 00 00 00 00 00 00 00 00 00 00 00 00 00   ................
0040  00 00 00 00 00 00 00 00 00 00 00 00 00 00 00 00   ................
0050  00 00 00 00 00 00 00 00 00 00 00                  ...........

No.     Time           Source                Destination           Protocol Length Info
  13014 26.590869      host                  1.25.3                USB      27     URB_INTERRUPT in

Frame 13014: 27 bytes on wire (216 bits), 27 bytes captured (216 bits) on interface \\.\USBPcap1, id 0
USB URB
    [Source: host]
    [Destination: 1.25.3]
    USBPcap pseudoheader length: 27
    IRP ID: 0xffff83030ee9ea20
    IRP USBD_STATUS: USBD_STATUS_SUCCESS (0x00000000)
    URB Function: URB_FUNCTION_BULK_OR_INTERRUPT_TRANSFER (0x0009)
    IRP information: 0x00, Direction: FDO -> PDO
        0000 000. = Reserved: 0x00
        .... ...0 = Direction: FDO -> PDO (0x0)
    URB bus id: 1
    Device address: 25
    Endpoint: 0x83, Direction: IN
        1... .... = Direction: IN (1)
        .... 0011 = Endpoint number: 3
    URB transfer type: URB_INTERRUPT (0x01)
    Packet Data Length: 0
    [Response in: 13021]
    [bInterfaceClass: HID (0x03)]

0000  1b 00 20 ea e9 0e 03 83 ff ff 00 00 00 00 09 00   .. .............
0010  00 01 00 19 00 83 01 00 00 00 00                  ...........

No.     Time           Source                Destination           Protocol Length Info
  13015 26.600638      host                  1.25.4                USB      91     URB_INTERRUPT out

Frame 13015: 91 bytes on wire (728 bits), 91 bytes captured (728 bits) on interface \\.\USBPcap1, id 0
USB URB
    [Source: host]
    [Destination: 1.25.4]
    USBPcap pseudoheader length: 27
    IRP ID: 0xffff83030a2c7010
    IRP USBD_STATUS: USBD_STATUS_SUCCESS (0x00000000)
    URB Function: URB_FUNCTION_BULK_OR_INTERRUPT_TRANSFER (0x0009)
    IRP information: 0x00, Direction: FDO -> PDO
        0000 000. = Reserved: 0x00
        .... ...0 = Direction: FDO -> PDO (0x0)
    URB bus id: 1
    Device address: 25
    Endpoint: 0x04, Direction: OUT
        0... .... = Direction: OUT (0)
        .... 0100 = Endpoint number: 4
    URB transfer type: URB_INTERRUPT (0x01)
    Packet Data Length: 64
    [Response in: 13016]
    [bInterfaceClass: HID (0x03)]
HID Data: 41800000000000000000000000000000000000000000000000000000000000000000000000000000000000000000000000000000000000000000000000000000

0000  1b 00 10 70 2c 0a 03 83 ff ff 00 00 00 00 09 00   ...p,...........
0010  00 01 00 19 00 04 01 40 00 00 00 41 80 00 00 00   .......@...A....
0020  00 00 00 00 00 00 00 00 00 00 00 00 00 00 00 00   ................
0030  00 00 00 00 00 00 00 00 00 00 00 00 00 00 00 00   ................
0040  00 00 00 00 00 00 00 00 00 00 00 00 00 00 00 00   ................
0050  00 00 00 00 00 00 00 00 00 00 00                  ...........

No.     Time           Source                Destination           Protocol Length Info
  13016 26.601800      1.25.4                host                  USB      27     URB_INTERRUPT out

Frame 13016: 27 bytes on wire (216 bits), 27 bytes captured (216 bits) on interface \\.\USBPcap1, id 0
USB URB
    [Source: 1.25.4]
    [Destination: host]
    USBPcap pseudoheader length: 27
    IRP ID: 0xffff83030a2c7010
    IRP USBD_STATUS: USBD_STATUS_SUCCESS (0x00000000)
    URB Function: URB_FUNCTION_BULK_OR_INTERRUPT_TRANSFER (0x0009)
    IRP information: 0x01, Direction: PDO -> FDO
        0000 000. = Reserved: 0x00
        .... ...1 = Direction: PDO -> FDO (0x1)
    URB bus id: 1
    Device address: 25
    Endpoint: 0x04, Direction: OUT
        0... .... = Direction: OUT (0)
        .... 0100 = Endpoint number: 4
    URB transfer type: URB_INTERRUPT (0x01)
    Packet Data Length: 0
    [Request in: 13015]
    [Time from request: 0.001162000 seconds]
    [bInterfaceClass: HID (0x03)]

0000  1b 00 10 70 2c 0a 03 83 ff ff 00 00 00 00 09 00   ...p,...........
0010  01 01 00 19 00 04 01 00 00 00 00                  ...........

No.     Time           Source                Destination           Protocol Length Info
  13017 26.602797      1.25.3                host                  USB      91     URB_INTERRUPT in

Frame 13017: 91 bytes on wire (728 bits), 91 bytes captured (728 bits) on interface \\.\USBPcap1, id 0
USB URB
    [Source: 1.25.3]
    [Destination: host]
    USBPcap pseudoheader length: 27
    IRP ID: 0xffff8303221f5a20
    IRP USBD_STATUS: USBD_STATUS_SUCCESS (0x00000000)
    URB Function: URB_FUNCTION_BULK_OR_INTERRUPT_TRANSFER (0x0009)
    IRP information: 0x01, Direction: PDO -> FDO
        0000 000. = Reserved: 0x00
        .... ...1 = Direction: PDO -> FDO (0x1)
    URB bus id: 1
    Device address: 25
    Endpoint: 0x83, Direction: IN
        1... .... = Direction: IN (1)
        .... 0011 = Endpoint number: 3
    URB transfer type: URB_INTERRUPT (0x01)
    Packet Data Length: 64
    [Request in: 13010]
    [Time from request: 0.022937000 seconds]
    [bInterfaceClass: HID (0x03)]
HID Data: 41800000000000000000000000000000000000000000000000000000000000000000000000000000000000000000000000000000000000000000000000000000

0000  1b 00 20 5a 1f 22 03 83 ff ff 00 00 00 00 09 00   .. Z."..........
0010  01 01 00 19 00 83 01 40 00 00 00 41 80 00 00 00   .......@...A....
0020  00 00 00 00 00 00 00 00 00 00 00 00 00 00 00 00   ................
0030  00 00 00 00 00 00 00 00 00 00 00 00 00 00 00 00   ................
0040  00 00 00 00 00 00 00 00 00 00 00 00 00 00 00 00   ................
0050  00 00 00 00 00 00 00 00 00 00 00                  ...........

No.     Time           Source                Destination           Protocol Length Info
  13018 26.602853      host                  1.25.3                USB      27     URB_INTERRUPT in

Frame 13018: 27 bytes on wire (216 bits), 27 bytes captured (216 bits) on interface \\.\USBPcap1, id 0
USB URB
    [Source: host]
    [Destination: 1.25.3]
    USBPcap pseudoheader length: 27
    IRP ID: 0xffff8303221f5a20
    IRP USBD_STATUS: USBD_STATUS_SUCCESS (0x00000000)
    URB Function: URB_FUNCTION_BULK_OR_INTERRUPT_TRANSFER (0x0009)
    IRP information: 0x00, Direction: FDO -> PDO
        0000 000. = Reserved: 0x00
        .... ...0 = Direction: FDO -> PDO (0x0)
    URB bus id: 1
    Device address: 25
    Endpoint: 0x83, Direction: IN
        1... .... = Direction: IN (1)
        .... 0011 = Endpoint number: 3
    URB transfer type: URB_INTERRUPT (0x01)
    Packet Data Length: 0
    [Response in: 13977]
    [bInterfaceClass: HID (0x03)]

0000  1b 00 20 5a 1f 22 03 83 ff ff 00 00 00 00 09 00   .. Z."..........
0010  00 01 00 19 00 83 01 00 00 00 00                  ...........

No.     Time           Source                Destination           Protocol Length Info
  13019 26.611728      host                  1.25.4                USB      91     URB_INTERRUPT out

Frame 13019: 91 bytes on wire (728 bits), 91 bytes captured (728 bits) on interface \\.\USBPcap1, id 0
USB URB
    [Source: host]
    [Destination: 1.25.4]
    USBPcap pseudoheader length: 27
    IRP ID: 0xffff83030d132900
    IRP USBD_STATUS: USBD_STATUS_SUCCESS (0x00000000)
    URB Function: URB_FUNCTION_BULK_OR_INTERRUPT_TRANSFER (0x0009)
    IRP information: 0x00, Direction: FDO -> PDO
        0000 000. = Reserved: 0x00
        .... ...0 = Direction: FDO -> PDO (0x0)
    URB bus id: 1
    Device address: 25
    Endpoint: 0x04, Direction: OUT
        0... .... = Direction: OUT (0)
        .... 0100 = Endpoint number: 4
    URB transfer type: URB_INTERRUPT (0x01)
    Packet Data Length: 64
    [Response in: 13020]
    [bInterfaceClass: HID (0x03)]
HID Data: 51280000ff0000000000000000000000000000000000000000000000000000000000000000000000000000000000000000000000000000000000000000000000

0000  1b 00 00 29 13 0d 03 83 ff ff 00 00 00 00 09 00   ...)............
0010  00 01 00 19 00 04 01 40 00 00 00 51 28 00 00 ff   .......@...Q(...
0020  00 00 00 00 00 00 00 00 00 00 00 00 00 00 00 00   ................
0030  00 00 00 00 00 00 00 00 00 00 00 00 00 00 00 00   ................
0040  00 00 00 00 00 00 00 00 00 00 00 00 00 00 00 00   ................
0050  00 00 00 00 00 00 00 00 00 00 00                  ...........

No.     Time           Source                Destination           Protocol Length Info
  13020 26.612798      1.25.4                host                  USB      27     URB_INTERRUPT out

Frame 13020: 27 bytes on wire (216 bits), 27 bytes captured (216 bits) on interface \\.\USBPcap1, id 0
USB URB
    [Source: 1.25.4]
    [Destination: host]
    USBPcap pseudoheader length: 27
    IRP ID: 0xffff83030d132900
    IRP USBD_STATUS: USBD_STATUS_SUCCESS (0x00000000)
    URB Function: URB_FUNCTION_BULK_OR_INTERRUPT_TRANSFER (0x0009)
    IRP information: 0x01, Direction: PDO -> FDO
        0000 000. = Reserved: 0x00
        .... ...1 = Direction: PDO -> FDO (0x1)
    URB bus id: 1
    Device address: 25
    Endpoint: 0x04, Direction: OUT
        0... .... = Direction: OUT (0)
        .... 0100 = Endpoint number: 4
    URB transfer type: URB_INTERRUPT (0x01)
    Packet Data Length: 0
    [Request in: 13019]
    [Time from request: 0.001070000 seconds]
    [bInterfaceClass: HID (0x03)]

0000  1b 00 00 29 13 0d 03 83 ff ff 00 00 00 00 09 00   ...)............
0010  01 01 00 19 00 04 01 00 00 00 00                  ...........

No.     Time           Source                Destination           Protocol Length Info
  13021 26.613793      1.25.3                host                  USB      91     URB_INTERRUPT in

Frame 13021: 91 bytes on wire (728 bits), 91 bytes captured (728 bits) on interface \\.\USBPcap1, id 0
USB URB
    [Source: 1.25.3]
    [Destination: host]
    USBPcap pseudoheader length: 27
    IRP ID: 0xffff83030ee9ea20
    IRP USBD_STATUS: USBD_STATUS_SUCCESS (0x00000000)
    URB Function: URB_FUNCTION_BULK_OR_INTERRUPT_TRANSFER (0x0009)
    IRP information: 0x01, Direction: PDO -> FDO
        0000 000. = Reserved: 0x00
        .... ...1 = Direction: PDO -> FDO (0x1)
    URB bus id: 1
    Device address: 25
    Endpoint: 0x83, Direction: IN
        1... .... = Direction: IN (1)
        .... 0011 = Endpoint number: 3
    URB transfer type: URB_INTERRUPT (0x01)
    Packet Data Length: 64
    [Request in: 13014]
    [Time from request: 0.022924000 seconds]
    [bInterfaceClass: HID (0x03)]
HID Data: 51280000000000000000000000000000000000000000000000000000000000000000000000000000000000000000000000000000000000000000000000000000

0000  1b 00 20 ea e9 0e 03 83 ff ff 00 00 00 00 09 00   .. .............
0010  01 01 00 19 00 83 01 40 00 00 00 51 28 00 00 00   .......@...Q(...
0020  00 00 00 00 00 00 00 00 00 00 00 00 00 00 00 00   ................
0030  00 00 00 00 00 00 00 00 00 00 00 00 00 00 00 00   ................
0040  00 00 00 00 00 00 00 00 00 00 00 00 00 00 00 00   ................
0050  00 00 00 00 00 00 00 00 00 00 00                  ...........

No.     Time           Source                Destination           Protocol Length Info
  13022 26.613839      host                  1.25.3                USB      27     URB_INTERRUPT in

Frame 13022: 27 bytes on wire (216 bits), 27 bytes captured (216 bits) on interface \\.\USBPcap1, id 0
USB URB
    [Source: host]
    [Destination: 1.25.3]
    USBPcap pseudoheader length: 27
    IRP ID: 0xffff83030ee9ea20
    IRP USBD_STATUS: USBD_STATUS_SUCCESS (0x00000000)
    URB Function: URB_FUNCTION_BULK_OR_INTERRUPT_TRANSFER (0x0009)
    IRP information: 0x00, Direction: FDO -> PDO
        0000 000. = Reserved: 0x00
        .... ...0 = Direction: FDO -> PDO (0x0)
    URB bus id: 1
    Device address: 25
    Endpoint: 0x83, Direction: IN
        1... .... = Direction: IN (1)
        .... 0011 = Endpoint number: 3
    URB transfer type: URB_INTERRUPT (0x01)
    Packet Data Length: 0
    [Response in: 13981]
    [bInterfaceClass: HID (0x03)]

0000  1b 00 20 ea e9 0e 03 83 ff ff 00 00 00 00 09 00   .. .............
0010  00 01 00 19 00 83 01 00 00 00 00                  ...........

No.     Time           Source                Destination           Protocol Length Info
  13975 28.039542      host                  1.25.4                USB      91     URB_INTERRUPT out

Frame 13975: 91 bytes on wire (728 bits), 91 bytes captured (728 bits) on interface \\.\USBPcap1, id 0
USB URB
    [Source: host]
    [Destination: 1.25.4]
    USBPcap pseudoheader length: 27
    IRP ID: 0xffff83030a2c7010
    IRP USBD_STATUS: USBD_STATUS_SUCCESS (0x00000000)
    URB Function: URB_FUNCTION_BULK_OR_INTERRUPT_TRANSFER (0x0009)
    IRP information: 0x00, Direction: FDO -> PDO
        0000 000. = Reserved: 0x00
        .... ...0 = Direction: FDO -> PDO (0x0)
    URB bus id: 1
    Device address: 25
    Endpoint: 0x04, Direction: OUT
        0... .... = Direction: OUT (0)
        .... 0100 = Endpoint number: 4
    URB transfer type: URB_INTERRUPT (0x01)
    Packet Data Length: 64
    [Response in: 13976]
    [bInterfaceClass: HID (0x03)]
HID Data: 568100000100000002000000bbbbbbbb000000000000000000000000000000000000000000000000000000000000000000000000000000000000000000000000

0000  1b 00 10 70 2c 0a 03 83 ff ff 00 00 00 00 09 00   ...p,...........
0010  00 01 00 19 00 04 01 40 00 00 00 56 81 00 00 01   .......@...V....
0020  00 00 00 02 00 00 00 bb bb bb bb 00 00 00 00 00   ................
0030  00 00 00 00 00 00 00 00 00 00 00 00 00 00 00 00   ................
0040  00 00 00 00 00 00 00 00 00 00 00 00 00 00 00 00   ................
0050  00 00 00 00 00 00 00 00 00 00 00                  ...........

No.     Time           Source                Destination           Protocol Length Info
  13976 28.040789      1.25.4                host                  USB      27     URB_INTERRUPT out

Frame 13976: 27 bytes on wire (216 bits), 27 bytes captured (216 bits) on interface \\.\USBPcap1, id 0
USB URB
    [Source: 1.25.4]
    [Destination: host]
    USBPcap pseudoheader length: 27
    IRP ID: 0xffff83030a2c7010
    IRP USBD_STATUS: USBD_STATUS_SUCCESS (0x00000000)
    URB Function: URB_FUNCTION_BULK_OR_INTERRUPT_TRANSFER (0x0009)
    IRP information: 0x01, Direction: PDO -> FDO
        0000 000. = Reserved: 0x00
        .... ...1 = Direction: PDO -> FDO (0x1)
    URB bus id: 1
    Device address: 25
    Endpoint: 0x04, Direction: OUT
        0... .... = Direction: OUT (0)
        .... 0100 = Endpoint number: 4
    URB transfer type: URB_INTERRUPT (0x01)
    Packet Data Length: 0
    [Request in: 13975]
    [Time from request: 0.001247000 seconds]
    [bInterfaceClass: HID (0x03)]

0000  1b 00 10 70 2c 0a 03 83 ff ff 00 00 00 00 09 00   ...p,...........
0010  01 01 00 19 00 04 01 00 00 00 00                  ...........

No.     Time           Source                Destination           Protocol Length Info
  13977 28.041786      1.25.3                host                  USB      91     URB_INTERRUPT in

Frame 13977: 91 bytes on wire (728 bits), 91 bytes captured (728 bits) on interface \\.\USBPcap1, id 0
USB URB
    [Source: 1.25.3]
    [Destination: host]
    USBPcap pseudoheader length: 27
    IRP ID: 0xffff8303221f5a20
    IRP USBD_STATUS: USBD_STATUS_SUCCESS (0x00000000)
    URB Function: URB_FUNCTION_BULK_OR_INTERRUPT_TRANSFER (0x0009)
    IRP information: 0x01, Direction: PDO -> FDO
        0000 000. = Reserved: 0x00
        .... ...1 = Direction: PDO -> FDO (0x1)
    URB bus id: 1
    Device address: 25
    Endpoint: 0x83, Direction: IN
        1... .... = Direction: IN (1)
        .... 0011 = Endpoint number: 3
    URB transfer type: URB_INTERRUPT (0x01)
    Packet Data Length: 64
    [Request in: 13018]
    [Time from request: 1.438933000 seconds]
    [bInterfaceClass: HID (0x03)]
HID Data: 56810000000000000000000000000000000000000000000000000000000000000000000000000000000000000000000000000000000000000000000000000000

0000  1b 00 20 5a 1f 22 03 83 ff ff 00 00 00 00 09 00   .. Z."..........
0010  01 01 00 19 00 83 01 40 00 00 00 56 81 00 00 00   .......@...V....
0020  00 00 00 00 00 00 00 00 00 00 00 00 00 00 00 00   ................
0030  00 00 00 00 00 00 00 00 00 00 00 00 00 00 00 00   ................
0040  00 00 00 00 00 00 00 00 00 00 00 00 00 00 00 00   ................
0050  00 00 00 00 00 00 00 00 00 00 00                  ...........

No.     Time           Source                Destination           Protocol Length Info
  13978 28.041866      host                  1.25.3                USB      27     URB_INTERRUPT in

Frame 13978: 27 bytes on wire (216 bits), 27 bytes captured (216 bits) on interface \\.\USBPcap1, id 0
USB URB
    [Source: host]
    [Destination: 1.25.3]
    USBPcap pseudoheader length: 27
    IRP ID: 0xffff8303221f5a20
    IRP USBD_STATUS: USBD_STATUS_SUCCESS (0x00000000)
    URB Function: URB_FUNCTION_BULK_OR_INTERRUPT_TRANSFER (0x0009)
    IRP information: 0x00, Direction: FDO -> PDO
        0000 000. = Reserved: 0x00
        .... ...0 = Direction: FDO -> PDO (0x0)
    URB bus id: 1
    Device address: 25
    Endpoint: 0x83, Direction: IN
        1... .... = Direction: IN (1)
        .... 0011 = Endpoint number: 3
    URB transfer type: URB_INTERRUPT (0x01)
    Packet Data Length: 0
    [Response in: 13985]
    [bInterfaceClass: HID (0x03)]

0000  1b 00 20 5a 1f 22 03 83 ff ff 00 00 00 00 09 00   .. Z."..........
0010  00 01 00 19 00 83 01 00 00 00 00                  ...........

No.     Time           Source                Destination           Protocol Length Info
  13979 28.050015      host                  1.25.4                USB      91     URB_INTERRUPT out

Frame 13979: 91 bytes on wire (728 bits), 91 bytes captured (728 bits) on interface \\.\USBPcap1, id 0
USB URB
    [Source: host]
    [Destination: 1.25.4]
    USBPcap pseudoheader length: 27
    IRP ID: 0xffff83030a2c7010
    IRP USBD_STATUS: USBD_STATUS_SUCCESS (0x00000000)
    URB Function: URB_FUNCTION_BULK_OR_INTERRUPT_TRANSFER (0x0009)
    IRP information: 0x00, Direction: FDO -> PDO
        0000 000. = Reserved: 0x00
        .... ...0 = Direction: FDO -> PDO (0x0)
    URB bus id: 1
    Device address: 25
    Endpoint: 0x04, Direction: OUT
        0... .... = Direction: OUT (0)
        .... 0100 = Endpoint number: 4
    URB transfer type: URB_INTERRUPT (0x01)
    Packet Data Length: 64
    [Response in: 13980]
    [bInterfaceClass: HID (0x03)]
HID Data: 568300000100000080010000ff0000000000ffff00000000d752ffd752ff000000000000000000d752ff000000000000000000000000d752ff00000000000000

0000  1b 00 10 70 2c 0a 03 83 ff ff 00 00 00 00 09 00   ...p,...........
0010  00 01 00 19 00 04 01 40 00 00 00 56 83 00 00 01   .......@...V....
0020  00 00 00 80 01 00 00 ff 00 00 00 00 00 ff ff 00   ................
0030  00 00 00 d7 52 ff d7 52 ff 00 00 00 00 00 00 00   ....R..R........
0040  00 00 d7 52 ff 00 00 00 00 00 00 00 00 00 00 00   ...R............
0050  00 d7 52 ff 00 00 00 00 00 00 00                  ..R........

No.     Time           Source                Destination           Protocol Length Info
  13980 28.050803      1.25.4                host                  USB      27     URB_INTERRUPT out

Frame 13980: 27 bytes on wire (216 bits), 27 bytes captured (216 bits) on interface \\.\USBPcap1, id 0
USB URB
    [Source: 1.25.4]
    [Destination: host]
    USBPcap pseudoheader length: 27
    IRP ID: 0xffff83030a2c7010
    IRP USBD_STATUS: USBD_STATUS_SUCCESS (0x00000000)
    URB Function: URB_FUNCTION_BULK_OR_INTERRUPT_TRANSFER (0x0009)
    IRP information: 0x01, Direction: PDO -> FDO
        0000 000. = Reserved: 0x00
        .... ...1 = Direction: PDO -> FDO (0x1)
    URB bus id: 1
    Device address: 25
    Endpoint: 0x04, Direction: OUT
        0... .... = Direction: OUT (0)
        .... 0100 = Endpoint number: 4
    URB transfer type: URB_INTERRUPT (0x01)
    Packet Data Length: 0
    [Request in: 13979]
    [Time from request: 0.000788000 seconds]
    [bInterfaceClass: HID (0x03)]

0000  1b 00 10 70 2c 0a 03 83 ff ff 00 00 00 00 09 00   ...p,...........
0010  01 01 00 19 00 04 01 00 00 00 00                  ...........

No.     Time           Source                Destination           Protocol Length Info
  13981 28.051792      1.25.3                host                  USB      91     URB_INTERRUPT in

Frame 13981: 91 bytes on wire (728 bits), 91 bytes captured (728 bits) on interface \\.\USBPcap1, id 0
USB URB
    [Source: 1.25.3]
    [Destination: host]
    USBPcap pseudoheader length: 27
    IRP ID: 0xffff83030ee9ea20
    IRP USBD_STATUS: USBD_STATUS_SUCCESS (0x00000000)
    URB Function: URB_FUNCTION_BULK_OR_INTERRUPT_TRANSFER (0x0009)
    IRP information: 0x01, Direction: PDO -> FDO
        0000 000. = Reserved: 0x00
        .... ...1 = Direction: PDO -> FDO (0x1)
    URB bus id: 1
    Device address: 25
    Endpoint: 0x83, Direction: IN
        1... .... = Direction: IN (1)
        .... 0011 = Endpoint number: 3
    URB transfer type: URB_INTERRUPT (0x01)
    Packet Data Length: 64
    [Request in: 13022]
    [Time from request: 1.437953000 seconds]
    [bInterfaceClass: HID (0x03)]
HID Data: 56830000000000000000000000000000000000000000000000000000000000000000000000000000000000000000000000000000000000000000000000000000

0000  1b 00 20 ea e9 0e 03 83 ff ff 00 00 00 00 09 00   .. .............
0010  01 01 00 19 00 83 01 40 00 00 00 56 83 00 00 00   .......@...V....
0020  00 00 00 00 00 00 00 00 00 00 00 00 00 00 00 00   ................
0030  00 00 00 00 00 00 00 00 00 00 00 00 00 00 00 00   ................
0040  00 00 00 00 00 00 00 00 00 00 00 00 00 00 00 00   ................
0050  00 00 00 00 00 00 00 00 00 00 00                  ...........

No.     Time           Source                Destination           Protocol Length Info
  13982 28.051831      host                  1.25.3                USB      27     URB_INTERRUPT in

Frame 13982: 27 bytes on wire (216 bits), 27 bytes captured (216 bits) on interface \\.\USBPcap1, id 0
USB URB
    [Source: host]
    [Destination: 1.25.3]
    USBPcap pseudoheader length: 27
    IRP ID: 0xffff83030ee9ea20
    IRP USBD_STATUS: USBD_STATUS_SUCCESS (0x00000000)
    URB Function: URB_FUNCTION_BULK_OR_INTERRUPT_TRANSFER (0x0009)
    IRP information: 0x00, Direction: FDO -> PDO
        0000 000. = Reserved: 0x00
        .... ...0 = Direction: FDO -> PDO (0x0)
    URB bus id: 1
    Device address: 25
    Endpoint: 0x83, Direction: IN
        1... .... = Direction: IN (1)
        .... 0011 = Endpoint number: 3
    URB transfer type: URB_INTERRUPT (0x01)
    Packet Data Length: 0
    [Response in: 13989]
    [bInterfaceClass: HID (0x03)]

0000  1b 00 20 ea e9 0e 03 83 ff ff 00 00 00 00 09 00   .. .............
0010  00 01 00 19 00 83 01 00 00 00 00                  ...........

No.     Time           Source                Destination           Protocol Length Info
  13983 28.058378      host                  1.25.4                USB      91     URB_INTERRUPT out

Frame 13983: 91 bytes on wire (728 bits), 91 bytes captured (728 bits) on interface \\.\USBPcap1, id 0
USB URB
    [Source: host]
    [Destination: 1.25.4]
    USBPcap pseudoheader length: 27
    IRP ID: 0xffff83030a2c7010
    IRP USBD_STATUS: USBD_STATUS_SUCCESS (0x00000000)
    URB Function: URB_FUNCTION_BULK_OR_INTERRUPT_TRANSFER (0x0009)
    IRP information: 0x00, Direction: FDO -> PDO
        0000 000. = Reserved: 0x00
        .... ...0 = Direction: FDO -> PDO (0x0)
    URB bus id: 1
    Device address: 25
    Endpoint: 0x04, Direction: OUT
        0... .... = Direction: OUT (0)
        .... 0100 = Endpoint number: 4
    URB transfer type: URB_INTERRUPT (0x01)
    Packet Data Length: 64
    [Response in: 13984]
    [bInterfaceClass: HID (0x03)]
HID Data: 568301000000000000d752ff000000000000000000000000d752ff00000000000000000000000000000000000000000000000000000000000000000000000000

0000  1b 00 10 70 2c 0a 03 83 ff ff 00 00 00 00 09 00   ...p,...........
0010  00 01 00 19 00 04 01 40 00 00 00 56 83 01 00 00   .......@...V....
0020  00 00 00 00 d7 52 ff 00 00 00 00 00 00 00 00 00   .....R..........
0030  00 00 00 d7 52 ff 00 00 00 00 00 00 00 00 00 00   ....R...........
0040  00 00 00 00 00 00 00 00 00 00 00 00 00 00 00 00   ................
0050  00 00 00 00 00 00 00 00 00 00 00                  ...........

No.     Time           Source                Destination           Protocol Length Info
  13984 28.058789      1.25.4                host                  USB      27     URB_INTERRUPT out

Frame 13984: 27 bytes on wire (216 bits), 27 bytes captured (216 bits) on interface \\.\USBPcap1, id 0
USB URB
    [Source: 1.25.4]
    [Destination: host]
    USBPcap pseudoheader length: 27
    IRP ID: 0xffff83030a2c7010
    IRP USBD_STATUS: USBD_STATUS_SUCCESS (0x00000000)
    URB Function: URB_FUNCTION_BULK_OR_INTERRUPT_TRANSFER (0x0009)
    IRP information: 0x01, Direction: PDO -> FDO
        0000 000. = Reserved: 0x00
        .... ...1 = Direction: PDO -> FDO (0x1)
    URB bus id: 1
    Device address: 25
    Endpoint: 0x04, Direction: OUT
        0... .... = Direction: OUT (0)
        .... 0100 = Endpoint number: 4
    URB transfer type: URB_INTERRUPT (0x01)
    Packet Data Length: 0
    [Request in: 13983]
    [Time from request: 0.000411000 seconds]
    [bInterfaceClass: HID (0x03)]

0000  1b 00 10 70 2c 0a 03 83 ff ff 00 00 00 00 09 00   ...p,...........
0010  01 01 00 19 00 04 01 00 00 00 00                  ...........

No.     Time           Source                Destination           Protocol Length Info
  13985 28.059799      1.25.3                host                  USB      91     URB_INTERRUPT in

Frame 13985: 91 bytes on wire (728 bits), 91 bytes captured (728 bits) on interface \\.\USBPcap1, id 0
USB URB
    [Source: 1.25.3]
    [Destination: host]
    USBPcap pseudoheader length: 27
    IRP ID: 0xffff8303221f5a20
    IRP USBD_STATUS: USBD_STATUS_SUCCESS (0x00000000)
    URB Function: URB_FUNCTION_BULK_OR_INTERRUPT_TRANSFER (0x0009)
    IRP information: 0x01, Direction: PDO -> FDO
        0000 000. = Reserved: 0x00
        .... ...1 = Direction: PDO -> FDO (0x1)
    URB bus id: 1
    Device address: 25
    Endpoint: 0x83, Direction: IN
        1... .... = Direction: IN (1)
        .... 0011 = Endpoint number: 3
    URB transfer type: URB_INTERRUPT (0x01)
    Packet Data Length: 64
    [Request in: 13978]
    [Time from request: 0.017933000 seconds]
    [bInterfaceClass: HID (0x03)]
HID Data: 56830100000000000000000000000000000000000000000000000000000000000000000000000000000000000000000000000000000000000000000000000000

0000  1b 00 20 5a 1f 22 03 83 ff ff 00 00 00 00 09 00   .. Z."..........
0010  01 01 00 19 00 83 01 40 00 00 00 56 83 01 00 00   .......@...V....
0020  00 00 00 00 00 00 00 00 00 00 00 00 00 00 00 00   ................
0030  00 00 00 00 00 00 00 00 00 00 00 00 00 00 00 00   ................
0040  00 00 00 00 00 00 00 00 00 00 00 00 00 00 00 00   ................
0050  00 00 00 00 00 00 00 00 00 00 00                  ...........

No.     Time           Source                Destination           Protocol Length Info
  13986 28.059858      host                  1.25.3                USB      27     URB_INTERRUPT in

Frame 13986: 27 bytes on wire (216 bits), 27 bytes captured (216 bits) on interface \\.\USBPcap1, id 0
USB URB
    [Source: host]
    [Destination: 1.25.3]
    USBPcap pseudoheader length: 27
    IRP ID: 0xffff8303221f5a20
    IRP USBD_STATUS: USBD_STATUS_SUCCESS (0x00000000)
    URB Function: URB_FUNCTION_BULK_OR_INTERRUPT_TRANSFER (0x0009)
    IRP information: 0x00, Direction: FDO -> PDO
        0000 000. = Reserved: 0x00
        .... ...0 = Direction: FDO -> PDO (0x0)
    URB bus id: 1
    Device address: 25
    Endpoint: 0x83, Direction: IN
        1... .... = Direction: IN (1)
        .... 0011 = Endpoint number: 3
    URB transfer type: URB_INTERRUPT (0x01)
    Packet Data Length: 0
    [Response in: 13993]
    [bInterfaceClass: HID (0x03)]

0000  1b 00 20 5a 1f 22 03 83 ff ff 00 00 00 00 09 00   .. Z."..........
0010  00 01 00 19 00 83 01 00 00 00 00                  ...........

No.     Time           Source                Destination           Protocol Length Info
  13987 28.067860      host                  1.25.4                USB      91     URB_INTERRUPT out

Frame 13987: 91 bytes on wire (728 bits), 91 bytes captured (728 bits) on interface \\.\USBPcap1, id 0
USB URB
    [Source: host]
    [Destination: 1.25.4]
    USBPcap pseudoheader length: 27
    IRP ID: 0xffff83030a2c7010
    IRP USBD_STATUS: USBD_STATUS_SUCCESS (0x00000000)
    URB Function: URB_FUNCTION_BULK_OR_INTERRUPT_TRANSFER (0x0009)
    IRP information: 0x00, Direction: FDO -> PDO
        0000 000. = Reserved: 0x00
        .... ...0 = Direction: FDO -> PDO (0x0)
    URB bus id: 1
    Device address: 25
    Endpoint: 0x04, Direction: OUT
        0... .... = Direction: OUT (0)
        .... 0100 = Endpoint number: 4
    URB transfer type: URB_INTERRUPT (0x01)
    Packet Data Length: 64
    [Response in: 13988]
    [bInterfaceClass: HID (0x03)]
HID Data: 41800000000000000000000000000000000000000000000000000000000000000000000000000000000000000000000000000000000000000000000000000000

0000  1b 00 10 70 2c 0a 03 83 ff ff 00 00 00 00 09 00   ...p,...........
0010  00 01 00 19 00 04 01 40 00 00 00 41 80 00 00 00   .......@...A....
0020  00 00 00 00 00 00 00 00 00 00 00 00 00 00 00 00   ................
0030  00 00 00 00 00 00 00 00 00 00 00 00 00 00 00 00   ................
0040  00 00 00 00 00 00 00 00 00 00 00 00 00 00 00 00   ................
0050  00 00 00 00 00 00 00 00 00 00 00                  ...........

No.     Time           Source                Destination           Protocol Length Info
  13988 28.068806      1.25.4                host                  USB      27     URB_INTERRUPT out

Frame 13988: 27 bytes on wire (216 bits), 27 bytes captured (216 bits) on interface \\.\USBPcap1, id 0
USB URB
    [Source: 1.25.4]
    [Destination: host]
    USBPcap pseudoheader length: 27
    IRP ID: 0xffff83030a2c7010
    IRP USBD_STATUS: USBD_STATUS_SUCCESS (0x00000000)
    URB Function: URB_FUNCTION_BULK_OR_INTERRUPT_TRANSFER (0x0009)
    IRP information: 0x01, Direction: PDO -> FDO
        0000 000. = Reserved: 0x00
        .... ...1 = Direction: PDO -> FDO (0x1)
    URB bus id: 1
    Device address: 25
    Endpoint: 0x04, Direction: OUT
        0... .... = Direction: OUT (0)
        .... 0100 = Endpoint number: 4
    URB transfer type: URB_INTERRUPT (0x01)
    Packet Data Length: 0
    [Request in: 13987]
    [Time from request: 0.000946000 seconds]
    [bInterfaceClass: HID (0x03)]

0000  1b 00 10 70 2c 0a 03 83 ff ff 00 00 00 00 09 00   ...p,...........
0010  01 01 00 19 00 04 01 00 00 00 00                  ...........

No.     Time           Source                Destination           Protocol Length Info
  13989 28.069808      1.25.3                host                  USB      91     URB_INTERRUPT in

Frame 13989: 91 bytes on wire (728 bits), 91 bytes captured (728 bits) on interface \\.\USBPcap1, id 0
USB URB
    [Source: 1.25.3]
    [Destination: host]
    USBPcap pseudoheader length: 27
    IRP ID: 0xffff83030ee9ea20
    IRP USBD_STATUS: USBD_STATUS_SUCCESS (0x00000000)
    URB Function: URB_FUNCTION_BULK_OR_INTERRUPT_TRANSFER (0x0009)
    IRP information: 0x01, Direction: PDO -> FDO
        0000 000. = Reserved: 0x00
        .... ...1 = Direction: PDO -> FDO (0x1)
    URB bus id: 1
    Device address: 25
    Endpoint: 0x83, Direction: IN
        1... .... = Direction: IN (1)
        .... 0011 = Endpoint number: 3
    URB transfer type: URB_INTERRUPT (0x01)
    Packet Data Length: 64
    [Request in: 13982]
    [Time from request: 0.017977000 seconds]
    [bInterfaceClass: HID (0x03)]
HID Data: 41800000000000000000000000000000000000000000000000000000000000000000000000000000000000000000000000000000000000000000000000000000

0000  1b 00 20 ea e9 0e 03 83 ff ff 00 00 00 00 09 00   .. .............
0010  01 01 00 19 00 83 01 40 00 00 00 41 80 00 00 00   .......@...A....
0020  00 00 00 00 00 00 00 00 00 00 00 00 00 00 00 00   ................
0030  00 00 00 00 00 00 00 00 00 00 00 00 00 00 00 00   ................
0040  00 00 00 00 00 00 00 00 00 00 00 00 00 00 00 00   ................
0050  00 00 00 00 00 00 00 00 00 00 00                  ...........

No.     Time           Source                Destination           Protocol Length Info
  13990 28.069881      host                  1.25.3                USB      27     URB_INTERRUPT in

Frame 13990: 27 bytes on wire (216 bits), 27 bytes captured (216 bits) on interface \\.\USBPcap1, id 0
USB URB
    [Source: host]
    [Destination: 1.25.3]
    USBPcap pseudoheader length: 27
    IRP ID: 0xffff83030ee9ea20
    IRP USBD_STATUS: USBD_STATUS_SUCCESS (0x00000000)
    URB Function: URB_FUNCTION_BULK_OR_INTERRUPT_TRANSFER (0x0009)
    IRP information: 0x00, Direction: FDO -> PDO
        0000 000. = Reserved: 0x00
        .... ...0 = Direction: FDO -> PDO (0x0)
    URB bus id: 1
    Device address: 25
    Endpoint: 0x83, Direction: IN
        1... .... = Direction: IN (1)
        .... 0011 = Endpoint number: 3
    URB transfer type: URB_INTERRUPT (0x01)
    Packet Data Length: 0
    [bInterfaceClass: HID (0x03)]

0000  1b 00 20 ea e9 0e 03 83 ff ff 00 00 00 00 09 00   .. .............
0010  00 01 00 19 00 83 01 00 00 00 00                  ...........

No.     Time           Source                Destination           Protocol Length Info
  13991 28.078873      host                  1.25.4                USB      91     URB_INTERRUPT out

Frame 13991: 91 bytes on wire (728 bits), 91 bytes captured (728 bits) on interface \\.\USBPcap1, id 0
USB URB
    [Source: host]
    [Destination: 1.25.4]
    USBPcap pseudoheader length: 27
    IRP ID: 0xffff83030a2c7010
    IRP USBD_STATUS: USBD_STATUS_SUCCESS (0x00000000)
    URB Function: URB_FUNCTION_BULK_OR_INTERRUPT_TRANSFER (0x0009)
    IRP information: 0x00, Direction: FDO -> PDO
        0000 000. = Reserved: 0x00
        .... ...0 = Direction: FDO -> PDO (0x0)
    URB bus id: 1
    Device address: 25
    Endpoint: 0x04, Direction: OUT
        0... .... = Direction: OUT (0)
        .... 0100 = Endpoint number: 4
    URB transfer type: URB_INTERRUPT (0x01)
    Packet Data Length: 64
    [Response in: 13992]
    [bInterfaceClass: HID (0x03)]
HID Data: 51280000ff0000000000000000000000000000000000000000000000000000000000000000000000000000000000000000000000000000000000000000000000

0000  1b 00 10 70 2c 0a 03 83 ff ff 00 00 00 00 09 00   ...p,...........
0010  00 01 00 19 00 04 01 40 00 00 00 51 28 00 00 ff   .......@...Q(...
0020  00 00 00 00 00 00 00 00 00 00 00 00 00 00 00 00   ................
0030  00 00 00 00 00 00 00 00 00 00 00 00 00 00 00 00   ................
0040  00 00 00 00 00 00 00 00 00 00 00 00 00 00 00 00   ................
0050  00 00 00 00 00 00 00 00 00 00 00                  ...........

No.     Time           Source                Destination           Protocol Length Info
  13992 28.079801      1.25.4                host                  USB      27     URB_INTERRUPT out

Frame 13992: 27 bytes on wire (216 bits), 27 bytes captured (216 bits) on interface \\.\USBPcap1, id 0
USB URB
    [Source: 1.25.4]
    [Destination: host]
    USBPcap pseudoheader length: 27
    IRP ID: 0xffff83030a2c7010
    IRP USBD_STATUS: USBD_STATUS_SUCCESS (0x00000000)
    URB Function: URB_FUNCTION_BULK_OR_INTERRUPT_TRANSFER (0x0009)
    IRP information: 0x01, Direction: PDO -> FDO
        0000 000. = Reserved: 0x00
        .... ...1 = Direction: PDO -> FDO (0x1)
    URB bus id: 1
    Device address: 25
    Endpoint: 0x04, Direction: OUT
        0... .... = Direction: OUT (0)
        .... 0100 = Endpoint number: 4
    URB transfer type: URB_INTERRUPT (0x01)
    Packet Data Length: 0
    [Request in: 13991]
    [Time from request: 0.000928000 seconds]
    [bInterfaceClass: HID (0x03)]

0000  1b 00 10 70 2c 0a 03 83 ff ff 00 00 00 00 09 00   ...p,...........
0010  01 01 00 19 00 04 01 00 00 00 00                  ...........

No.     Time           Source                Destination           Protocol Length Info
  13993 28.080780      1.25.3                host                  USB      91     URB_INTERRUPT in

Frame 13993: 91 bytes on wire (728 bits), 91 bytes captured (728 bits) on interface \\.\USBPcap1, id 0
USB URB
    [Source: 1.25.3]
    [Destination: host]
    USBPcap pseudoheader length: 27
    IRP ID: 0xffff8303221f5a20
    IRP USBD_STATUS: USBD_STATUS_SUCCESS (0x00000000)
    URB Function: URB_FUNCTION_BULK_OR_INTERRUPT_TRANSFER (0x0009)
    IRP information: 0x01, Direction: PDO -> FDO
        0000 000. = Reserved: 0x00
        .... ...1 = Direction: PDO -> FDO (0x1)
    URB bus id: 1
    Device address: 25
    Endpoint: 0x83, Direction: IN
        1... .... = Direction: IN (1)
        .... 0011 = Endpoint number: 3
    URB transfer type: URB_INTERRUPT (0x01)
    Packet Data Length: 64
    [Request in: 13986]
    [Time from request: 0.020922000 seconds]
    [bInterfaceClass: HID (0x03)]
HID Data: 51280000000000000000000000000000000000000000000000000000000000000000000000000000000000000000000000000000000000000000000000000000

0000  1b 00 20 5a 1f 22 03 83 ff ff 00 00 00 00 09 00   .. Z."..........
0010  01 01 00 19 00 83 01 40 00 00 00 51 28 00 00 00   .......@...Q(...
0020  00 00 00 00 00 00 00 00 00 00 00 00 00 00 00 00   ................
0030  00 00 00 00 00 00 00 00 00 00 00 00 00 00 00 00   ................
0040  00 00 00 00 00 00 00 00 00 00 00 00 00 00 00 00   ................
0050  00 00 00 00 00 00 00 00 00 00 00                  ...........

No.     Time           Source                Destination           Protocol Length Info
  13994 28.080829      host                  1.25.3                USB      27     URB_INTERRUPT in

Frame 13994: 27 bytes on wire (216 bits), 27 bytes captured (216 bits) on interface \\.\USBPcap1, id 0
USB URB
    [Source: host]
    [Destination: 1.25.3]
    USBPcap pseudoheader length: 27
    IRP ID: 0xffff8303221f5a20
    IRP USBD_STATUS: USBD_STATUS_SUCCESS (0x00000000)
    URB Function: URB_FUNCTION_BULK_OR_INTERRUPT_TRANSFER (0x0009)
    IRP information: 0x00, Direction: FDO -> PDO
        0000 000. = Reserved: 0x00
        .... ...0 = Direction: FDO -> PDO (0x0)
    URB bus id: 1
    Device address: 25
    Endpoint: 0x83, Direction: IN
        1... .... = Direction: IN (1)
        .... 0011 = Endpoint number: 3
    URB transfer type: URB_INTERRUPT (0x01)
    Packet Data Length: 0
    [bInterfaceClass: HID (0x03)]

0000  1b 00 20 5a 1f 22 03 83 ff ff 00 00 00 00 09 00   .. Z."..........
0010  00 01 00 19 00 83 01 00 00 00 00                  ...........
